category,date,title,url
Hearings,03/17/2022,"Hearing on ""The Future of Medicine: Legislation to Encourage Innovation and Improve Oversight""",https://energycommerce.house.gov/committee-activity/hearings/hearing-on-the-future-of-medicine-legislation-to-encourage-innovation
Press Release,"Mar 17, 2022",Pallone Opening Remarks at Public Health Legislative Hearing,https://energycommerce.house.gov/newsroom/press-releases/pallone-opening-remarks-at-public-health-legislative-hearing
Press Release,"Mar 16, 2022",Pallone Asks Oil Company Executives to Testify and Answer for Rising Gas Prices on April 6,https://energycommerce.house.gov/newsroom/press-releases/pallone-asks-oil-company-executives-to-testify-and-answer-for-rising-gas
Hearings,03/16/2022,"Hearing on ""5G and Beyond: Exploring the Next Wireless Frontier""",https://energycommerce.house.gov/committee-activity/hearings/hearing-on-5g-and-beyond-exploring-the-next-wireless-frontier
Press Release,"Mar 16, 2022",Pallone Opening Remarks at Hearing on America's Wireless Future Frontier ,https://energycommerce.house.gov/newsroom/press-releases/pallone-opening-remarks-at-hearing-on-americas-wireless-future-frontier
