category,date,title,url,summary
Press Release,"Jan 13, 2022",E&C Leaders Request Information from Tennessee Valley Authority on Ratepayer Bills and Climate Action,https://energycommerce.house.gov/newsroom/press-releases/ec-leaders-request-information-from-tennessee-valley-authority-on-ratepayer,Energy and Commerce leaders request information regarding high electric bills and underinvestment in energy efficiency and renewable power.
Hearings,01/19/2022,"RESCHEDULED: Hearing on ""Securing our Energy Infrastructure: Legislation to Enhance Pipeline Reliability""",https://energycommerce.house.gov/committee-activity/hearings/rescheduled-hearing-on-securing-our-energy-infrastructure-legislation-to,
Hearings,01/20/2022,"Hearing on ""Cleaning Up Cryptocurrency: The Energy Impacts of Blockchains""",https://energycommerce.house.gov/committee-activity/hearings/hearing-on-cleaning-up-cryptocurrency-the-energy-impacts-of-blockchains,
Press Release,"Jan 12, 2022",E&C Announces Oversight Hearing on the Energy Impacts of Cryptocurrency,https://energycommerce.house.gov/newsroom/press-releases/ec-announces-oversight-hearing-on-the-energy-impacts-of-cryptocurrency,Chairman Pallone and Oversight and Investigations Chair Diana DeGette announce an oversight hearing on the energy impacts of cryptocurrencies and proof of work blockchains.
Press Release,"Jan 11, 2022",Pallone Applauds Biden EPA Action on Toxic Coal Ash,https://energycommerce.house.gov/newsroom/press-releases/pallone-applauds-biden-epa-action-on-toxic-coal-ash,Pallone applauds the Biden EPA's actions on mitigating toxic coal ash pollution.
