category,date,title,url
Hearings,02/08/2022,"Hearing on ""ARPA-H: The Next Frontier of Biomedical Research""",https://energycommerce.house.gov/committee-activity/hearings/hearing-on-arpa-h-the-next-frontier-of-biomedical-research
Press Release,"Feb 04, 2022",Pallone Hails House Passage of the America COMPETES Act,https://energycommerce.house.gov/newsroom/press-releases/pallone-hails-house-passage-of-the-america-competes-act
Press Release,"Feb 03, 2022","Pallone Opening Remarks at Legislative Hearing on PDUFA, GDUFA, and BsUFA Reauthorization",https://energycommerce.house.gov/newsroom/press-releases/pallone-opening-remarks-at-legislative-hearing-on-pdufa-gdufa-and-bsufa
Hearings,02/03/2022,"Hearing on ""FDA User Fee Reauthorization: Ensuring Safe and Effective Drugs and Biologics""",https://energycommerce.house.gov/committee-activity/hearings/hearing-on-fda-user-fee-reauthorization-ensuring-safe-and-effective
Hearings,02/02/2022,"Hearing on ""Pandemic Profiteers: Legislation to Stop Corporate Price Gouging""",https://energycommerce.house.gov/committee-activity/hearings/hearing-on-pandemic-profiteers-legislation-to-stop-corporate-price
Press Release,"Feb 02, 2022",Pallone Praises FDA Announcement of Kimberlee Trzeciak as Associate Commissioner for Legislative Affairs,https://energycommerce.house.gov/newsroom/press-releases/pallone-praises-fda-announcement-of-kimberlee-trzeciak-as-associate
Press Release,"Feb 02, 2022",Pallone Floor Statement on the America COMPETES Act,https://energycommerce.house.gov/newsroom/press-releases/pallone-floor-statement-on-the-america-competes-act
Press Release,"Feb 02, 2022",Pallone Opening Remarks at Legislative Hearing to Address Greedy Corporate Price Gouging,https://energycommerce.house.gov/newsroom/press-releases/pallone-opening-remarks-at-legislative-hearing-to-address-greedy-corporate
Press Release,"Feb 01, 2022",E&C Announces Hearing on ARPA-H and Accelerating Biomedical Research,https://energycommerce.house.gov/newsroom/press-releases/ec-announces-hearing-on-arpa-h-and-accelerating-biomedical-research
