category,date,title,url,summary
Press Release,"Nov 08, 2021",Pallone Joins Other Congressional Leaders in Attending COP26 Climate Conference in Glasgow,https://energycommerce.house.gov/newsroom/press-releases/pallone-joins-other-congressional-leaders-in-attending-cop26-climate,Chairman Pallone joins other congressional leaders for a congressional delegation trip to Glasgow for COP26.
Press Release,"Nov 05, 2021",Pallone on House Passage of Bipartisan Infrastructure Bill,https://energycommerce.house.gov/newsroom/press-releases/pallone-on-house-passage-of-bipartisan-infrastructure-bill,Chairman Pallone's statement on House passage of the Bipartisan Infrastructure Bill.
Markups,11/04/2021,"Markup of 9 Bills, Subcommittee on Health (November 4, 2021)",https://energycommerce.house.gov/committee-activity/markups/markup-of-9-bills-subcommittee-on-health-november-4-2021,
Markups,11/03/2021,"Markup of H.R. 1218 and H.R. 2501, Subcommittee on Communications and Technology (November 3, 2021)",https://energycommerce.house.gov/committee-activity/markups/markup-of-hr-1218-and-hr-2501-subcommittee-on-communications-and,
Press Release,"Nov 04, 2021",Eshoo Opening Remarks at Health Subcommittee Markup of Nine Public Health Bills,https://energycommerce.house.gov/newsroom/press-releases/eshoo-opening-remarks-at-health-subcommittee-markup-of-nine-public-health,Chairwoman Eshoo's opening remarks at a Health Subcommittee markup.
Press Release,"Nov 03, 2021",Pallone Opening Remarks at Subcommittee Markup of Communications and Technology Bills,https://energycommerce.house.gov/newsroom/press-releases/pallone-opening-remarks-at-subcommittee-markup-of-communications-and,Chairman Pallone's opening remarks at a Communications and Technology Subcommittee markup of H.R. 1218 and H.R. 2501.
