category,date,title,url
Hearings,10/06/2021,"Hearing on ""Strengthening Our Communications Networks To Meet The Needs Of Consumers""",https://energycommerce.house.gov/committee-activity/hearings/hearing-on-strengthening-our-communications-networks-to-meet-the-needs
Hearings,09/30/2021,"Hearing on ""A Level Playing Field: College Athletes' Rights to Their Name, Image, and Likeness""",https://energycommerce.house.gov/committee-activity/hearings/hearing-on-a-level-playing-field-college-athletes-rights-to-their-name
Press Release,"Oct 06, 2021",Pallone Opening Remarks at Legislative Hearing on Strengthening Our Communications Networks to Meet Consumers’ Needs,https://energycommerce.house.gov/newsroom/press-releases/pallone-opening-remarks-at-legislative-hearing-on-strengthening-our
Press Release,"Sep 30, 2021","Pallone Opening Remarks at Hearing on Collegiate Athletes’ Name, Image, and Likeness",https://energycommerce.house.gov/newsroom/press-releases/pallone-opening-remarks-at-hearing-on-collegiate-athletes-name-image-and
Press Release,"Sep 30, 2021","Pallone, Murray Applaud Biden Administration Rule Implementing Ban on Surprise Bills",https://energycommerce.house.gov/newsroom/press-releases/pallone-murray-applaud-biden-administration-rule-implementing-ban-on
Press Release,"Sep 30, 2021",E&C Leaders Request GAO Review of Federal Efforts to Streamline Broadband Deployment & Close the Digital Divide,https://energycommerce.house.gov/newsroom/press-releases/ec-leaders-request-gao-review-of-federal-efforts-to-streamline-broadband
