category,date,title,url,summary
Press Release,"Mar 22, 2022",E&C Announces Hearing on Upgrading America’s Drinking Water Infrastructure,https://energycommerce.house.gov/newsroom/press-releases/ec-announces-hearing-on-upgrading-america-s-drinking-water-infrastructure,Energy and Commerce Committee announces a Environment and Climate Change Subcommittee hearing on upgrading America's drinking water intrastructure.
Hearings,03/29/2022,"Hearing on ""Trusting the Tap: Upgrading America's Drinking Water Infrastructure""",https://energycommerce.house.gov/committee-activity/hearings/hearing-on-trusting-the-tap-upgrading-americas-drinking-water,
Press Release,"Mar 22, 2022",Pallone Questions Vaping Companies Over Marketing of Synthetic Nicotine Products to Teens,https://energycommerce.house.gov/newsroom/press-releases/pallone-questions-vaping-companies-over-marketing-of-synthetic-nicotine,Pallone wrote to four leading vaping companies that sell synthetic nicotine products to request information regarding the health and safety of their products.
Press Release,"Mar 21, 2022",E&C Democrats Outline Priorities on Implementation of Bipartisan Infrastructure Law’s Broadband Investments ,https://energycommerce.house.gov/newsroom/press-releases/ec-democrats-outline-priorities-on-implementation-of-bipartisan,Seventeen Energy and Commerce Democrats highlight opportunities to help close the digital divide through the $65 billion investment in the Bipartisan Infrastructure Law.
Press Release,"Mar 21, 2022",E&C Leaders Demand Answers from Utility Companies on Alarmingly High Shutoff Rates During COVID-19 Pandemic,https://energycommerce.house.gov/newsroom/press-releases/ec-leaders-demand-answers-from-utility-companies-on-alarmingly-high-shutoff,"Pallone, Rush, and DeGette demand answers from six utility companies on alarmingly high shutoff rates during the COVID-19 pandemic."
Press Release,"Mar 17, 2022",Pallone Opening Remarks at Public Health Legislative Hearing,https://energycommerce.house.gov/newsroom/press-releases/pallone-opening-remarks-at-public-health-legislative-hearing,Chairman Pallone's opening remarks at a public health hearing on the future of medicine.
Hearings,03/17/2022,"Hearing on ""The Future of Medicine: Legislation to Encourage Innovation and Improve Oversight""",https://energycommerce.house.gov/committee-activity/hearings/hearing-on-the-future-of-medicine-legislation-to-encourage-innovation,
