category,date,title,url,description
Press Releases,"October 27, 2021",PHOTOS: Homeland Republicans Work To Advance Maritime Security,https://republicans-homeland.house.gov/photos-homeland-republicans-work-to-advance-maritime-security/,"PHOTOS: Homeland Republicans Work To Advance Maritime Security WASHINGTON, DC – Republican Members of the House Committee on Homeland Security recently..."
Press Releases,"October 27, 2021",PHOTOS: Homeland Republicans Work To Advance Maritime Security,https://republicans-homeland.house.gov/photos-homeland-republicans-work-to-advance-maritime-security/,"PHOTOS: Homeland Republicans Work To Advance Maritime Security WASHINGTON, DC – Republican Members of the House Committee on Homeland Security recently..."
Press Releases,"October 27, 2021",Katko Opening Statement In Hearing On Equity In Disaster Response,https://republicans-homeland.house.gov/katko-opening-statement-in-hearing-on-equity-in-disaster-response/,"Katko Opening Statement In Hearing On Equity In Disaster Response WASHINGTON, DC – Rep. John Katko (R-NY), Ranking Member..."
Press Releases,"October 26, 2021",Committee Approves Bills To Bolster Homeland Security Mission,https://republicans-homeland.house.gov/committee-approves-bills-to-bolster-homeland-security-mission/,"Committee Approves Bills To Bolster Homeland Security Mission WASHINGTON, DC – Today, the House Committee on Homeland Security advanced 12..."
Press Releases,"October 26, 2021",Garbarino & Gimenez Opening Statements In Transportation Cybersecurity Hearing,https://republicans-homeland.house.gov/garbarino-gimenez-opening-statements-in-transportation-cybersecurity-hearing/,"Garbarino & Gimenez Opening Statements In Transportation Cybersecurity Hearing WASHINGTON, DC – Rep. Andrew Garbarino (R-NY), Ranking Member of..."
Press Releases,"October 26, 2021",Katko: Biden’s ‘Tough Talk’ With Russia Isn’t Getting The Job Done,https://republicans-homeland.house.gov/katko-bidens-tough-talk-with-russia-isnt-getting-the-job-done/,"Katko: Biden’s ‘Tough Talk’ With Russia Isn’t Getting The Job Done WASHINGTON, DC – Rep. John Katko (R-NY), Ranking..."
Press Releases,"October 25, 2021",New Border Numbers: A Year Of Chaos & Crisis,https://republicans-homeland.house.gov/new-border-numbers-a-year-of-chaos-crisis/,"New Border Numbers: A Year Of Chaos & Crisis WASHINGTON, DC – Amid a global pandemic, the number of illegal..."
Press Releases,"October 22, 2021","Katko, Cuellar Propose Needed Improvements To Shadow Wolves Authority To Secure Southern Border",https://republicans-homeland.house.gov/katko-cuellar-propose-needed-improvements-to-shadow-wolves-authority-to-secure-southern-border/,"Katko, Cuellar Propose Needed Improvements To Shadow Wolves Authority To Secure Southern Border WASHINGTON, DC – Rep. John Katko (R-NY), Ranking..."
