category,date,title,url,description
Press Releases,"November 3, 2021",Katko Opening Statement In Cybersecurity Hearing,https://republicans-homeland.house.gov/katko-opening-statement-in-cybersecurity-hearing/,"Katko Opening Statement In Cybersecurity Hearing WASHINGTON, DC – Rep. John Katko (R-NY), Ranking Member of the House Committee..."
Press Releases,"November 3, 2021",Katko Opening Statement In Cybersecurity Hearing,https://republicans-homeland.house.gov/katko-opening-statement-in-cybersecurity-hearing/,"Katko Opening Statement In Cybersecurity Hearing WASHINGTON, DC – Rep. John Katko (R-NY), Ranking Member of the House Committee..."
Press Releases,"November 2, 2021",ICYMI: Katko Talks Cyber Priorities At CSIS Event,https://republicans-homeland.house.gov/icymi-katko-talks-cyber-priorities-at-csis-event/,"ICYMI: Katko Talks Cyber Priorities At CSIS Event WASHINGTON, DC – In case you missed it, Rep. John Katko (R-NY), Ranking..."
Press Releases,"November 2, 2021",Cammack Opening Statement In Hearing On Emergency Communications,https://republicans-homeland.house.gov/cammack-opening-statement-in-hearing-on-emergency-communications/,"Cammack Opening Statement In Hearing On Emergency Communications WASHINGTON, DC – Rep. Kat Cammack (R-FL), Ranking Member of the Emergency..."
Press Releases,"October 29, 2021",In Case You Missed It: Reps. John Katko & Andrew Garbarino In The Hill: Now Is The Time To Take Stock In Our Cyber Defenses,https://republicans-homeland.house.gov/in-case-you-missed-it-reps-john-katko-andrew-garbarino-in-the-hill-now-is-the-time-to-take-stock-in-our-cyber-defenses/,In Case You Missed It Reps. John Katko & Andrew Garbarino In The Hill: Now Is The Time To...
Press Releases,"October 29, 2021",MEDIA ADVISORY: Katko Speaks At CSIS Cyber Event With CISA Director Easterly,https://republicans-homeland.house.gov/media-advisory-katko-speaks-at-csis-cyber-event-with-cisa-director-easterly/,"MEDIA ADVISORY: Katko Speaks At CSIS Cyber Event With CISA Director Easterly This afternoon, Rep. John Katko (R-NY), Ranking..."
