category,date,title,url,summary
Press Releases,01.19.22,Biden’s Foreign Policy Failures One Year In,https://gop-foreignaffairs.house.gov/press-release/bidens-foreign-policy-failures-one-year-in/,"Washington, D.C. – House Foreign Affairs Committee Lead Republican Michael McCaul has released the following documents outlining some of President Biden’s many foreign policy failures since taking…"
Press Releases,01.19.22,McCaul: Biden Remarks on Russia ‘Nothing Short of a Disaster’,https://gop-foreignaffairs.house.gov/press-release/mccaul-biden-remarks-on-russia-nothing-short-of-a-disaster/,"Washington, D.C. – House Foreign Affairs Committee Lead Republican Michael McCaul has issued the following statement after remarks today by President Biden that undercut his own administration’s…"
Press Releases,01.16.22,"McCaul Talks Russia, Upcoming Beijing Games on CNN’s “State of the Union",https://gop-foreignaffairs.house.gov/press-release/mccaul-talks-russia-upcoming-beijing-games-on-cnns-state-of-the-union/,"Washington, D.C. – House Foreign Affairs Committee Lead Republican Michael McCaul joined Jake Tapper on CNN’s “State of the Union” to discuss Biden’s weak Russia policy and the CCP’s malign…"
Press Releases,01.15.22,TUNE IN: Rep. McCaul Will Join “State of the Union” January 16th at 9amET/8amCT,https://gop-foreignaffairs.house.gov/press-release/tune-in-rep-mccaul-will-join-state-of-the-union-january-16th-at-9amet-8amct/,"Washington, D.C. – House Foreign Affairs Committee Lead Republican Michael McCaul will join Jake Tapper on “State of the Union” this Sunday, January 16th at 9amET/8amCT. Rep. McCaul will…"
Press Releases,01.14.22,"McCaul, Meeks, Chabot, Bera Raise Concerns Over Appropriate Burmese Participation in ASEAN Meetings",https://gop-foreignaffairs.house.gov/press-release/mccaul-meeks-chabot-bera-raise-concerns-over-appropriate-burmese-participation-in-asean-meetings/,"Washington, D.C. – House Foreign Affairs Committee Lead Republican Michael McCaul (R-TX) and Chairman Gregory W. Meeks (D-NY), joined by Subcommittee on Asia, the Pacific, Central Asia, and…"
