category,date,title,url,description
Press Releases,"May 19, 2022",Committee Clears Republican Bills to Protect CBP Frontline Personnel & Push Back Against China’s Influence,https://republicans-homeland.house.gov/committee-clears-republican-bills-to-protect-cbp-frontline-personnel-push-back-against-chinas-influence/,"Committee Clears Republican Bills to Protect CBP Frontline Personnel & Push Back Against China’s Influence WASHINGTON, DC – Today, the House..."
Press Releases,"May 19, 2022",Committee Clears Republican Bills to Protect CBP Frontline Personnel & Push Back Against China’s Influence,https://republicans-homeland.house.gov/committee-clears-republican-bills-to-protect-cbp-frontline-personnel-push-back-against-chinas-influence/,"Committee Clears Republican Bills to Protect CBP Frontline Personnel & Push Back Against China’s Influence WASHINGTON, DC – Today, the House..."
Press Releases,"May 19, 2022",Katko Opening Statement in Full Committee Markup,https://republicans-homeland.house.gov/katko-opening-statement-in-full-committee-markup/,"Katko Opening Statement in Full Committee Markup WASHINGTON, DC – Rep. John Katko (R-NY), Ranking Member of the House..."
Press Releases,"May 18, 2022",The Biden Administration is Breaking All of the Wrong Records,https://republicans-homeland.house.gov/the-biden-administration-is-breaking-all-of-the-wrong-records/,"The Biden Administration is Breaking All of the Wrong Records WASHINGTON, DC – The Biden administration has been defined..."
Press Releases,"May 18, 2022",Katko & Turner on Suspension of DHS Disinformation Governance Board,https://republicans-homeland.house.gov/katko-turner-on-suspension-of-dhs-disinformation-governance-board/,"Katko & Turner on Suspension of DHS Disinformation Governance Board WASHINGTON, DC – Rep. John Katko (R-NY), Ranking Member of..."
Press Releases,"May 17, 2022",Garbarino Opening Statement in Federal Networks Hearing,https://republicans-homeland.house.gov/garbarino-opening-statement-in-federal-networks-hearing/,"Garbarino Opening Statement in Federal Networks Hearing WASHINGTON, DC – Rep. Andrew Garbarino (R-NY), Ranking Member of the Cybersecurity,..."
Press Releases,"May 16, 2022","Katko on the Mass Shooting in Buffalo, NY",https://republicans-homeland.house.gov/katko-on-the-mass-shooting-in-buffalo-ny/,"Katko on the Mass Shooting in Buffalo, NY WASHINGTON, DC – Rep. John Katko (R-NY), Ranking Member of the House Committee..."
