category,date,title,url,summary
Press Releases,08.09.21,McCaul Statement on Anniversary of Fraudulent Belarus Presidential Election and New U.S. Sanctions,https://gop-foreignaffairs.house.gov/press-release/mccaul-statement-on-anniversary-of-fraudulent-belarus-presidential-election-and-new-u-s-sanctions/,"Washington, DC – On the one-year anniversary of the fraudulent presidential election in Belarus, and in response to the Biden Administration’s announcement of a new Executive Order with expanded…"
Press Releases,08.09.21,"McCaul, Green, & Salazar Join Leader McCarthy in Support of Cuban Freedom in Miami",https://gop-foreignaffairs.house.gov/press-release/mccaul-green-salazar-join-leader-mccarthy-in-support-of-cuban-freedom-in-miami/,"Washington, DC-House Foreign Affairs Committee Lead Republican Michael McCaul (R-TX), Western Hemisphere, Civilian Security, Migration, and International Economic Policy Subcommittee Lead Republican…"
Press Releases,08.09.21,McCaul Introduces Havana Syndrome Attacks Response Act,https://gop-foreignaffairs.house.gov/press-release/mccaul-introduces-havana-syndrome-attacks-response-act/,"Washington, D.C. – House Foreign Affairs Lead Republican Michael McCaul has introduced H.R. 4914, the Havana Syndrome Attacks Response Act. The full text of the legislation can be found here. The…"
Press Releases,08.06.21,"McCaul, Meeks and Bipartisan Group of HFAC Members Statement ahead of Polish Parliament Vote on Press Freedom",https://gop-foreignaffairs.house.gov/press-release/mccaul-meeks-and-bipartisan-group-of-hfac-members-statement-ahead-of-polish-parliament-vote-on-press-freedom/,"Washington, D.C. – House Foreign Affairs Committee Ranking Member Michael McCaul (R-TX) and Chairman Gregory Meeks (D-NY), along with Europe, Energy, the Environment, and Cyber Subcommittee Ranking…"
Press Releases,08.06.21,"McCaul, China Task Force Members Ask for Honor Device Co. to Be Added to the Entity List",https://gop-foreignaffairs.house.gov/press-release/mccaul-china-task-force-members-ask-for-honor-device-co-to-be-added-to-the-entity-list/,"Washington, D.C. – China Task Force Chairman Michael McCaul and 13 China Task Force Members have sent a letter to Commerce Secretary Gina Raimondo asking that the End-User Review Committee (ERC)…"
Press Releases,08.04.21,McCaul: “Ill-Timed and Haphazard Withdrawal from Afghanistan” an “Utter Failure on the Part of President Biden”,https://gop-foreignaffairs.house.gov/press-release/mccaul-ill-timed-and-haphazard-withdrawal-from-afghanistan-an-utter-failure-on-the-part-of-president-biden/,"Washington, D.C. – House Foreign Affairs Committee Lead Republican has released the following statement on President Biden’s announcement of a Priority 2 (P-2) program for a select group of Afghans…"
