category,date,title,url
News,"Jul 27, 2021","Opening Statement of Ranking Member Frank Lucas at Full Committee Markup of H.R. 4609, H.R. 3858, H.R. 4588, H.R. 4606, H.R. 4599",https://republicans-science.house.gov/news/opening-statements/opening-statement-ranking-member-frank-lucas-full-committee-markup-hr-4609
News,"Jul 26, 2021",Representatives Foster and Obernolte Urge OSTP Examine Nation’s Lab Biosafety Policies ,https://republicans-science.house.gov/news/press-releases/representatives-foster-and-obernolte-urge-ostp-examine-nation-s-lab-biosafety
News,"Jul 21, 2021",Science Committee Members Introduce Bipartisan Legislation to Reauthorize NIST,https://republicans-science.house.gov/news/press-releases/science-committee-members-introduce-legislation-reauthorize-nist
Markups,07/27/2021,"Full Committee Markup of H.R. 4609, H.R. 3858, H.R. 4588, H.R. 4606, H.R. 4599",https://republicans-science.house.gov/legislation/markups/full-committee-markup-nist-future-act-national-science-and-technology-strategy
Hearings,07/29/2021,Space and Aeronautics Subcommittee Hearing - Enabling Mission Success from the Ground Up: Addressing NASA’s Urgent Infrastructure Needs,https://republicans-science.house.gov/legislation/hearings/space-and-aeronautics-subcommittee-hearing-enabling-mission-success-ground
Hearings,07/21/2021,Environment Subcommittee Hearing - Silent Killer: The Rising Problem of Extreme Heat in the U.S.,https://republicans-science.house.gov/legislation/hearings/environment-subcommittee-hearing-silent-killer-rising-problem-extreme-heat-us
