category,date,title,url,summary
Press Releases,09.01.21,McCaul: Ukrainian President Zelenksy’s White House Visit “Long Overdue”,https://gop-foreignaffairs.house.gov/press-release/mccaul-ukrainian-president-zelenksys-white-house-visit-long-overdue/,"Washington, D.C. – House Foreign Affairs Committee Lead Republican Michael McCaul has released the following statement on Ukrainian President Volodymyr Zelensky’s long overdue meeting with…"
Press Releases,09.01.21,McCaul Joins Leader McCarthy in Standing Up for Americans Left Behind,https://gop-foreignaffairs.house.gov/press-release/mccaul-joins-leader-mccarthy-in-standing-up-for-americans-left-behind/,"Washington, D.C.- Today, House Foreign Affairs Committee Lead Republican Michael McCaul joined Republican Leader Kevin McCarthy, congressional veterans, and others to stand up for Americans and our…"
Press Releases,08.31.21,McCaul Urges U.S. Special Presidential Envoy for Climate John Kerry Not to Link US Energy Needs to “Genocidal Regime”,https://gop-foreignaffairs.house.gov/press-release/mccaul-urges-u-s-special-presidential-envoy-for-climate-john-kerry-not-to-link-us-energy-needs-to-genocidal-regime/,"Washington, D.C. – As Special Presidential Envoy for Climate John Kerry heads to the People’s Republic of China (PRC) and Japan, House Foreign Affairs Committee Lead Republican Michael McCaul has…"
Press Releases,08.31.21,"McCaul, Meeks, Deutch, Wilson Issue Statement on Recent Developments in Tunisia",https://gop-foreignaffairs.house.gov/press-release/mccaul-meeks-deutch-wilson-issue-statement-on-recent-developments-in-tunisia/,"Washington, D.C. – Today, House Foreign Affairs Committee Lead Republican Michael McCaul (R-TX) and Chairman Gregory Meeks (D-NY), along with the Subcommittee on Middle East, North Africa, and Global…"
Press Releases,08.31.21,McCaul: “Disgraceful” State Dept. Left Hundreds of USAGM Journalists in Afghanistan,https://gop-foreignaffairs.house.gov/press-release/mccaul-disgraceful-state-dept-left-hundreds-of-usagm-journalists-in-afghanistan/,"Washington, D.C. – House Foreign Affairs Committee Lead Republican Michael McCaul has released the following statement on the news that more than 500 journalists and their families who were…"
Press Releases,08.30.21,"McCaul, Nunes and Rogers Ask NSA Sullivan for Afghanistan Evacuation Plan",https://gop-foreignaffairs.house.gov/press-release/mccaul-nunes-and-rogers-ask-nsa-sullivan-for-afghanistan-evacuation-plan/,"Washington, D.C.- House Foreign Affairs Committee Lead Republican Michael McCaul (R-TX) joined House Permanent Select Committee on Intelligence Lead Republican Devin Nunes (R-CA), and House Armed…"
Press Releases,08.30.21,"McCaul, Meeks Urge Biden Administration to “Prioritize Securing the Release of American Citizens Unjustly Imprisoned in Iran”",https://gop-foreignaffairs.house.gov/press-release/mccaul-meeks-urge-biden-administration-to-prioritize-securing-the-release-of-american-citizens-unjustly-imprisoned-in-iran/,"Washington, D.C. – House Foreign Affairs Committee Lead Republican Michael McCaul (R-TX) and Chairman Gregory Meeks (D-NY) have sent a letter urging the president to “prioritize securing the release…"
