category,date,title,url,summary
Majority Press Releases,"October 13, 2021",Chairs DeFazio and Carbajal Statement on Sexual Assault Allegations at the United States Merchant Marine Academy and Aboard Training Vessels ,https://transportation.house.gov/news/press-releases/chairs-defazio-and-carbajal-statement-on-sexual-assault-allegations-at-the-united-states-merchant-marine-academy-and-aboard-training-vessels-,"Washington, D.C. - Chair of the House Committee on Transportation and Infrastructure Peter DeFazio (D-OR) and Chair of the Subcommittee on Coast Guard and Maritime Transportation Salud Carbajal (D-CA) issued the following statement regarding allegations of rape and sexual harassment of students at the U.S. Merchant Marine Academy and aboard training vessels:""We must have zero tolerance when it comes to sexual assault,"" Chairs DeFazio and Carbajal said. ""This pattern of abuse in the maritime … "
Majority Press Releases,"October 13, 2021",DeFazio and Cohen Urge President Biden to Reopen and Reexamine U.S. Army Corps’ Nationwide Permits ,https://transportation.house.gov/news/press-releases/defazio-and-cohen-urge-president-biden-to-reopen-and-reexamine-us-army-corps-nationwide-permits-,"T&I Members to Biden: ""[Nationwide Permits] should be based on sound science, with abundant stakeholder input-including robust input from the states-and include considerations of climate change impacts and the environmental justice goals of your administration""Washington, DC - Today, Chair of the House Committee on Transportation and Infrastructure Peter DeFazio (D-OR) and Representative Steve Cohen (D-TN) urged President Biden to ensure protection of clean water by reopening and … "
Majority Press Releases,"October 08, 2021","Chairs DeFazio, Carbajal, and Payne, Jr. Statements on Critical Federal Steps Taken Following Oil Spill in Southern California",https://transportation.house.gov/news/press-releases/chairs-defazio-carbajal-and-payne-jr-statements-on-critical-federal-steps-taken-following-oil-spill-in-southern-california,"Washington, D.C. - Chair of the House Committee on Transportation and Infrastructure Peter DeFazio (D-OR), Chair of the Subcommittee on Coast Guard and Maritime Transportation Salud Carbajal (D-CA), and Chair of the Subcommittee on Railroads, Pipelines, and Hazardous Materials Donald M. Payne, Jr. (D-NJ) issued the following statements on the critical steps taken by the federal government following an oil spill off the coast of Southern California:""The recent oil spill in Southern California … "
Majority Hearings,Oct 20 2021,,https://transportation.house.gov/committee-activity/hearings/achieving-mission-balance-positioning-the-coast-guard-for-the-future,
Minority Press Releases,"October 14, 2021",Republicans Press DOT to Implement All Provisions of Pipeline Safety Law,https://republicans-transportation.house.gov/news/documentsingle.aspx?DocumentID=405635,
Minority Press Releases,"October 13, 2021",The Biden Administration Bears Full Responsibility for California Oil Spill with Failure to Address Supply Chain Issues,https://republicans-transportation.house.gov/news/documentsingle.aspx?DocumentID=405633,
