date,type,title,sponsor,committees,latest_action,tracker,url
08/06/2021,LAW,"To designate the facility of the United States Postal Service located at 500 West Main Street, Suite 102 in Tupelo, Mississippi, as the ""Colonel Carlyle 'Smitty' Harris Post Office"".","Rep. Kelly, Trent [R-MS-1]", House - Oversight and Reform | Senate - Homeland Security and Governmental Affairs        ,,Became Law,https://www.congress.gov/bill/117th-congress/house-bill/208?q=%7B%22search%22%3A%5B%22actionDate%3A%5C%22117%7C2021-08-06%5C%22+AND+%28billIsReserved%3A%5C%22N%5C%22+OR+type%3A%5C%22AMENDMENT%5C%22%29%22%5D%7D&s=1&r=1
08/06/2021,LAW,"To designate the facility of the United States Postal Service located at 1101 Charlotte Street in Georgetown, South Carolina, as the ""Joseph Hayne Rainey Memorial Post Office Building"".","Rep. Rice, Tom [R-SC-7]", House - Oversight and Reform | Senate - Homeland Security and Governmental Affairs        ,,Became Law,https://www.congress.gov/bill/117th-congress/house-bill/264?q=%7B%22search%22%3A%5B%22actionDate%3A%5C%22117%7C2021-08-06%5C%22+AND+%28billIsReserved%3A%5C%22N%5C%22+OR+type%3A%5C%22AMENDMENT%5C%22%29%22%5D%7D&s=1&r=2
08/06/2021,LAW,"To designate the facility of the United States Postal Service located at 229 Minnetonka Avenue South in Wayzata, Minnesota, as the ""Jim Ramstad Post Office"".","Rep. Phillips, Dean [D-MN-3]", House - Oversight and Reform | Senate - Homeland Security and Governmental Affairs        ,,Became Law,https://www.congress.gov/bill/117th-congress/house-bill/772?q=%7B%22search%22%3A%5B%22actionDate%3A%5C%22117%7C2021-08-06%5C%22+AND+%28billIsReserved%3A%5C%22N%5C%22+OR+type%3A%5C%22AMENDMENT%5C%22%29%22%5D%7D&s=1&r=3
08/06/2021,LAW,DEBAR Act of 2021,"Rep. Latta, Robert E. [R-OH-5]", House - Energy and Commerce; Judiciary | Senate - Judiciary        ,,Became Law,https://www.congress.gov/bill/117th-congress/house-bill/1002?q=%7B%22search%22%3A%5B%22actionDate%3A%5C%22117%7C2021-08-06%5C%22+AND+%28billIsReserved%3A%5C%22N%5C%22+OR+type%3A%5C%22AMENDMENT%5C%22%29%22%5D%7D&s=1&r=4
08/06/2021,BILL,Puppies Assisting Wounded Servicemembers for Veterans Therapy Act,"Rep. Stivers, Steve [R-OH-15]", House - Veterans' Affairs | Senate - Veterans' Affairs        ,Senate - 08/06/2021 Passed Senate without amendment by Voice Vote. (,Passed Senate,https://www.congress.gov/bill/117th-congress/house-bill/1448?q=%7B%22search%22%3A%5B%22actionDate%3A%5C%22117%7C2021-08-06%5C%22+AND+%28billIsReserved%3A%5C%22N%5C%22+OR+type%3A%5C%22AMENDMENT%5C%22%29%22%5D%7D&s=1&r=5
08/06/2021,BILL,Dr. Lorna Breen Health Care Provider Protection Act,"Sen. Kaine, Tim [D-VA]"," Senate - Health, Education, Labor, and Pensions        ",Senate - 08/06/2021 Passed Senate with an amendment by Voice Vote. (text: CR ,Passed Senate,https://www.congress.gov/bill/117th-congress/senate-bill/610?q=%7B%22search%22%3A%5B%22actionDate%3A%5C%22117%7C2021-08-06%5C%22+AND+%28billIsReserved%3A%5C%22N%5C%22+OR+type%3A%5C%22AMENDMENT%5C%22%29%22%5D%7D&s=1&r=6
08/06/2021,BILL,"A bill to direct the Secretary of State to develop a strategy to regain observer status for Taiwan in the World Health Organization, and for other purposes.","Sen. Menendez, Robert [D-NJ]", Senate - Foreign Relations        ,Senate - 08/06/2021 Passed Senate without amendment by Unanimous Consent. (consideration: CR ,Passed Senate,https://www.congress.gov/bill/117th-congress/senate-bill/812?q=%7B%22search%22%3A%5B%22actionDate%3A%5C%22117%7C2021-08-06%5C%22+AND+%28billIsReserved%3A%5C%22N%5C%22+OR+type%3A%5C%22AMENDMENT%5C%22%29%22%5D%7D&s=1&r=7
08/06/2021,BILL,"A bill to require the Comptroller General of the United States to conduct a study on disparities associated with race and ethnicity with respect to certain benefits administered by the Secretary of Veterans Affairs, and for other purposes.","Sen. Warnock, Raphael G. [D-GA]", Senate - Veterans' Affairs        ,Senate - 08/06/2021 Passed Senate without amendment by Unanimous Consent. (text: CR ,Passed Senate,https://www.congress.gov/bill/117th-congress/senate-bill/1031?q=%7B%22search%22%3A%5B%22actionDate%3A%5C%22117%7C2021-08-06%5C%22+AND+%28billIsReserved%3A%5C%22N%5C%22+OR+type%3A%5C%22AMENDMENT%5C%22%29%22%5D%7D&s=1&r=8
08/06/2021,BILL,RENACER Act,"Sen. Menendez, Robert [D-NJ]", Senate - Foreign Relations        ,Senate - 08/06/2021 Passed Senate with an amendment by Voice Vote. (consideration: CR ,Passed Senate,https://www.congress.gov/bill/117th-congress/senate-bill/1041?q=%7B%22search%22%3A%5B%22actionDate%3A%5C%22117%7C2021-08-06%5C%22+AND+%28billIsReserved%3A%5C%22N%5C%22+OR+type%3A%5C%22AMENDMENT%5C%22%29%22%5D%7D&s=1&r=9
08/06/2021,BILL,"A bill to provide for redistricting reform, and for other purposes.","Sen. Schumer, Charles [D-NY]",,Senate - 08/06/2021 Introduced in the Senate. Read the first time. Placed on Senate Legislative Calendar under Read the First Time. (text: CR ,Introduced,https://www.congress.gov/bill/117th-congress/senate-bill/2670?q=%7B%22search%22%3A%5B%22actionDate%3A%5C%22117%7C2021-08-06%5C%22+AND+%28billIsReserved%3A%5C%22N%5C%22+OR+type%3A%5C%22AMENDMENT%5C%22%29%22%5D%7D&s=1&r=10
08/06/2021,BILL,"A bill to amend the Federal Election Campaign Act of 1971 to provide for additional disclosure requirements for corporations, labor organizations, Super PACs and other entities, and for other purposes.","Sen. Schumer, Charles [D-NY]",,Senate - 08/06/2021 Introduced in the Senate. Read the first time. Placed on Senate Legislative Calendar under Read the First Time. (text: CR ,Introduced,https://www.congress.gov/bill/117th-congress/senate-bill/2671?q=%7B%22search%22%3A%5B%22actionDate%3A%5C%22117%7C2021-08-06%5C%22+AND+%28billIsReserved%3A%5C%22N%5C%22+OR+type%3A%5C%22AMENDMENT%5C%22%29%22%5D%7D&s=1&r=11
08/06/2021,AMENDMENT,,,,,,https://www.congress.gov/search?q=%7B%22congress%22%3A%22all%22%2C%22source%22%3A%22legislation%22%2C%22search%22%3A%22actionDate%3A%5C%22117%7C2021-08-06%5C%22+AND+%28billIsReserved%3A%5C%22N%5C%22+OR+type%3A%5C%22AMENDMENT%5C%22%29%22%7D&pageSort=documentNumber%3Aasc
07/31/2021,BILL,"A bill to extend the moratorium on residential evictions, and for other purposes.","Sen. Brown, Sherrod [D-OH]"," Senate - Health, Education, Labor, and Pensions        ","Senate - 07/31/2021 Read twice and referred to the Committee on Health, Education, Labor, and Pensions. (",Introduced,https://www.congress.gov/bill/117th-congress/senate-bill/2578?q=%7B%22search%22%3A%5B%22actionDate%3A%5C%22117%7C2021-07-31%5C%22+AND+%28billIsReserved%3A%5C%22N%5C%22+OR+type%3A%5C%22AMENDMENT%5C%22%29%22%5D%7D&s=1&r=1
08/05/2021,LAW,"To award four congressional gold medals to the United States Capitol Police and those who protected the U.S. Capitol on January 6, 2021.","Rep. Pelosi, Nancy [D-CA-12]"," House - Financial Services; House Administration; Budget | Senate - Banking, Housing, and Urban Affairs        ",,Became Law,https://www.congress.gov/bill/117th-congress/house-bill/3325?q=%7B%22search%22%3A%5B%22actionDate%3A%5C%22117%7C2021-08-05%5C%22+AND+%28billIsReserved%3A%5C%22N%5C%22+OR+type%3A%5C%22AMENDMENT%5C%22%29%22%5D%7D&s=1&r=1
08/05/2021,BILL,INVEST in America Act,"Rep. DeFazio, Peter A. [D-OR-4]", House - Transportation and Infrastructure        ,Senate - 08/05/2021 Cloture motion on the measure presented in Senate. (CR ,Passed House,https://www.congress.gov/bill/117th-congress/house-bill/3684?q=%7B%22search%22%3A%5B%22actionDate%3A%5C%22117%7C2021-08-05%5C%22+AND+%28billIsReserved%3A%5C%22N%5C%22+OR+type%3A%5C%22AMENDMENT%5C%22%29%22%5D%7D&s=1&r=2
08/05/2021,BILL,"A bill to create livable communities through coordinated public investment and streamlined requirements, and for other purposes.","Sen. Menendez, Robert [D-NJ]"," Senate - Banking, Housing, and Urban Affairs        ","Senate - 08/05/2021 Read twice and referred to the Committee on Banking, Housing, and Urban Affairs. (",Introduced,https://www.congress.gov/bill/117th-congress/senate-bill/2616?q=%7B%22search%22%3A%5B%22actionDate%3A%5C%22117%7C2021-08-05%5C%22+AND+%28billIsReserved%3A%5C%22N%5C%22+OR+type%3A%5C%22AMENDMENT%5C%22%29%22%5D%7D&s=1&r=3
08/05/2021,BILL,"A bill to amend the Internal Revenue Code of 1986 to revise the treatment of partnership interests received in connection with the performance of services, and for other purposes.","Sen. Wyden, Ron [D-OR]", Senate - Finance        ,Senate - 08/05/2021 Read twice and referred to the Committee on Finance. (,Introduced,https://www.congress.gov/bill/117th-congress/senate-bill/2617?q=%7B%22search%22%3A%5B%22actionDate%3A%5C%22117%7C2021-08-05%5C%22+AND+%28billIsReserved%3A%5C%22N%5C%22+OR+type%3A%5C%22AMENDMENT%5C%22%29%22%5D%7D&s=1&r=4
08/05/2021,BILL,"A bill to amend titles XVIII and XIX of the Social Security Act to provide for coverage of dental and oral health services, vision services, and hearing services under the Medicare and Medicaid programs.","Sen. Casey, Bob [D-PA]", Senate - Finance        ,Senate - 08/05/2021 Read twice and referred to the Committee on Finance. (,Introduced,https://www.congress.gov/bill/117th-congress/senate-bill/2618?q=%7B%22search%22%3A%5B%22actionDate%3A%5C%22117%7C2021-08-05%5C%22+AND+%28billIsReserved%3A%5C%22N%5C%22+OR+type%3A%5C%22AMENDMENT%5C%22%29%22%5D%7D&s=1&r=5
08/05/2021,BILL,"A bill to prevent States and local jurisdictions from interfering with the production and distribution of agricultural products in interstate commerce, and for other purposes.","Sen. Marshall, Roger [R-KS]"," Senate - Agriculture, Nutrition, and Forestry        ","Senate - 08/05/2021 Read twice and referred to the Committee on Agriculture, Nutrition, and Forestry. (",Introduced,https://www.congress.gov/bill/117th-congress/senate-bill/2619?q=%7B%22search%22%3A%5B%22actionDate%3A%5C%22117%7C2021-08-05%5C%22+AND+%28billIsReserved%3A%5C%22N%5C%22+OR+type%3A%5C%22AMENDMENT%5C%22%29%22%5D%7D&s=1&r=6
08/05/2021,BILL,A bill to amend the Higher Education Act of 1965 to make college affordable and accessible by expanding access to dual or concurrent enrollment programs and early college high school programs.,"Sen. Peters, Gary [D-MI]"," Senate - Health, Education, Labor, and Pensions        ","Senate - 08/05/2021 Read twice and referred to the Committee on Health, Education, Labor, and Pensions. (",Introduced,https://www.congress.gov/bill/117th-congress/senate-bill/2620?q=%7B%22search%22%3A%5B%22actionDate%3A%5C%22117%7C2021-08-05%5C%22+AND+%28billIsReserved%3A%5C%22N%5C%22+OR+type%3A%5C%22AMENDMENT%5C%22%29%22%5D%7D&s=1&r=7
08/05/2021,BILL,"A bill to amend the Internal Revenue Code of 1986 to modernize the tax treatment of derivatives and their underlying investments, and for other purposes.","Sen. Wyden, Ron [D-OR]", Senate - Finance        ,Senate - 08/05/2021 Read twice and referred to the Committee on Finance. (,Introduced,https://www.congress.gov/bill/117th-congress/senate-bill/2621?q=%7B%22search%22%3A%5B%22actionDate%3A%5C%22117%7C2021-08-05%5C%22+AND+%28billIsReserved%3A%5C%22N%5C%22+OR+type%3A%5C%22AMENDMENT%5C%22%29%22%5D%7D&s=1&r=8
08/05/2021,BILL,"A bill to amend title XIX and XXI of the Social Security Act to provide coverage of comprehensive tobacco cessation services under such titles, and for other purposes.","Sen. Carper, Thomas [D-DE]", Senate - Finance        ,Senate - 08/05/2021 Read twice and referred to the Committee on Finance. (,Introduced,https://www.congress.gov/bill/117th-congress/senate-bill/2622?q=%7B%22search%22%3A%5B%22actionDate%3A%5C%22117%7C2021-08-05%5C%22+AND+%28billIsReserved%3A%5C%22N%5C%22+OR+type%3A%5C%22AMENDMENT%5C%22%29%22%5D%7D&s=1&r=9
08/05/2021,BILL,"A bill to amend the Federal Meat Inspection Act to modify requirements for a meat food product of cattle to bear a ""Product of U.S.A."" label, and for other purposes.","Sen. Rounds, Mike [R-SD]"," Senate - Agriculture, Nutrition, and Forestry        ","Senate - 08/05/2021 Read twice and referred to the Committee on Agriculture, Nutrition, and Forestry. (",Introduced,https://www.congress.gov/bill/117th-congress/senate-bill/2623?q=%7B%22search%22%3A%5B%22actionDate%3A%5C%22117%7C2021-08-05%5C%22+AND+%28billIsReserved%3A%5C%22N%5C%22+OR+type%3A%5C%22AMENDMENT%5C%22%29%22%5D%7D&s=1&r=10
08/05/2021,BILL,"A bill to authorize major medical facility projects for the Department of Veterans Affairs for fiscal year 2022, and for other purposes.","Sen. Tester, Jon [D-MT]", Senate - Veterans' Affairs        ,Senate - 08/05/2021 Read twice and referred to the Committee on Veterans' Affairs. (,Introduced,https://www.congress.gov/bill/117th-congress/senate-bill/2624?q=%7B%22search%22%3A%5B%22actionDate%3A%5C%22117%7C2021-08-05%5C%22+AND+%28billIsReserved%3A%5C%22N%5C%22+OR+type%3A%5C%22AMENDMENT%5C%22%29%22%5D%7D&s=1&r=11
08/02/2021,BILL,INVEST in America Act,"Rep. DeFazio, Peter A. [D-OR-4]", House - Transportation and Infrastructure        ,Senate - 08/05/2021 Cloture motion on the measure presented in Senate. (CR ,Passed House,https://www.congress.gov/bill/117th-congress/house-bill/3684?q=%7B%22search%22%3A%5B%22actionDate%3A%5C%22117%7C2021-08-02%5C%22+AND+%28billIsReserved%3A%5C%22N%5C%22+OR+type%3A%5C%22AMENDMENT%5C%22%29%22%5D%7D&s=1&r=1
08/03/2021,LAW,"To award four congressional gold medals to the United States Capitol Police and those who protected the U.S. Capitol on January 6, 2021.","Rep. Pelosi, Nancy [D-CA-12]"," House - Financial Services; House Administration; Budget | Senate - Banking, Housing, and Urban Affairs        ",,Became Law,https://www.congress.gov/bill/117th-congress/house-bill/3325?q=%7B%22search%22%3A%5B%22actionDate%3A%5C%22117%7C2021-08-03%5C%22+AND+%28billIsReserved%3A%5C%22N%5C%22+OR+type%3A%5C%22AMENDMENT%5C%22%29%22%5D%7D&s=1&r=1
08/04/2021,LAW,"To designate the facility of the United States Postal Service located at 500 West Main Street, Suite 102 in Tupelo, Mississippi, as the ""Colonel Carlyle 'Smitty' Harris Post Office"".","Rep. Kelly, Trent [R-MS-1]", House - Oversight and Reform | Senate - Homeland Security and Governmental Affairs        ,,Became Law,https://www.congress.gov/bill/117th-congress/house-bill/208?q=%7B%22search%22%3A%5B%22actionDate%3A%5C%22117%7C2021-08-04%5C%22+AND+%28billIsReserved%3A%5C%22N%5C%22+OR+type%3A%5C%22AMENDMENT%5C%22%29%22%5D%7D&s=1&r=1
08/01/2021,BILL,INVEST in America Act,"Rep. DeFazio, Peter A. [D-OR-4]", House - Transportation and Infrastructure        ,Senate - 08/05/2021 Cloture motion on the measure presented in Senate. (CR ,Passed House,https://www.congress.gov/bill/117th-congress/house-bill/3684?q=%7B%22search%22%3A%5B%22actionDate%3A%5C%22117%7C2021-08-01%5C%22+AND+%28billIsReserved%3A%5C%22N%5C%22+OR+type%3A%5C%22AMENDMENT%5C%22%29%22%5D%7D&s=1&r=1
08/05/2021,BILL,A bill to amend the Child Care Access Means Parents in School Program under the Higher Education Act of 1965.,"Sen. Duckworth, Tammy [D-IL]"," Senate - Health, Education, Labor, and Pensions        ","Senate - 08/05/2021 Read twice and referred to the Committee on Health, Education, Labor, and Pensions. (",Introduced,https://www.congress.gov/bill/117th-congress/senate-bill/2625?q=%7B%22search%22%3A%5B%22actionDate%3A%5C%22117%7C2021-08-05%5C%22+AND+%28billIsReserved%3A%5C%22N%5C%22+OR+type%3A%5C%22AMENDMENT%5C%22%29%22%5D%7D&s=1&r=12
08/05/2021,BILL,A bill to enhance protections for election records.,"Sen. Klobuchar, Amy [D-MN]", Senate - Rules and Administration        ,Senate - 08/05/2021 Read twice and referred to the Committee on Rules and Administration. (,Introduced,https://www.congress.gov/bill/117th-congress/senate-bill/2626?q=%7B%22search%22%3A%5B%22actionDate%3A%5C%22117%7C2021-08-05%5C%22+AND+%28billIsReserved%3A%5C%22N%5C%22+OR+type%3A%5C%22AMENDMENT%5C%22%29%22%5D%7D&s=1&r=13
08/05/2021,BILL,"A bill to amend title 38, United States Code, to improve assistance for veterans with travel necessary for counseling, mental health services, health care, and others services furnished by the Department of Veterans Affairs, and for other purposes.","Sen. Tester, Jon [D-MT]", Senate - Veterans' Affairs        ,Senate - 08/05/2021 Read twice and referred to the Committee on Veterans' Affairs. (,Introduced,https://www.congress.gov/bill/117th-congress/senate-bill/2627?q=%7B%22search%22%3A%5B%22actionDate%3A%5C%22117%7C2021-08-05%5C%22+AND+%28billIsReserved%3A%5C%22N%5C%22+OR+type%3A%5C%22AMENDMENT%5C%22%29%22%5D%7D&s=1&r=14
08/05/2021,BILL,"A bill to amend the Federal Food, Drug, and Cosmetic Act with respect to safe disposal packaging and safe disposal system requirements for certain drugs.","Sen. Hassan, Maggie [D-NH]"," Senate - Health, Education, Labor, and Pensions        ","Senate - 08/05/2021 Read twice and referred to the Committee on Health, Education, Labor, and Pensions. (",Introduced,https://www.congress.gov/bill/117th-congress/senate-bill/2628?q=%7B%22search%22%3A%5B%22actionDate%3A%5C%22117%7C2021-08-05%5C%22+AND+%28billIsReserved%3A%5C%22N%5C%22+OR+type%3A%5C%22AMENDMENT%5C%22%29%22%5D%7D&s=1&r=15
08/05/2021,BILL,"A bill to establish cybercrime reporting mechanisms, and for other purposes.","Sen. Schatz, Brian [D-HI]", Senate - Judiciary        ,Senate - 08/05/2021 Read twice and referred to the Committee on the Judiciary. (,Introduced,https://www.congress.gov/bill/117th-congress/senate-bill/2629?q=%7B%22search%22%3A%5B%22actionDate%3A%5C%22117%7C2021-08-05%5C%22+AND+%28billIsReserved%3A%5C%22N%5C%22+OR+type%3A%5C%22AMENDMENT%5C%22%29%22%5D%7D&s=1&r=16
08/05/2021,BILL,"A bill to require Federal agencies to address environmental justice, to require consideration of cumulative impacts in certain permitting decisions, and for other purposes.","Sen. Booker, Cory [D-NJ]", Senate - Environment and Public Works        ,Senate - 08/05/2021 Read twice and referred to the Committee on Environment and Public Works. (,Introduced,https://www.congress.gov/bill/117th-congress/senate-bill/2630?q=%7B%22search%22%3A%5B%22actionDate%3A%5C%22117%7C2021-08-05%5C%22+AND+%28billIsReserved%3A%5C%22N%5C%22+OR+type%3A%5C%22AMENDMENT%5C%22%29%22%5D%7D&s=1&r=17
08/05/2021,BILL,"A bill to amend the Small Business Act to create a program to provide funding for organizations that support startup businesses in formation and early growth stages by providing entrepreneurs with resources and services to produce viable businesses, and for other purposes.","Sen. Booker, Cory [D-NJ]", Senate - Small Business and Entrepreneurship        ,Senate - 08/05/2021 Read twice and referred to the Committee on Small Business and Entrepreneurship. (,Introduced,https://www.congress.gov/bill/117th-congress/senate-bill/2631?q=%7B%22search%22%3A%5B%22actionDate%3A%5C%22117%7C2021-08-05%5C%22+AND+%28billIsReserved%3A%5C%22N%5C%22+OR+type%3A%5C%22AMENDMENT%5C%22%29%22%5D%7D&s=1&r=18
08/05/2021,BILL,"A bill to amend title 18, United States Code, to include doping fraud as a predicate offense for racketeering and money laundering offenses, and for other purposes.","Sen. Whitehouse, Sheldon [D-RI]", Senate - Judiciary        ,Senate - 08/05/2021 Read twice and referred to the Committee on the Judiciary. (,Introduced,https://www.congress.gov/bill/117th-congress/senate-bill/2632?q=%7B%22search%22%3A%5B%22actionDate%3A%5C%22117%7C2021-08-05%5C%22+AND+%28billIsReserved%3A%5C%22N%5C%22+OR+type%3A%5C%22AMENDMENT%5C%22%29%22%5D%7D&s=1&r=19
08/05/2021,BILL,"A bill to require the Administrator of the National Oceanic and Atmospheric Administration to award grants to certain entities for purposes of carrying out climate-resilient living shoreline projects that protect coastal communities, and for other purposes.","Sen. Murphy, Christopher [D-CT]"," Senate - Commerce, Science, and Transportation        ","Senate - 08/05/2021 Read twice and referred to the Committee on Commerce, Science, and Transportation. (",Introduced,https://www.congress.gov/bill/117th-congress/senate-bill/2633?q=%7B%22search%22%3A%5B%22actionDate%3A%5C%22117%7C2021-08-05%5C%22+AND+%28billIsReserved%3A%5C%22N%5C%22+OR+type%3A%5C%22AMENDMENT%5C%22%29%22%5D%7D&s=1&r=20
08/05/2021,BILL,A bill to amend the Higher Education Act of 1965 to direct the Secretary of Education to issue guidance and recommendations for institutions of higher education on removing criminal and juvenile justice questions from their application for admissions process.,"Sen. Schatz, Brian [D-HI]"," Senate - Health, Education, Labor, and Pensions        ","Senate - 08/05/2021 Read twice and referred to the Committee on Health, Education, Labor, and Pensions. (",Introduced,https://www.congress.gov/bill/117th-congress/senate-bill/2634?q=%7B%22search%22%3A%5B%22actionDate%3A%5C%22117%7C2021-08-05%5C%22+AND+%28billIsReserved%3A%5C%22N%5C%22+OR+type%3A%5C%22AMENDMENT%5C%22%29%22%5D%7D&s=1&r=21
08/05/2021,BILL,"A bill to require the Secretary of State to submit a plan to eliminate the backlog of passport applications due to the COVID-19 pandemic, and for other purposes.","Sen. Ossoff, Jon [D-GA]", Senate - Foreign Relations        ,Senate - 08/05/2021 Read twice and referred to the Committee on Foreign Relations. (,Introduced,https://www.congress.gov/bill/117th-congress/senate-bill/2635?q=%7B%22search%22%3A%5B%22actionDate%3A%5C%22117%7C2021-08-05%5C%22+AND+%28billIsReserved%3A%5C%22N%5C%22+OR+type%3A%5C%22AMENDMENT%5C%22%29%22%5D%7D&s=1&r=22
08/02/2021,BILL,Residential Substance Use Disorder Treatment Act of 2021,"Sen. Cornyn, John [R-TX]", Senate - Judiciary        ,House - 08/03/2021 Held at the desk. (,Passed Senate,https://www.congress.gov/bill/117th-congress/senate-bill/1046?q=%7B%22search%22%3A%5B%22actionDate%3A%5C%22117%7C2021-08-02%5C%22+AND+%28billIsReserved%3A%5C%22N%5C%22+OR+type%3A%5C%22AMENDMENT%5C%22%29%22%5D%7D&s=1&r=2
08/02/2021,BILL,Promoting Physical Activity for Americans Act,"Sen. Brown, Sherrod [D-OH]"," Senate - Health, Education, Labor, and Pensions        ",House - 08/03/2021 Held at the desk. (,Passed Senate,https://www.congress.gov/bill/117th-congress/senate-bill/1301?q=%7B%22search%22%3A%5B%22actionDate%3A%5C%22117%7C2021-08-02%5C%22+AND+%28billIsReserved%3A%5C%22N%5C%22+OR+type%3A%5C%22AMENDMENT%5C%22%29%22%5D%7D&s=1&r=3
08/02/2021,BILL,"A bill to designate the area between the intersections of 16th Street, Northwest and Fuller Street, Northwest and 16th Street, Northwest and Euclid Street, Northwest in Washington, District of Columbia, as ""Oswaldo Paya Way"".","Sen. Cruz, Ted [R-TX]", Senate - Homeland Security and Governmental Affairs        ,House - 08/03/2021 Held at the desk. (,Passed Senate,https://www.congress.gov/bill/117th-congress/senate-bill/2045?q=%7B%22search%22%3A%5B%22actionDate%3A%5C%22117%7C2021-08-02%5C%22+AND+%28billIsReserved%3A%5C%22N%5C%22+OR+type%3A%5C%22AMENDMENT%5C%22%29%22%5D%7D&s=1&r=4
08/02/2021,BILL,"A bill to amend titles 23 and 49, United States Code, with respect to bikeshare projects, and for other purposes.","Sen. Wyden, Ron [D-OR]"," Senate - Banking, Housing, and Urban Affairs        ","Senate - 08/02/2021 Read twice and referred to the Committee on Banking, Housing, and Urban Affairs. (",Introduced,https://www.congress.gov/bill/117th-congress/senate-bill/2579?q=%7B%22search%22%3A%5B%22actionDate%3A%5C%22117%7C2021-08-02%5C%22+AND+%28billIsReserved%3A%5C%22N%5C%22+OR+type%3A%5C%22AMENDMENT%5C%22%29%22%5D%7D&s=1&r=5
08/02/2021,BILL,"A bill to direct the Secretary of the Interior and the Secretary of Agriculture to make free National Parks and Federal Recreational Lands Passes available to members of the Armed Forces, and for other purposes.","Sen. Sinema, Kyrsten [D-AZ]", Senate - Energy and Natural Resources        ,Senate - 08/02/2021 Read twice and referred to the Committee on Energy and Natural Resources. (,Introduced,https://www.congress.gov/bill/117th-congress/senate-bill/2580?q=%7B%22search%22%3A%5B%22actionDate%3A%5C%22117%7C2021-08-02%5C%22+AND+%28billIsReserved%3A%5C%22N%5C%22+OR+type%3A%5C%22AMENDMENT%5C%22%29%22%5D%7D&s=1&r=6
08/02/2021,BILL,A bill to amend the Internal Revenue Code of 1986 to provide relief for taxpayers affected by disasters or other critical events.,"Sen. Portman, Rob [R-OH]", Senate - Finance        ,Senate - 08/02/2021 Read twice and referred to the Committee on Finance. (,Introduced,https://www.congress.gov/bill/117th-congress/senate-bill/2581?q=%7B%22search%22%3A%5B%22actionDate%3A%5C%22117%7C2021-08-02%5C%22+AND+%28billIsReserved%3A%5C%22N%5C%22+OR+type%3A%5C%22AMENDMENT%5C%22%29%22%5D%7D&s=1&r=7
08/02/2021,RESOLUTION,"A resolution relating to the death of the Honorable Carl Levin, former Senator for the State of Michigan.","Sen. Stabenow, Debbie [D-MI]",,Senate - 08/02/2021 Message on Senate action sent to the House. (,Agreed to in Senate,https://www.congress.gov/bill/117th-congress/senate-resolution/333?q=%7B%22search%22%3A%5B%22actionDate%3A%5C%22117%7C2021-08-02%5C%22+AND+%28billIsReserved%3A%5C%22N%5C%22+OR+type%3A%5C%22AMENDMENT%5C%22%29%22%5D%7D&s=1&r=8
08/02/2021,AMENDMENT,,,,,,https://www.congress.gov/search?q=%7B%22congress%22%3A%22all%22%2C%22source%22%3A%22legislation%22%2C%22search%22%3A%22actionDate%3A%5C%22117%7C2021-08-02%5C%22+AND+%28billIsReserved%3A%5C%22N%5C%22+OR+type%3A%5C%22AMENDMENT%5C%22%29%22%7D&pageSort=documentNumber%3Aasc
08/02/2021,AMENDMENT,,Record Vote Number: 291,,", under the order of 8/2/2021, having achieved 60 votes in the affirmative, was agreed to in Senate by Yea-Nay Vote. 90 - 7. ",,https://www.congress.gov/search?q=%7B%22congress%22%3A%22all%22%2C%22source%22%3A%22legislation%22%2C%22search%22%3A%22actionDate%3A%5C%22117%7C2021-08-02%5C%22+AND+%28billIsReserved%3A%5C%22N%5C%22+OR+type%3A%5C%22AMENDMENT%5C%22%29%22%7D&pageSort=documentNumber%3Aasc
08/02/2021,AMENDMENT,,,,,,https://www.congress.gov/search?q=%7B%22congress%22%3A%22all%22%2C%22source%22%3A%22legislation%22%2C%22search%22%3A%22actionDate%3A%5C%22117%7C2021-08-02%5C%22+AND+%28billIsReserved%3A%5C%22N%5C%22+OR+type%3A%5C%22AMENDMENT%5C%22%29%22%7D&pageSort=documentNumber%3Aasc
