date,type,title,sponsor,committees,latest_action,tracker,url
08/04/2021,BILL,Native American Language Resource Center Act of 2021,"Sen. Schatz, Brian [D-HI]", Senate - Indian Affairs        ,Senate - 08/04/2021 Committee on Indian Affairs. Ordered to be reported with an amendment in the nature of a substitute favorably. (,Introduced,https://www.congress.gov/bill/117th-congress/senate-bill/989?q=%7B%22search%22%3A%5B%22actionDate%3A%5C%22117%7C2021-08-04%5C%22+AND+%28billIsReserved%3A%5C%22N%5C%22+OR+type%3A%5C%22AMENDMENT%5C%22%29%22%5D%7D&s=1&r=18
08/04/2021,BILL,Durbin Feeling Native American Languages Act of 2021,"Sen. Schatz, Brian [D-HI]", Senate - Indian Affairs        ,Senate - 08/04/2021 Committee on Indian Affairs. Ordered to be reported without amendment favorably. (,Introduced,https://www.congress.gov/bill/117th-congress/senate-bill/1402?q=%7B%22search%22%3A%5B%22actionDate%3A%5C%22117%7C2021-08-04%5C%22+AND+%28billIsReserved%3A%5C%22N%5C%22+OR+type%3A%5C%22AMENDMENT%5C%22%29%22%5D%7D&s=1&r=19
08/04/2021,BILL,Secure Equipment Act of 2021,"Sen. Rubio, Marco [R-FL]"," Senate - Commerce, Science, and Transportation        ","Senate - 08/04/2021 Committee on Commerce, Science, and Transportation. Ordered to be reported with an amendment in the nature of a substitute favorably. (",Introduced,https://www.congress.gov/bill/117th-congress/senate-bill/1790?q=%7B%22search%22%3A%5B%22actionDate%3A%5C%22117%7C2021-08-04%5C%22+AND+%28billIsReserved%3A%5C%22N%5C%22+OR+type%3A%5C%22AMENDMENT%5C%22%29%22%5D%7D&s=1&r=20
08/04/2021,BILL,Protecting Indian Tribes from Scams Act,"Sen. Lujan, Ben Ray [D-NM]"," Senate - Commerce, Science, and Transportation        ","Senate - 08/04/2021 Committee on Commerce, Science, and Transportation. Ordered to be reported with an amendment in the nature of a substitute favorably. (",Introduced,https://www.congress.gov/bill/117th-congress/senate-bill/1880?q=%7B%22search%22%3A%5B%22actionDate%3A%5C%22117%7C2021-08-04%5C%22+AND+%28billIsReserved%3A%5C%22N%5C%22+OR+type%3A%5C%22AMENDMENT%5C%22%29%22%5D%7D&s=1&r=21
08/04/2021,BILL,Minority Business Development Act of 2021,"Sen. Cardin, Benjamin L. [D-MD]"," Senate - Commerce, Science, and Transportation        ","Senate - 08/04/2021 Committee on Commerce, Science, and Transportation. Ordered to be reported with an amendment in the nature of a substitute favorably. (",Introduced,https://www.congress.gov/bill/117th-congress/senate-bill/2068?q=%7B%22search%22%3A%5B%22actionDate%3A%5C%22117%7C2021-08-04%5C%22+AND+%28billIsReserved%3A%5C%22N%5C%22+OR+type%3A%5C%22AMENDMENT%5C%22%29%22%5D%7D&s=1&r=22
08/04/2021,BILL,CADETS Act,"Sen. Peters, Gary C. [D-MI]"," Senate - Commerce, Science, and Transportation        ","Senate - 08/04/2021 Committee on Commerce, Science, and Transportation. Ordered to be reported without amendment favorably. (",Introduced,https://www.congress.gov/bill/117th-congress/senate-bill/2299?q=%7B%22search%22%3A%5B%22actionDate%3A%5C%22117%7C2021-08-04%5C%22+AND+%28billIsReserved%3A%5C%22N%5C%22+OR+type%3A%5C%22AMENDMENT%5C%22%29%22%5D%7D&s=1&r=23
08/04/2021,BILL,Cybersecurity Opportunity Act,"Sen. Ossoff, Jon [D-GA]", Senate - Homeland Security and Governmental Affairs        ,Senate - 08/04/2021 Committee on Homeland Security and Governmental Affairs. Ordered to be reported with an amendment in the nature of a substitute favorably. (,Introduced,https://www.congress.gov/bill/117th-congress/senate-bill/2305?q=%7B%22search%22%3A%5B%22actionDate%3A%5C%22117%7C2021-08-04%5C%22+AND+%28billIsReserved%3A%5C%22N%5C%22+OR+type%3A%5C%22AMENDMENT%5C%22%29%22%5D%7D&s=1&r=24
08/06/2021,LAW,"To designate the facility of the United States Postal Service located at 500 West Main Street, Suite 102 in Tupelo, Mississippi, as the ""Colonel Carlyle 'Smitty' Harris Post Office"".","Rep. Kelly, Trent [R-MS-1]", House - Oversight and Reform | Senate - Homeland Security and Governmental Affairs        ,,Became Law,https://www.congress.gov/bill/117th-congress/house-bill/208?q=%7B%22search%22%3A%5B%22actionDate%3A%5C%22117%7C2021-08-06%5C%22+AND+%28billIsReserved%3A%5C%22N%5C%22+OR+type%3A%5C%22AMENDMENT%5C%22%29%22%5D%7D&s=1&r=1
08/05/2021,BILL,A bill to enhance protections for election records.,"Sen. Klobuchar, Amy [D-MN]", Senate - Rules and Administration        ,Senate - 08/05/2021 Read twice and referred to the Committee on Rules and Administration. (,Introduced,https://www.congress.gov/bill/117th-congress/senate-bill/2626?q=%7B%22search%22%3A%5B%22actionDate%3A%5C%22117%7C2021-08-05%5C%22+AND+%28billIsReserved%3A%5C%22N%5C%22+OR+type%3A%5C%22AMENDMENT%5C%22%29%22%5D%7D&s=1&r=13
08/05/2021,BILL,"A bill to amend title 38, United States Code, to improve assistance for veterans with travel necessary for counseling, mental health services, health care, and others services furnished by the Department of Veterans Affairs, and for other purposes.","Sen. Tester, Jon [D-MT]", Senate - Veterans' Affairs        ,Senate - 08/05/2021 Read twice and referred to the Committee on Veterans' Affairs. (,Introduced,https://www.congress.gov/bill/117th-congress/senate-bill/2627?q=%7B%22search%22%3A%5B%22actionDate%3A%5C%22117%7C2021-08-05%5C%22+AND+%28billIsReserved%3A%5C%22N%5C%22+OR+type%3A%5C%22AMENDMENT%5C%22%29%22%5D%7D&s=1&r=14
08/05/2021,BILL,"A bill to amend the Federal Food, Drug, and Cosmetic Act with respect to safe disposal packaging and safe disposal system requirements for certain drugs.","Sen. Hassan, Maggie [D-NH]"," Senate - Health, Education, Labor, and Pensions        ","Senate - 08/05/2021 Read twice and referred to the Committee on Health, Education, Labor, and Pensions. (",Introduced,https://www.congress.gov/bill/117th-congress/senate-bill/2628?q=%7B%22search%22%3A%5B%22actionDate%3A%5C%22117%7C2021-08-05%5C%22+AND+%28billIsReserved%3A%5C%22N%5C%22+OR+type%3A%5C%22AMENDMENT%5C%22%29%22%5D%7D&s=1&r=15
08/05/2021,BILL,"A bill to establish cybercrime reporting mechanisms, and for other purposes.","Sen. Schatz, Brian [D-HI]", Senate - Judiciary        ,Senate - 08/05/2021 Read twice and referred to the Committee on the Judiciary. (,Introduced,https://www.congress.gov/bill/117th-congress/senate-bill/2629?q=%7B%22search%22%3A%5B%22actionDate%3A%5C%22117%7C2021-08-05%5C%22+AND+%28billIsReserved%3A%5C%22N%5C%22+OR+type%3A%5C%22AMENDMENT%5C%22%29%22%5D%7D&s=1&r=16
08/05/2021,BILL,"A bill to require Federal agencies to address environmental justice, to require consideration of cumulative impacts in certain permitting decisions, and for other purposes.","Sen. Booker, Cory [D-NJ]", Senate - Environment and Public Works        ,Senate - 08/05/2021 Read twice and referred to the Committee on Environment and Public Works. (,Introduced,https://www.congress.gov/bill/117th-congress/senate-bill/2630?q=%7B%22search%22%3A%5B%22actionDate%3A%5C%22117%7C2021-08-05%5C%22+AND+%28billIsReserved%3A%5C%22N%5C%22+OR+type%3A%5C%22AMENDMENT%5C%22%29%22%5D%7D&s=1&r=17
08/05/2021,BILL,"A bill to amend the Small Business Act to create a program to provide funding for organizations that support startup businesses in formation and early growth stages by providing entrepreneurs with resources and services to produce viable businesses, and for other purposes.","Sen. Booker, Cory [D-NJ]", Senate - Small Business and Entrepreneurship        ,Senate - 08/05/2021 Read twice and referred to the Committee on Small Business and Entrepreneurship. (,Introduced,https://www.congress.gov/bill/117th-congress/senate-bill/2631?q=%7B%22search%22%3A%5B%22actionDate%3A%5C%22117%7C2021-08-05%5C%22+AND+%28billIsReserved%3A%5C%22N%5C%22+OR+type%3A%5C%22AMENDMENT%5C%22%29%22%5D%7D&s=1&r=18
08/05/2021,BILL,"A bill to amend title 18, United States Code, to include doping fraud as a predicate offense for racketeering and money laundering offenses, and for other purposes.","Sen. Whitehouse, Sheldon [D-RI]", Senate - Judiciary        ,Senate - 08/05/2021 Read twice and referred to the Committee on the Judiciary. (,Introduced,https://www.congress.gov/bill/117th-congress/senate-bill/2632?q=%7B%22search%22%3A%5B%22actionDate%3A%5C%22117%7C2021-08-05%5C%22+AND+%28billIsReserved%3A%5C%22N%5C%22+OR+type%3A%5C%22AMENDMENT%5C%22%29%22%5D%7D&s=1&r=19
08/05/2021,BILL,"A bill to require the Administrator of the National Oceanic and Atmospheric Administration to award grants to certain entities for purposes of carrying out climate-resilient living shoreline projects that protect coastal communities, and for other purposes.","Sen. Murphy, Christopher [D-CT]"," Senate - Commerce, Science, and Transportation        ","Senate - 08/05/2021 Read twice and referred to the Committee on Commerce, Science, and Transportation. (",Introduced,https://www.congress.gov/bill/117th-congress/senate-bill/2633?q=%7B%22search%22%3A%5B%22actionDate%3A%5C%22117%7C2021-08-05%5C%22+AND+%28billIsReserved%3A%5C%22N%5C%22+OR+type%3A%5C%22AMENDMENT%5C%22%29%22%5D%7D&s=1&r=20
08/05/2021,BILL,A bill to amend the Higher Education Act of 1965 to direct the Secretary of Education to issue guidance and recommendations for institutions of higher education on removing criminal and juvenile justice questions from their application for admissions process.,"Sen. Schatz, Brian [D-HI]"," Senate - Health, Education, Labor, and Pensions        ","Senate - 08/05/2021 Read twice and referred to the Committee on Health, Education, Labor, and Pensions. (",Introduced,https://www.congress.gov/bill/117th-congress/senate-bill/2634?q=%7B%22search%22%3A%5B%22actionDate%3A%5C%22117%7C2021-08-05%5C%22+AND+%28billIsReserved%3A%5C%22N%5C%22+OR+type%3A%5C%22AMENDMENT%5C%22%29%22%5D%7D&s=1&r=21
08/05/2021,BILL,"A bill to require the Secretary of State to submit a plan to eliminate the backlog of passport applications due to the COVID-19 pandemic, and for other purposes.","Sen. Ossoff, Jon [D-GA]", Senate - Foreign Relations        ,Senate - 08/05/2021 Read twice and referred to the Committee on Foreign Relations. (,Introduced,https://www.congress.gov/bill/117th-congress/senate-bill/2635?q=%7B%22search%22%3A%5B%22actionDate%3A%5C%22117%7C2021-08-05%5C%22+AND+%28billIsReserved%3A%5C%22N%5C%22+OR+type%3A%5C%22AMENDMENT%5C%22%29%22%5D%7D&s=1&r=22
08/05/2021,BILL,"A bill to amend the Research Facilities Act and the Agricultural Research, Extension, and Education Reform Act of 1998 to address deferred maintenance at agricultural research facilities, and for other purposes.","Sen. Hirono, Mazie [D-HI]"," Senate - Agriculture, Nutrition, and Forestry        ","Senate - 08/05/2021 Read twice and referred to the Committee on Agriculture, Nutrition, and Forestry. (",Introduced,https://www.congress.gov/bill/117th-congress/senate-bill/2636?q=%7B%22search%22%3A%5B%22actionDate%3A%5C%22117%7C2021-08-05%5C%22+AND+%28billIsReserved%3A%5C%22N%5C%22+OR+type%3A%5C%22AMENDMENT%5C%22%29%22%5D%7D&s=1&r=23
08/03/2021,BILL,To amend the Internal Revenue Code of 1986 to provide an additional deduction for the cost of certain materials purchased directly from a domestic smelter or processor.,"Rep. Stauber, Pete [R-MN-8]", House - Ways and Means        ,House - 08/03/2021 Referred to the House Committee on Ways and Means. (,Introduced,https://www.congress.gov/bill/117th-congress/house-bill/4932?q=%7B%22search%22%3A%5B%22actionDate%3A%5C%22117%7C2021-08-03%5C%22+AND+%28billIsReserved%3A%5C%22N%5C%22+OR+type%3A%5C%22AMENDMENT%5C%22%29%22%5D%7D&s=1&r=32
08/03/2021,BILL,"To amend the Older Americans Act of 1965 to establish a competitive grant program to enable area agencies on aging and local nutrition service providers to purchase, customize, or repair vehicles with hot and cold food storage for delivering meals to older individuals through the Congregate Nutrition Program or the Home-Delivered Nutrition Program.","Rep. Vela, Filemon [D-TX-34]", House - Education and Labor        ,House - 08/03/2021 Referred to the House Committee on Education and Labor. (,Introduced,https://www.congress.gov/bill/117th-congress/house-bill/4933?q=%7B%22search%22%3A%5B%22actionDate%3A%5C%22117%7C2021-08-03%5C%22+AND+%28billIsReserved%3A%5C%22N%5C%22+OR+type%3A%5C%22AMENDMENT%5C%22%29%22%5D%7D&s=1&r=33
08/03/2021,BILL,"To establish the National Equal Pay Enforcement Task Force, and for other purposes.","Rep. Williams, Nikema [D-GA-5]", House - Education and Labor; Oversight and Reform        ,"House - 08/03/2021 Referred to the Committee on Education and Labor, and in addition to the Committee on Oversight and Reform, for a period to be subsequently determined by the Speaker, in each case for consideration of such provisions as fall within the jurisdiction of the committee... (",Introduced,https://www.congress.gov/bill/117th-congress/house-bill/4934?q=%7B%22search%22%3A%5B%22actionDate%3A%5C%22117%7C2021-08-03%5C%22+AND+%28billIsReserved%3A%5C%22N%5C%22+OR+type%3A%5C%22AMENDMENT%5C%22%29%22%5D%7D&s=1&r=34
08/03/2021,BILL,"To amend title 10, United States Code, to clarify the roles of surface warfare officers of the Navy, and for other purposes.","Rep. Wittman, Robert J. [R-VA-1]", House - Armed Services        ,House - 08/03/2021 Referred to the House Committee on Armed Services. (,Introduced,https://www.congress.gov/bill/117th-congress/house-bill/4935?q=%7B%22search%22%3A%5B%22actionDate%3A%5C%22117%7C2021-08-03%5C%22+AND+%28billIsReserved%3A%5C%22N%5C%22+OR+type%3A%5C%22AMENDMENT%5C%22%29%22%5D%7D&s=1&r=35
08/03/2021,BILL,For the relief of Rosa Aurora Sabido-Valdivia.,"Rep. Neguse, Joe [D-CO-2]", House - Judiciary        ,House - 08/03/2021 Referred to the House Committee on the Judiciary. (,Introduced,https://www.congress.gov/bill/117th-congress/house-bill/4936?q=%7B%22search%22%3A%5B%22actionDate%3A%5C%22117%7C2021-08-03%5C%22+AND+%28billIsReserved%3A%5C%22N%5C%22+OR+type%3A%5C%22AMENDMENT%5C%22%29%22%5D%7D&s=1&r=36
08/03/2021,CONCURRENT RESOLUTION,Recognizing the significance of equal pay and the disparity in wages paid to men and to Black women.,"Rep. Adams, Alma S. [D-NC-12]", House - Education and Labor        ,House - 08/03/2021 Referred to the House Committee on Education and Labor. (,Introduced,https://www.congress.gov/bill/117th-congress/house-concurrent-resolution/46?q=%7B%22search%22%3A%5B%22actionDate%3A%5C%22117%7C2021-08-03%5C%22+AND+%28billIsReserved%3A%5C%22N%5C%22+OR+type%3A%5C%22AMENDMENT%5C%22%29%22%5D%7D&s=1&r=37
08/03/2021,BILL,Residential Substance Use Disorder Treatment Act of 2021,"Sen. Cornyn, John [R-TX]", Senate - Judiciary        ,House - 08/03/2021 Held at the desk. (,Passed Senate,https://www.congress.gov/bill/117th-congress/senate-bill/1046?q=%7B%22search%22%3A%5B%22actionDate%3A%5C%22117%7C2021-08-03%5C%22+AND+%28billIsReserved%3A%5C%22N%5C%22+OR+type%3A%5C%22AMENDMENT%5C%22%29%22%5D%7D&s=1&r=38
08/03/2021,BILL,Promoting Physical Activity for Americans Act,"Sen. Brown, Sherrod [D-OH]"," Senate - Health, Education, Labor, and Pensions        ",House - 08/03/2021 Held at the desk. (,Passed Senate,https://www.congress.gov/bill/117th-congress/senate-bill/1301?q=%7B%22search%22%3A%5B%22actionDate%3A%5C%22117%7C2021-08-03%5C%22+AND+%28billIsReserved%3A%5C%22N%5C%22+OR+type%3A%5C%22AMENDMENT%5C%22%29%22%5D%7D&s=1&r=39
08/03/2021,BILL,Pregnant Workers Fairness Act,"Sen. Casey, Robert P., Jr. [D-PA]"," Senate - Health, Education, Labor, and Pensions        ","Senate - 08/03/2021 Committee on Health, Education, Labor, and Pensions. Ordered to be reported with an amendment in the nature of a substitute favorably. (",Introduced,https://www.congress.gov/bill/117th-congress/senate-bill/1486?q=%7B%22search%22%3A%5B%22actionDate%3A%5C%22117%7C2021-08-03%5C%22+AND+%28billIsReserved%3A%5C%22N%5C%22+OR+type%3A%5C%22AMENDMENT%5C%22%29%22%5D%7D&s=1&r=40
08/03/2021,BILL,STANDUP Act of 2021,"Sen. Hassan, Margaret Wood [D-NH]"," Senate - Health, Education, Labor, and Pensions        ","Senate - 08/03/2021 Committee on Health, Education, Labor, and Pensions. Ordered to be reported with an amendment in the nature of a substitute favorably. (",Introduced,https://www.congress.gov/bill/117th-congress/senate-bill/1543?q=%7B%22search%22%3A%5B%22actionDate%3A%5C%22117%7C2021-08-03%5C%22+AND+%28billIsReserved%3A%5C%22N%5C%22+OR+type%3A%5C%22AMENDMENT%5C%22%29%22%5D%7D&s=1&r=41
08/03/2021,BILL,"A bill to designate the area between the intersections of 16th Street, Northwest and Fuller Street, Northwest and 16th Street, Northwest and Euclid Street, Northwest in Washington, District of Columbia, as ""Oswaldo Paya Way"".","Sen. Cruz, Ted [R-TX]", Senate - Homeland Security and Governmental Affairs        ,House - 08/03/2021 Held at the desk. (,Passed Senate,https://www.congress.gov/bill/117th-congress/senate-bill/2045?q=%7B%22search%22%3A%5B%22actionDate%3A%5C%22117%7C2021-08-03%5C%22+AND+%28billIsReserved%3A%5C%22N%5C%22+OR+type%3A%5C%22AMENDMENT%5C%22%29%22%5D%7D&s=1&r=42
08/03/2021,BILL,21st Century Assistive Technology Act,"Sen. Casey, Bob [D-PA]"," Senate - Health, Education, Labor, and Pensions        ",Senate - 08/07/2021 Placed on Senate Legislative Calendar under General Orders. Calendar No. 121. (,Introduced,https://www.congress.gov/bill/117th-congress/senate-bill/2401?q=%7B%22search%22%3A%5B%22actionDate%3A%5C%22117%7C2021-08-03%5C%22+AND+%28billIsReserved%3A%5C%22N%5C%22+OR+type%3A%5C%22AMENDMENT%5C%22%29%22%5D%7D&s=1&r=43
08/04/2021,BILL,Restoring Brand USA Act,"Sen. Klobuchar, Amy [D-MN]"," Senate - Commerce, Science, and Transportation        ","Senate - 08/04/2021 Committee on Commerce, Science, and Transportation. Ordered to be reported with an amendment favorably. (",Introduced,https://www.congress.gov/bill/117th-congress/senate-bill/2424?q=%7B%22search%22%3A%5B%22actionDate%3A%5C%22117%7C2021-08-04%5C%22+AND+%28billIsReserved%3A%5C%22N%5C%22+OR+type%3A%5C%22AMENDMENT%5C%22%29%22%5D%7D&s=1&r=25
08/04/2021,BILL,DHS Industrial Control Systems Capabilities Enhancement Act of 2021,"Sen. Peters, Gary [D-MI]", Senate - Homeland Security and Governmental Affairs        ,Senate - 08/04/2021 Committee on Homeland Security and Governmental Affairs. Ordered to be reported without amendment favorably. (,Introduced,https://www.congress.gov/bill/117th-congress/senate-bill/2439?q=%7B%22search%22%3A%5B%22actionDate%3A%5C%22117%7C2021-08-04%5C%22+AND+%28billIsReserved%3A%5C%22N%5C%22+OR+type%3A%5C%22AMENDMENT%5C%22%29%22%5D%7D&s=1&r=26
08/04/2021,BILL,State and Local Government Cybersecurity Act of 2021,"Sen. Peters, Gary [D-MI]", Senate - Homeland Security and Governmental Affairs        ,Senate - 08/04/2021 Committee on Homeland Security and Governmental Affairs. Ordered to be reported with an amendment in the nature of a substitute favorably. (,Introduced,https://www.congress.gov/bill/117th-congress/senate-bill/2520?q=%7B%22search%22%3A%5B%22actionDate%3A%5C%22117%7C2021-08-04%5C%22+AND+%28billIsReserved%3A%5C%22N%5C%22+OR+type%3A%5C%22AMENDMENT%5C%22%29%22%5D%7D&s=1&r=27
08/04/2021,BILL,Domains Critical to Homeland Security Act,"Sen. Portman, Rob [R-OH]", Senate - Homeland Security and Governmental Affairs        ,Senate - 08/04/2021 Committee on Homeland Security and Governmental Affairs. Ordered to be reported without amendment favorably. (,Introduced,https://www.congress.gov/bill/117th-congress/senate-bill/2525?q=%7B%22search%22%3A%5B%22actionDate%3A%5C%22117%7C2021-08-04%5C%22+AND+%28billIsReserved%3A%5C%22N%5C%22+OR+type%3A%5C%22AMENDMENT%5C%22%29%22%5D%7D&s=1&r=28
08/04/2021,BILL,AI Training Act,"Sen. Peters, Gary [D-MI]", Senate - Homeland Security and Governmental Affairs        ,Senate - 08/04/2021 Committee on Homeland Security and Governmental Affairs. Ordered to be reported without amendment favorably. (,Introduced,https://www.congress.gov/bill/117th-congress/senate-bill/2551?q=%7B%22search%22%3A%5B%22actionDate%3A%5C%22117%7C2021-08-04%5C%22+AND+%28billIsReserved%3A%5C%22N%5C%22+OR+type%3A%5C%22AMENDMENT%5C%22%29%22%5D%7D&s=1&r=29
08/04/2021,BILL,Deepfake Task Force Act,"Sen. Portman, Rob [R-OH]", Senate - Homeland Security and Governmental Affairs        ,Senate - 08/04/2021 Committee on Homeland Security and Governmental Affairs. Ordered to be reported without amendment favorably. (,Introduced,https://www.congress.gov/bill/117th-congress/senate-bill/2559?q=%7B%22search%22%3A%5B%22actionDate%3A%5C%22117%7C2021-08-04%5C%22+AND+%28billIsReserved%3A%5C%22N%5C%22+OR+type%3A%5C%22AMENDMENT%5C%22%29%22%5D%7D&s=1&r=30
08/04/2021,BILL,"A bill to address prescription drug shortages and improve the quality of prescription drugs, and for other purposes.","Sen. Cardin, Ben [D-MD]"," Senate - Health, Education, Labor, and Pensions        ","Senate - 08/04/2021 Read twice and referred to the Committee on Health, Education, Labor, and Pensions. (",Introduced,https://www.congress.gov/bill/117th-congress/senate-bill/2595?q=%7B%22search%22%3A%5B%22actionDate%3A%5C%22117%7C2021-08-04%5C%22+AND+%28billIsReserved%3A%5C%22N%5C%22+OR+type%3A%5C%22AMENDMENT%5C%22%29%22%5D%7D&s=1&r=31
08/04/2021,BILL,A bill to amend the Higher Education Act of 1965 to provide for Federal student loan reform.,"Sen. Rubio, Marco [R-FL]"," Senate - Health, Education, Labor, and Pensions        ","Senate - 08/04/2021 Read twice and referred to the Committee on Health, Education, Labor, and Pensions. (",Introduced,https://www.congress.gov/bill/117th-congress/senate-bill/2596?q=%7B%22search%22%3A%5B%22actionDate%3A%5C%22117%7C2021-08-04%5C%22+AND+%28billIsReserved%3A%5C%22N%5C%22+OR+type%3A%5C%22AMENDMENT%5C%22%29%22%5D%7D&s=1&r=32
08/04/2021,BILL,"A bill to amend the Animal Health Protection Act with respect to the importation of live dogs, and for other purposes.","Sen. Grassley, Charles [R-IA]"," Senate - Agriculture, Nutrition, and Forestry        ","Senate - 08/04/2021 Read twice and referred to the Committee on Agriculture, Nutrition, and Forestry. (",Introduced,https://www.congress.gov/bill/117th-congress/senate-bill/2597?q=%7B%22search%22%3A%5B%22actionDate%3A%5C%22117%7C2021-08-04%5C%22+AND+%28billIsReserved%3A%5C%22N%5C%22+OR+type%3A%5C%22AMENDMENT%5C%22%29%22%5D%7D&s=1&r=33
08/04/2021,BILL,"A bill to amend title 11, United States Code, to improve the treatment of student loans in bankruptcy, and for other purposes.","Sen. Durbin, Richard [D-IL]", Senate - Judiciary        ,Senate - 08/04/2021 Read twice and referred to the Committee on the Judiciary. (,Introduced,https://www.congress.gov/bill/117th-congress/senate-bill/2598?q=%7B%22search%22%3A%5B%22actionDate%3A%5C%22117%7C2021-08-04%5C%22+AND+%28billIsReserved%3A%5C%22N%5C%22+OR+type%3A%5C%22AMENDMENT%5C%22%29%22%5D%7D&s=1&r=34
08/04/2021,BILL,"Agriculture, Rural Development, Food and Drug Administration, and Related Agencies Appropriations Act, 2022","Sen. Baldwin, Tammy [D-WI]", Senate - Appropriations        ,Senate - 08/04/2021 Placed on Senate Legislative Calendar under General Orders. Calendar No. 113. (,Introduced,https://www.congress.gov/bill/117th-congress/senate-bill/2599?q=%7B%22search%22%3A%5B%22actionDate%3A%5C%22117%7C2021-08-04%5C%22+AND+%28billIsReserved%3A%5C%22N%5C%22+OR+type%3A%5C%22AMENDMENT%5C%22%29%22%5D%7D&s=1&r=35
08/04/2021,BILL,A bill to establish the Refund to Rainy Day Savings Program.,"Sen. Booker, Cory [D-NJ]"," Senate - Health, Education, Labor, and Pensions        ","Senate - 08/04/2021 Read twice and referred to the Committee on Health, Education, Labor, and Pensions. (",Introduced,https://www.congress.gov/bill/117th-congress/senate-bill/2600?q=%7B%22search%22%3A%5B%22actionDate%3A%5C%22117%7C2021-08-04%5C%22+AND+%28billIsReserved%3A%5C%22N%5C%22+OR+type%3A%5C%22AMENDMENT%5C%22%29%22%5D%7D&s=1&r=36
08/06/2021,LAW,"To designate the facility of the United States Postal Service located at 1101 Charlotte Street in Georgetown, South Carolina, as the ""Joseph Hayne Rainey Memorial Post Office Building"".","Rep. Rice, Tom [R-SC-7]", House - Oversight and Reform | Senate - Homeland Security and Governmental Affairs        ,,Became Law,https://www.congress.gov/bill/117th-congress/house-bill/264?q=%7B%22search%22%3A%5B%22actionDate%3A%5C%22117%7C2021-08-06%5C%22+AND+%28billIsReserved%3A%5C%22N%5C%22+OR+type%3A%5C%22AMENDMENT%5C%22%29%22%5D%7D&s=1&r=2
08/06/2021,LAW,"To designate the facility of the United States Postal Service located at 229 Minnetonka Avenue South in Wayzata, Minnesota, as the ""Jim Ramstad Post Office"".","Rep. Phillips, Dean [D-MN-3]", House - Oversight and Reform | Senate - Homeland Security and Governmental Affairs        ,,Became Law,https://www.congress.gov/bill/117th-congress/house-bill/772?q=%7B%22search%22%3A%5B%22actionDate%3A%5C%22117%7C2021-08-06%5C%22+AND+%28billIsReserved%3A%5C%22N%5C%22+OR+type%3A%5C%22AMENDMENT%5C%22%29%22%5D%7D&s=1&r=3
08/06/2021,LAW,DEBAR Act of 2021,"Rep. Latta, Robert E. [R-OH-5]", House - Energy and Commerce; Judiciary | Senate - Judiciary        ,,Became Law,https://www.congress.gov/bill/117th-congress/house-bill/1002?q=%7B%22search%22%3A%5B%22actionDate%3A%5C%22117%7C2021-08-06%5C%22+AND+%28billIsReserved%3A%5C%22N%5C%22+OR+type%3A%5C%22AMENDMENT%5C%22%29%22%5D%7D&s=1&r=4
08/06/2021,BILL,Puppies Assisting Wounded Servicemembers for Veterans Therapy Act,"Rep. Stivers, Steve [R-OH-15]", House - Veterans' Affairs | Senate - Veterans' Affairs        ,Senate - 08/06/2021 Passed Senate without amendment by Voice Vote. (,Passed Senate,https://www.congress.gov/bill/117th-congress/house-bill/1448?q=%7B%22search%22%3A%5B%22actionDate%3A%5C%22117%7C2021-08-06%5C%22+AND+%28billIsReserved%3A%5C%22N%5C%22+OR+type%3A%5C%22AMENDMENT%5C%22%29%22%5D%7D&s=1&r=5
