date,type,title,sponsor,committees,latest_action,tracker,url
11/30/2021,RESOLUTION,"Recognizing the 75th anniversary of United Spinal Association, a leading national advocacy organization that is dedicated to promoting the independence and enhancing the quality of life of all people living with spinal cord injuries and neurological disorders, including veterans, and providing support and information to their loved ones, care providers, and personal support networks.","Rep. Meng, Grace [D-NY-6]", House - Energy and Commerce        ,House - 11/30/2021 Referred to the House Committee on Energy and Commerce. (,Introduced,https://www.congress.gov/bill/117th-congress/house-resolution/824?q=%7B%22search%22%3A%5B%22actionDate%3A%5C%22117%7C2021-11-30%5C%22+AND+%28billIsReserved%3A%5C%22N%5C%22+OR+type%3A%5C%22AMENDMENT%5C%22%29%22%2C%22%5C%22117%7C2021-11-30%5C%22%22%5D%7D&s=1&r=41
12/02/2021,BILL,Outdoors for All Act,"Sen. Padilla, Alex [D-CA]", Senate - Energy and Natural Resources        ,Senate - 12/02/2021 Committee on Energy and Natural Resources. Hearings held. (,Introduced,https://www.congress.gov/bill/117th-congress/senate-bill/2887?q=%7B%22search%22%3A%5B%22actionDate%3A%5C%22117%7C2021-12-02%5C%22+AND+%28billIsReserved%3A%5C%22N%5C%22+OR+type%3A%5C%22AMENDMENT%5C%22%29%22%2C%22%5C%22117%7C2021-12-02%5C%22%22%5D%7D&s=1&r=45
12/02/2021,BILL,Biking on Long-Distance Trails Act,"Sen. Lujan, Ben [D-NM]", Senate - Energy and Natural Resources        ,Senate - 12/02/2021 Committee on Energy and Natural Resources. Hearings held. (,Introduced,https://www.congress.gov/bill/117th-congress/senate-bill/3264?q=%7B%22search%22%3A%5B%22actionDate%3A%5C%22117%7C2021-12-02%5C%22+AND+%28billIsReserved%3A%5C%22N%5C%22+OR+type%3A%5C%22AMENDMENT%5C%22%29%22%2C%22%5C%22117%7C2021-12-02%5C%22%22%5D%7D&s=1&r=46
12/02/2021,BILL,Outdoor Recreation Act,"Sen. Manchin, Joseph [D-WV]", Senate - Energy and Natural Resources        ,Senate - 12/02/2021 Committee on Energy and Natural Resources. Hearings held. (,Introduced,https://www.congress.gov/bill/117th-congress/senate-bill/3266?q=%7B%22search%22%3A%5B%22actionDate%3A%5C%22117%7C2021-12-02%5C%22+AND+%28billIsReserved%3A%5C%22N%5C%22+OR+type%3A%5C%22AMENDMENT%5C%22%29%22%2C%22%5C%22117%7C2021-12-02%5C%22%22%5D%7D&s=1&r=47
11/30/2021,LAW,Protecting Moms Who Served Act of 2021,"Sen. Duckworth, Tammy [D-IL]", Senate - Veterans' Affairs        ,,Became Law,https://www.congress.gov/bill/117th-congress/senate-bill/796?q=%7B%22search%22%3A%5B%22actionDate%3A%5C%22117%7C2021-11-30%5C%22+AND+%28billIsReserved%3A%5C%22N%5C%22+OR+type%3A%5C%22AMENDMENT%5C%22%29%22%2C%22%5C%22117%7C2021-11-30%5C%22%22%5D%7D&s=1&r=42
11/30/2021,LAW,Hire Veteran Health Heroes Act of 2021,"Sen. Braun, Mike  [R-IN]", Senate - Veterans' Affairs        ,,Became Law,https://www.congress.gov/bill/117th-congress/senate-bill/894?q=%7B%22search%22%3A%5B%22actionDate%3A%5C%22117%7C2021-11-30%5C%22+AND+%28billIsReserved%3A%5C%22N%5C%22+OR+type%3A%5C%22AMENDMENT%5C%22%29%22%2C%22%5C%22117%7C2021-11-30%5C%22%22%5D%7D&s=1&r=43
11/30/2021,LAW,"A bill to require the Comptroller General of the United States to conduct a study on disparities associated with race and ethnicity with respect to certain benefits administered by the Secretary of Veterans Affairs, and for other purposes.","Sen. Warnock, Raphael G. [D-GA]", Senate - Veterans' Affairs        ,,Became Law,https://www.congress.gov/bill/117th-congress/senate-bill/1031?q=%7B%22search%22%3A%5B%22actionDate%3A%5C%22117%7C2021-11-30%5C%22+AND+%28billIsReserved%3A%5C%22N%5C%22+OR+type%3A%5C%22AMENDMENT%5C%22%29%22%2C%22%5C%22117%7C2021-11-30%5C%22%22%5D%7D&s=1&r=44
12/02/2021,BILL,A bill to prohibit the Department of Defense from discharging or withholding pay or benefits from members of the National Guard based on COVID-19 vaccination status.,"Sen. Lankford, James [R-OK]",,Senate - 12/02/2021 Read the second time. Placed on Senate Legislative Calendar under General Orders. Calendar No. 174. (,Introduced,https://www.congress.gov/bill/117th-congress/senate-bill/3299?q=%7B%22search%22%3A%5B%22actionDate%3A%5C%22117%7C2021-12-02%5C%22+AND+%28billIsReserved%3A%5C%22N%5C%22+OR+type%3A%5C%22AMENDMENT%5C%22%29%22%2C%22%5C%22117%7C2021-12-02%5C%22%22%5D%7D&s=1&r=48
12/02/2021,BILL,A bill to prohibit the payment of certain legal settlements to individuals who unlawfully entered the United States.,"Sen. Tillis, Thomas [R-NC]", Senate - Judiciary        ,Senate - 12/02/2021 Read twice and referred to the Committee on the Judiciary. (,Introduced,https://www.congress.gov/bill/117th-congress/senate-bill/3300?q=%7B%22search%22%3A%5B%22actionDate%3A%5C%22117%7C2021-12-02%5C%22+AND+%28billIsReserved%3A%5C%22N%5C%22+OR+type%3A%5C%22AMENDMENT%5C%22%29%22%2C%22%5C%22117%7C2021-12-02%5C%22%22%5D%7D&s=1&r=49
12/02/2021,BILL,A bill to prohibit discrimination on the basis of mental or physical disability in cases of organ transplants.,"Sen. Rubio, Marco [R-FL]"," Senate - Health, Education, Labor, and Pensions        ","Senate - 12/02/2021 Read twice and referred to the Committee on Health, Education, Labor, and Pensions. (",Introduced,https://www.congress.gov/bill/117th-congress/senate-bill/3301?q=%7B%22search%22%3A%5B%22actionDate%3A%5C%22117%7C2021-12-02%5C%22+AND+%28billIsReserved%3A%5C%22N%5C%22+OR+type%3A%5C%22AMENDMENT%5C%22%29%22%2C%22%5C%22117%7C2021-12-02%5C%22%22%5D%7D&s=1&r=50
11/30/2021,LAW,Colonel John M. McHugh Tuition Fairness for Survivors Act of 2021,"Sen. Moran, Jerry [R-KS]", Senate - Veterans' Affairs        ,,Became Law,https://www.congress.gov/bill/117th-congress/senate-bill/1095?q=%7B%22search%22%3A%5B%22actionDate%3A%5C%22117%7C2021-11-30%5C%22+AND+%28billIsReserved%3A%5C%22N%5C%22+OR+type%3A%5C%22AMENDMENT%5C%22%29%22%2C%22%5C%22117%7C2021-11-30%5C%22%22%5D%7D&s=1&r=45
11/30/2021,BILL,Federal Secure Cloud Improvement and Jobs Act of 2021,"Sen. Peters, Gary [D-MI]", Senate - Homeland Security and Governmental Affairs        ,Senate - 11/30/2021 Committee on Homeland Security and Governmental Affairs. Hearings held. (,Introduced,https://www.congress.gov/bill/117th-congress/senate-bill/3099?q=%7B%22search%22%3A%5B%22actionDate%3A%5C%22117%7C2021-11-30%5C%22+AND+%28billIsReserved%3A%5C%22N%5C%22+OR+type%3A%5C%22AMENDMENT%5C%22%29%22%2C%22%5C%22117%7C2021-11-30%5C%22%22%5D%7D&s=1&r=46
12/02/2021,BILL,"A bill to amend the Individuals with Disabilities Act to improve provisions relating to dyslexia, and for other purposes.","Sen. Cassidy, Bill [R-LA]"," Senate - Health, Education, Labor, and Pensions        ","Senate - 12/02/2021 Read twice and referred to the Committee on Health, Education, Labor, and Pensions. (",Introduced,https://www.congress.gov/bill/117th-congress/senate-bill/3302?q=%7B%22search%22%3A%5B%22actionDate%3A%5C%22117%7C2021-12-02%5C%22+AND+%28billIsReserved%3A%5C%22N%5C%22+OR+type%3A%5C%22AMENDMENT%5C%22%29%22%2C%22%5C%22117%7C2021-12-02%5C%22%22%5D%7D&s=1&r=51
12/02/2021,BILL,A bill to extend the authority of the National Aeronautics and Space Administration to enter into leases of non-excess property of the Administration.,"Sen. Rubio, Marco [R-FL]"," Senate - Commerce, Science, and Transportation        ","Senate - 12/02/2021 Read twice and referred to the Committee on Commerce, Science, and Transportation. (",Introduced,https://www.congress.gov/bill/117th-congress/senate-bill/3303?q=%7B%22search%22%3A%5B%22actionDate%3A%5C%22117%7C2021-12-02%5C%22+AND+%28billIsReserved%3A%5C%22N%5C%22+OR+type%3A%5C%22AMENDMENT%5C%22%29%22%2C%22%5C%22117%7C2021-12-02%5C%22%22%5D%7D&s=1&r=52
11/30/2021,BILL,"A bill to prohibit the circumvention of control measures used by Internet retailers to ensure equitable consumer access to products, and for other purposes.","Sen. Blumenthal, Richard [D-CT]"," Senate - Commerce, Science, and Transportation        ","Senate - 11/30/2021 Read twice and referred to the Committee on Commerce, Science, and Transportation. (",Introduced,https://www.congress.gov/bill/117th-congress/senate-bill/3276?q=%7B%22search%22%3A%5B%22actionDate%3A%5C%22117%7C2021-11-30%5C%22+AND+%28billIsReserved%3A%5C%22N%5C%22+OR+type%3A%5C%22AMENDMENT%5C%22%29%22%2C%22%5C%22117%7C2021-11-30%5C%22%22%5D%7D&s=1&r=47
11/30/2021,BILL,"A bill to enact the Section 401 Certification Rule, and for other purposes.","Sen. Capito, Shelley [R-WV]", Senate - Environment and Public Works        ,Senate - 11/30/2021 Read twice and referred to the Committee on Environment and Public Works. (,Introduced,https://www.congress.gov/bill/117th-congress/senate-bill/3277?q=%7B%22search%22%3A%5B%22actionDate%3A%5C%22117%7C2021-11-30%5C%22+AND+%28billIsReserved%3A%5C%22N%5C%22+OR+type%3A%5C%22AMENDMENT%5C%22%29%22%2C%22%5C%22117%7C2021-11-30%5C%22%22%5D%7D&s=1&r=48
11/30/2021,BILL,"A bill to protect children and other consumers against hazards associated with the accidental ingestion of button cell or coin batteries by requiring the Consumer Product Safety Commission to promulgate a consumer product safety standard to require child-resistant closures on consumer products that use such batteries, and for other purposes.","Sen. Blumenthal, Richard [D-CT]"," Senate - Commerce, Science, and Transportation        ","Senate - 11/30/2021 Read twice and referred to the Committee on Commerce, Science, and Transportation. (",Introduced,https://www.congress.gov/bill/117th-congress/senate-bill/3278?q=%7B%22search%22%3A%5B%22actionDate%3A%5C%22117%7C2021-11-30%5C%22+AND+%28billIsReserved%3A%5C%22N%5C%22+OR+type%3A%5C%22AMENDMENT%5C%22%29%22%2C%22%5C%22117%7C2021-11-30%5C%22%22%5D%7D&s=1&r=49
12/02/2021,BILL,"A bill to amend title 38, United States Code, to improve the ability of veterans to electronically submit complaints about the delivery of health care services by the Department of Veterans Affairs.","Sen. Kennedy, John [R-LA]", Senate - Veterans' Affairs        ,Senate - 12/02/2021 Read twice and referred to the Committee on Veterans' Affairs. (,Introduced,https://www.congress.gov/bill/117th-congress/senate-bill/3304?q=%7B%22search%22%3A%5B%22actionDate%3A%5C%22117%7C2021-12-02%5C%22+AND+%28billIsReserved%3A%5C%22N%5C%22+OR+type%3A%5C%22AMENDMENT%5C%22%29%22%2C%22%5C%22117%7C2021-12-02%5C%22%22%5D%7D&s=1&r=53
12/02/2021,BILL,A bill to repeal the amendment made to the Superfund excise taxes by the Infrastructure Investment and Jobs Act.,"Sen. Cruz, Ted [R-TX]", Senate - Finance        ,Senate - 12/02/2021 Read twice and referred to the Committee on Finance. (,Introduced,https://www.congress.gov/bill/117th-congress/senate-bill/3305?q=%7B%22search%22%3A%5B%22actionDate%3A%5C%22117%7C2021-12-02%5C%22+AND+%28billIsReserved%3A%5C%22N%5C%22+OR+type%3A%5C%22AMENDMENT%5C%22%29%22%2C%22%5C%22117%7C2021-12-02%5C%22%22%5D%7D&s=1&r=54
12/02/2021,BILL,"A bill to prohibit the purchase of certain telecommunications or aerospace goods or service from entities affiliated with the People's Republic of China or the Russian Federation and to require reporting relating to investment by foreign persons in the aerospace industry in the United States, and for other purposes.","Sen. Rubio, Marco [R-FL]"," Senate - Commerce, Science, and Transportation        ","Senate - 12/02/2021 Read twice and referred to the Committee on Commerce, Science, and Transportation. (",Introduced,https://www.congress.gov/bill/117th-congress/senate-bill/3306?q=%7B%22search%22%3A%5B%22actionDate%3A%5C%22117%7C2021-12-02%5C%22+AND+%28billIsReserved%3A%5C%22N%5C%22+OR+type%3A%5C%22AMENDMENT%5C%22%29%22%2C%22%5C%22117%7C2021-12-02%5C%22%22%5D%7D&s=1&r=55
11/30/2021,BILL,A bill to extend duty-free treatment provided with respect to imports from Haiti under the Caribbean Basin Economic Recovery Act.,"Sen. Rubio, Marco [R-FL]", Senate - Finance        ,Senate - 11/30/2021 Read twice and referred to the Committee on Finance. (,Introduced,https://www.congress.gov/bill/117th-congress/senate-bill/3279?q=%7B%22search%22%3A%5B%22actionDate%3A%5C%22117%7C2021-11-30%5C%22+AND+%28billIsReserved%3A%5C%22N%5C%22+OR+type%3A%5C%22AMENDMENT%5C%22%29%22%2C%22%5C%22117%7C2021-11-30%5C%22%22%5D%7D&s=1&r=50
11/30/2021,BILL,"A bill to establish the Office of Children in Family Security and an Ambassador at Large  for Children in Family Security, and for other purposes.","Sen. Blunt, Roy [R-MO]", Senate - Foreign Relations        ,Senate - 11/30/2021 Read twice and referred to the Committee on Foreign Relations. (,Introduced,https://www.congress.gov/bill/117th-congress/senate-bill/3280?q=%7B%22search%22%3A%5B%22actionDate%3A%5C%22117%7C2021-11-30%5C%22+AND+%28billIsReserved%3A%5C%22N%5C%22+OR+type%3A%5C%22AMENDMENT%5C%22%29%22%2C%22%5C%22117%7C2021-11-30%5C%22%22%5D%7D&s=1&r=51
11/30/2021,BILL,"A bill to amend the Bill Emerson Good Samaritan Food Donation Act to clarify and expand food donation, and for other purposes.","Sen. Blumenthal, Richard [D-CT]"," Senate - Agriculture, Nutrition, and Forestry        ","Senate - 11/30/2021 Read twice and referred to the Committee on Agriculture, Nutrition, and Forestry. (",Introduced,https://www.congress.gov/bill/117th-congress/senate-bill/3281?q=%7B%22search%22%3A%5B%22actionDate%3A%5C%22117%7C2021-11-30%5C%22+AND+%28billIsReserved%3A%5C%22N%5C%22+OR+type%3A%5C%22AMENDMENT%5C%22%29%22%2C%22%5C%22117%7C2021-11-30%5C%22%22%5D%7D&s=1&r=52
12/02/2021,BILL,"A bill to modify the boundary of the Wilson's Creek National Battlefield in the State of Missouri, and for other purposes.","Sen. Blunt, Roy [R-MO]", Senate - Energy and Natural Resources        ,Senate - 12/02/2021 Read twice and referred to the Committee on Energy and Natural Resources. (,Introduced,https://www.congress.gov/bill/117th-congress/senate-bill/3307?q=%7B%22search%22%3A%5B%22actionDate%3A%5C%22117%7C2021-12-02%5C%22+AND+%28billIsReserved%3A%5C%22N%5C%22+OR+type%3A%5C%22AMENDMENT%5C%22%29%22%2C%22%5C%22117%7C2021-12-02%5C%22%22%5D%7D&s=1&r=56
12/02/2021,BILL,"A bill to authorize the Colorado River Indian Tribes to enter into lease or exchange agreements and storage agreements relating to water of the Colorado River allocated to the Colorado River Indian Tribes, and for other purposes.","Sen. Kelly, Mark [D-AZ]", Senate - Indian Affairs        ,Senate - 12/02/2021 Read twice and referred to the Committee on Indian Affairs. (,Introduced,https://www.congress.gov/bill/117th-congress/senate-bill/3308?q=%7B%22search%22%3A%5B%22actionDate%3A%5C%22117%7C2021-12-02%5C%22+AND+%28billIsReserved%3A%5C%22N%5C%22+OR+type%3A%5C%22AMENDMENT%5C%22%29%22%2C%22%5C%22117%7C2021-12-02%5C%22%22%5D%7D&s=1&r=57
12/02/2021,BILL,A bill to require SelectUSA to coordinate with State-level economic development organizations to increase foreign direct investment in semiconductor-related manufacturing and production.,"Sen. Peters, Gary [D-MI]"," Senate - Commerce, Science, and Transportation        ","Senate - 12/02/2021 Read twice and referred to the Committee on Commerce, Science, and Transportation. (",Introduced,https://www.congress.gov/bill/117th-congress/senate-bill/3309?q=%7B%22search%22%3A%5B%22actionDate%3A%5C%22117%7C2021-12-02%5C%22+AND+%28billIsReserved%3A%5C%22N%5C%22+OR+type%3A%5C%22AMENDMENT%5C%22%29%22%2C%22%5C%22117%7C2021-12-02%5C%22%22%5D%7D&s=1&r=58
11/30/2021,BILL,"A bill to amend the Federal Water Pollution Control Act and the Safe Drinking Water Act to authorize grants for smart water infrastructure technology, and for other purposes.","Sen. Kelly, Mark [D-AZ]", Senate - Environment and Public Works        ,Senate - 11/30/2021 Read twice and referred to the Committee on Environment and Public Works. (,Introduced,https://www.congress.gov/bill/117th-congress/senate-bill/3282?q=%7B%22search%22%3A%5B%22actionDate%3A%5C%22117%7C2021-11-30%5C%22+AND+%28billIsReserved%3A%5C%22N%5C%22+OR+type%3A%5C%22AMENDMENT%5C%22%29%22%2C%22%5C%22117%7C2021-11-30%5C%22%22%5D%7D&s=1&r=53
12/02/2021,BILL,"A bill to direct the Secretary of Defense to develop a plan to establish the Minority Institute for Defense Research, and for other purposes.","Sen. Brown, Sherrod [D-OH]", Senate - Armed Services        ,Senate - 12/02/2021 Read twice and referred to the Committee on Armed Services. (,Introduced,https://www.congress.gov/bill/117th-congress/senate-bill/3310?q=%7B%22search%22%3A%5B%22actionDate%3A%5C%22117%7C2021-12-02%5C%22+AND+%28billIsReserved%3A%5C%22N%5C%22+OR+type%3A%5C%22AMENDMENT%5C%22%29%22%2C%22%5C%22117%7C2021-12-02%5C%22%22%5D%7D&s=1&r=59
12/02/2021,BILL,A bill to amend the Federal Trade Commission Act to establish procedures for the treatment of votes by departed Commissioners.,"Sen. Moran, Jerry [R-KS]"," Senate - Commerce, Science, and Transportation        ","Senate - 12/02/2021 Read twice and referred to the Committee on Commerce, Science, and Transportation. (",Introduced,https://www.congress.gov/bill/117th-congress/senate-bill/3311?q=%7B%22search%22%3A%5B%22actionDate%3A%5C%22117%7C2021-12-02%5C%22+AND+%28billIsReserved%3A%5C%22N%5C%22+OR+type%3A%5C%22AMENDMENT%5C%22%29%22%2C%22%5C%22117%7C2021-12-02%5C%22%22%5D%7D&s=1&r=60
11/30/2021,BILL,"A bill to amend the Federal Insecticide, Fungicide, and Rodenticide Act to fully protect the safety of children and the environment, to remove dangerous pesticides from use, and for other purposes.","Sen. Booker, Cory [D-NJ]"," Senate - Agriculture, Nutrition, and Forestry        ","Senate - 11/30/2021 Read twice and referred to the Committee on Agriculture, Nutrition, and Forestry. (",Introduced,https://www.congress.gov/bill/117th-congress/senate-bill/3283?q=%7B%22search%22%3A%5B%22actionDate%3A%5C%22117%7C2021-11-30%5C%22+AND+%28billIsReserved%3A%5C%22N%5C%22+OR+type%3A%5C%22AMENDMENT%5C%22%29%22%2C%22%5C%22117%7C2021-11-30%5C%22%22%5D%7D&s=1&r=54
11/30/2021,BILL,"A bill to require the Secretary of Veterans Affairs to establish a toll-free telephone helpline for veterans and other eligible individuals to use to obtain information about the benefits and services provided by the Department of Veterans Affairs, and for other purposes.","Sen. Rosen, Jacklyn [D-NV]", Senate - Veterans' Affairs        ,Senate - 11/30/2021 Read twice and referred to the Committee on Veterans' Affairs. (,Introduced,https://www.congress.gov/bill/117th-congress/senate-bill/3284?q=%7B%22search%22%3A%5B%22actionDate%3A%5C%22117%7C2021-11-30%5C%22+AND+%28billIsReserved%3A%5C%22N%5C%22+OR+type%3A%5C%22AMENDMENT%5C%22%29%22%2C%22%5C%22117%7C2021-11-30%5C%22%22%5D%7D&s=1&r=55
12/02/2021,BILL,A bill to analyze the impacts of establishing U.S. Customs and Border Protection Preclearance facilities in Taiwan and in other Indo-Pacific countries.,"Sen. Hawley, Josh [R-MO]", Senate - Homeland Security and Governmental Affairs        ,Senate - 12/02/2021 Read twice and referred to the Committee on Homeland Security and Governmental Affairs. (,Introduced,https://www.congress.gov/bill/117th-congress/senate-bill/3312?q=%7B%22search%22%3A%5B%22actionDate%3A%5C%22117%7C2021-12-02%5C%22+AND+%28billIsReserved%3A%5C%22N%5C%22+OR+type%3A%5C%22AMENDMENT%5C%22%29%22%2C%22%5C%22117%7C2021-12-02%5C%22%22%5D%7D&s=1&r=61
12/02/2021,RESOLUTION,"A resolution expressing the sense of the Senate that the United States should prioritize within the Government and emphasize with allies the need to provide continued support to, and maintain legal pathways for the emigration out of Afghanistan of, individuals who do not wish to be governed by the Taliban.","Sen. Cassidy, Bill [R-LA]", Senate - Foreign Relations        ,Senate - 12/02/2021 Referred to the Committee on Foreign Relations. (text: CR ,Introduced,https://www.congress.gov/bill/117th-congress/senate-resolution/465?q=%7B%22search%22%3A%5B%22actionDate%3A%5C%22117%7C2021-12-02%5C%22+AND+%28billIsReserved%3A%5C%22N%5C%22+OR+type%3A%5C%22AMENDMENT%5C%22%29%22%2C%22%5C%22117%7C2021-12-02%5C%22%22%5D%7D&s=1&r=62
11/30/2021,BILL,"A bill to improve protections for meatpacking workers, and for other purposes.","Sen. Booker, Cory [D-NJ]"," Senate - Health, Education, Labor, and Pensions        ","Senate - 11/30/2021 Read twice and referred to the Committee on Health, Education, Labor, and Pensions. (",Introduced,https://www.congress.gov/bill/117th-congress/senate-bill/3285?q=%7B%22search%22%3A%5B%22actionDate%3A%5C%22117%7C2021-11-30%5C%22+AND+%28billIsReserved%3A%5C%22N%5C%22+OR+type%3A%5C%22AMENDMENT%5C%22%29%22%2C%22%5C%22117%7C2021-11-30%5C%22%22%5D%7D&s=1&r=56
11/30/2021,BILL,A bill to include a Federal defender as a nonvoting member of the United States Sentencing Commission.,"Sen. Booker, Cory [D-NJ]", Senate - Judiciary        ,Senate - 11/30/2021 Read twice and referred to the Committee on the Judiciary. (,Introduced,https://www.congress.gov/bill/117th-congress/senate-bill/3286?q=%7B%22search%22%3A%5B%22actionDate%3A%5C%22117%7C2021-11-30%5C%22+AND+%28billIsReserved%3A%5C%22N%5C%22+OR+type%3A%5C%22AMENDMENT%5C%22%29%22%2C%22%5C%22117%7C2021-11-30%5C%22%22%5D%7D&s=1&r=57
11/30/2021,BILL,A bill to provide for the development and issuance of a plan to increase oil and gas production on Federal land in conjunction with a drawdown of petroleum reserves from the Strategic Petroleum Reserve.,"Sen. Barrasso, John [R-WY]", Senate - Energy and Natural Resources        ,,Introduced,https://www.congress.gov/bill/117th-congress/senate-bill/3287?q=%7B%22search%22%3A%5B%22actionDate%3A%5C%22117%7C2021-11-30%5C%22+AND+%28billIsReserved%3A%5C%22N%5C%22+OR+type%3A%5C%22AMENDMENT%5C%22%29%22%2C%22%5C%22117%7C2021-11-30%5C%22%22%5D%7D&s=1&r=58
12/02/2021,RESOLUTION,A resolution expressing the sense of the Senate in support of the International Atomic Energy Agency's (IAEA) nuclear security role.,"Sen. Lujan, Ben [D-NM]", Senate - Foreign Relations        ,Senate - 12/02/2021 Referred to the Committee on Foreign Relations. (text: CR ,Introduced,https://www.congress.gov/bill/117th-congress/senate-resolution/466?q=%7B%22search%22%3A%5B%22actionDate%3A%5C%22117%7C2021-12-02%5C%22+AND+%28billIsReserved%3A%5C%22N%5C%22+OR+type%3A%5C%22AMENDMENT%5C%22%29%22%2C%22%5C%22117%7C2021-12-02%5C%22%22%5D%7D&s=1&r=63
12/02/2021,RESOLUTION,A resolution recognizing the contributions made by the 305-meter radio telescope at the Arecibo Observatory.,"Sen. Blumenthal, Richard [D-CT]"," Senate - Commerce, Science, and Transportation        ","Senate - 12/02/2021 Referred to the Committee on Commerce, Science, and Transportation. (text: CR ",Introduced,https://www.congress.gov/bill/117th-congress/senate-resolution/467?q=%7B%22search%22%3A%5B%22actionDate%3A%5C%22117%7C2021-12-02%5C%22+AND+%28billIsReserved%3A%5C%22N%5C%22+OR+type%3A%5C%22AMENDMENT%5C%22%29%22%2C%22%5C%22117%7C2021-12-02%5C%22%22%5D%7D&s=1&r=64
12/02/2021,AMENDMENT,,,,,,https://www.congress.gov/search?q=%7B%22congress%22%3A%22all%22%2C%22source%22%3A%22legislation%22%2C%22search%22%3A%22actionDate%3A%5C%22117%7C2021-12-02%5C%22+AND+%28billIsReserved%3A%5C%22N%5C%22+OR+type%3A%5C%22AMENDMENT%5C%22%29%22%7D&pageSort=documentNumber%3Aasc
12/02/2021,AMENDMENT,,,,,,https://www.congress.gov/search?q=%7B%22congress%22%3A%22all%22%2C%22source%22%3A%22legislation%22%2C%22search%22%3A%22actionDate%3A%5C%22117%7C2021-12-02%5C%22+AND+%28billIsReserved%3A%5C%22N%5C%22+OR+type%3A%5C%22AMENDMENT%5C%22%29%22%7D&pageSort=documentNumber%3Aasc
11/30/2021,BILL,"A bill to reauthorize and reform the National Telecommunications and Information Administration, and for other purposes.","Sen. Wicker, Roger [R-MS]"," Senate - Commerce, Science, and Transportation        ","Senate - 11/30/2021 Read twice and referred to the Committee on Commerce, Science, and Transportation. (",Introduced,https://www.congress.gov/bill/117th-congress/senate-bill/3288?q=%7B%22search%22%3A%5B%22actionDate%3A%5C%22117%7C2021-11-30%5C%22+AND+%28billIsReserved%3A%5C%22N%5C%22+OR+type%3A%5C%22AMENDMENT%5C%22%29%22%2C%22%5C%22117%7C2021-11-30%5C%22%22%5D%7D&s=1&r=59
11/30/2021,RESOLUTION,"A resolution expressing support for the designation of November 8, 2021, as ""National First-Generation College Celebration Day"".","Sen. Warnock, Raphael [D-GA]"," Senate - Health, Education, Labor, and Pensions        ",Senate - 11/30/2021 Resolution agreed to in Senate without amendment and with a preamble by Unanimous Consent. (text: CR 11/03/2021 ,Agreed to in Senate,https://www.congress.gov/bill/117th-congress/senate-resolution/437?q=%7B%22search%22%3A%5B%22actionDate%3A%5C%22117%7C2021-11-30%5C%22+AND+%28billIsReserved%3A%5C%22N%5C%22+OR+type%3A%5C%22AMENDMENT%5C%22%29%22%2C%22%5C%22117%7C2021-11-30%5C%22%22%5D%7D&s=1&r=60
11/30/2021,RESOLUTION,"A resolution designating November 2021 as ""National Runaway Prevention Month"".","Sen. Duckworth, Tammy [D-IL]", Senate - Judiciary        ,Senate - 11/30/2021 Referred to the Committee on the Judiciary. (text: CR ,Introduced,https://www.congress.gov/bill/117th-congress/senate-resolution/460?q=%7B%22search%22%3A%5B%22actionDate%3A%5C%22117%7C2021-11-30%5C%22+AND+%28billIsReserved%3A%5C%22N%5C%22+OR+type%3A%5C%22AMENDMENT%5C%22%29%22%2C%22%5C%22117%7C2021-11-30%5C%22%22%5D%7D&s=1&r=61
12/02/2021,AMENDMENT,,,,,,https://www.congress.gov/search?q=%7B%22congress%22%3A%22all%22%2C%22source%22%3A%22legislation%22%2C%22search%22%3A%22actionDate%3A%5C%22117%7C2021-12-02%5C%22+AND+%28billIsReserved%3A%5C%22N%5C%22+OR+type%3A%5C%22AMENDMENT%5C%22%29%22%7D&pageSort=documentNumber%3Aasc
12/02/2021,AMENDMENT,,,,,,https://www.congress.gov/search?q=%7B%22congress%22%3A%22all%22%2C%22source%22%3A%22legislation%22%2C%22search%22%3A%22actionDate%3A%5C%22117%7C2021-12-02%5C%22+AND+%28billIsReserved%3A%5C%22N%5C%22+OR+type%3A%5C%22AMENDMENT%5C%22%29%22%7D&pageSort=documentNumber%3Aasc
