date,type,title,sponsor,committees,latest_action,tracker,url
07/20/2021,BILL,Domains Critical to Homeland Security Act,"Rep. Katko, John [R-NY-24]", House - Homeland Security | Senate - Homeland Security and Governmental Affairs        ,Senate - 07/21/2021 Received in the Senate and Read twice and referred to the Committee on Homeland Security and Governmental Affairs. (,Passed House,https://www.congress.gov/bill/117th-congress/house-bill/3264?q=%7B%22search%22%3A%5B%22actionDate%3A%5C%22117%7C2021-07-20%5C%22+AND+%28billIsReserved%3A%5C%22N%5C%22+OR+type%3A%5C%22AMENDMENT%5C%22%29%22%5D%7D&s=1&r=32
07/20/2021,BILL,Urban Indian Health Providers Facilities Improvement Act,"Rep. Gallego, Ruben [D-AZ-7]", House - Natural Resources; Energy and Commerce        ,House - 07/20/2021 Subcommittee Hearings Held. (,Introduced,https://www.congress.gov/bill/117th-congress/house-bill/3496?q=%7B%22search%22%3A%5B%22actionDate%3A%5C%22117%7C2021-07-20%5C%22+AND+%28billIsReserved%3A%5C%22N%5C%22+OR+type%3A%5C%22AMENDMENT%5C%22%29%22%5D%7D&s=1&r=33
07/20/2021,BILL,"To establish occupational series for Federal positions in software development, software engineering, data science, and data management, and for other purposes.","Rep. Obernolte, Jay [R-CA-8]", House - Oversight and Reform        ,House - 07/20/2021 Committee Consideration and Mark-up Session Held. (,Introduced,https://www.congress.gov/bill/117th-congress/house-bill/3533?q=%7B%22search%22%3A%5B%22actionDate%3A%5C%22117%7C2021-07-20%5C%22+AND+%28billIsReserved%3A%5C%22N%5C%22+OR+type%3A%5C%22AMENDMENT%5C%22%29%22%5D%7D&s=1&r=34
07/20/2021,BILL,"To designate the facility of the United States Postal Service located at 223 West Chalan Santo Papa in Hagatna, Guam, as the ""Atanasio Taitano Perez Post Office"".","Del. San Nicolas, Michael F. Q. [D-GU-At Large]", House - Oversight and Reform        ,House - 07/20/2021 Committee Consideration and Mark-up Session Held. (,Introduced,https://www.congress.gov/bill/117th-congress/house-bill/3539?q=%7B%22search%22%3A%5B%22actionDate%3A%5C%22117%7C2021-07-20%5C%22+AND+%28billIsReserved%3A%5C%22N%5C%22+OR+type%3A%5C%22AMENDMENT%5C%22%29%22%5D%7D&s=1&r=35
07/20/2021,BILL,"To designate the facility of the United States Postal Service located at 200 East Main Street in Maroa, Illinois, as the ""Jeremy L. Ridlen Post Office"".","Rep. Davis, Rodney [R-IL-13]", House - Oversight and Reform        ,House - 07/20/2021 Committee Consideration and Mark-up Session Held. (,Introduced,https://www.congress.gov/bill/117th-congress/house-bill/3579?q=%7B%22search%22%3A%5B%22actionDate%3A%5C%22117%7C2021-07-20%5C%22+AND+%28billIsReserved%3A%5C%22N%5C%22+OR+type%3A%5C%22AMENDMENT%5C%22%29%22%5D%7D&s=1&r=36
07/20/2021,BILL,"To designate the facility of the United States Postal Service located at 202 Trumbull Street in Saint Clair, Michigan, as the ""Corporal Jeffrey Robert Standfest Post Office Building"".","Rep. McClain, Lisa C. [R-MI-10]", House - Oversight and Reform        ,House - 07/20/2021 Committee Consideration and Mark-up Session Held. (,Introduced,https://www.congress.gov/bill/117th-congress/house-bill/3613?q=%7B%22search%22%3A%5B%22actionDate%3A%5C%22117%7C2021-07-20%5C%22+AND+%28billIsReserved%3A%5C%22N%5C%22+OR+type%3A%5C%22AMENDMENT%5C%22%29%22%5D%7D&s=1&r=37
07/20/2021,BILL,Disaster Tax Relief Act of 2021,"Rep. Thompson, Mike [D-CA-5]", House - Ways and Means; Small Business; Agriculture        ,House - 07/20/2021 Referred to the Subcommittee on General Farm Commodities and Risk Management. (,Introduced,https://www.congress.gov/bill/117th-congress/house-bill/3954?q=%7B%22search%22%3A%5B%22actionDate%3A%5C%22117%7C2021-07-20%5C%22+AND+%28billIsReserved%3A%5C%22N%5C%22+OR+type%3A%5C%22AMENDMENT%5C%22%29%22%5D%7D&s=1&r=38
07/20/2021,BILL,Averting Loss of Life and Injury by Expediting SIVs Act of 2021,"Rep. Crow, Jason [D-CO-6]", House - Judiciary        ,Senate - 07/22/2021 Received in the Senate. (,Passed House,https://www.congress.gov/bill/117th-congress/house-bill/3985?q=%7B%22search%22%3A%5B%22actionDate%3A%5C%22117%7C2021-07-20%5C%22+AND+%28billIsReserved%3A%5C%22N%5C%22+OR+type%3A%5C%22AMENDMENT%5C%22%29%22%5D%7D&s=1&r=39
07/20/2021,BILL,"To designate the facility of the United States Postal Service located at 800 6th Street in Paso Robles, California, as the ""Reverend Ruben Franklin Tate, Jr., Post Office Building"".","Rep. Carbajal, Salud O. [D-CA-24]", House - Oversight and Reform        ,House - 07/20/2021 Committee Consideration and Mark-up Session Held. (,Introduced,https://www.congress.gov/bill/117th-congress/house-bill/4030?q=%7B%22search%22%3A%5B%22actionDate%3A%5C%22117%7C2021-07-20%5C%22+AND+%28billIsReserved%3A%5C%22N%5C%22+OR+type%3A%5C%22AMENDMENT%5C%22%29%22%5D%7D&s=1&r=40
07/20/2021,BILL,Keep the Watchdogs Running Act,"Rep. Connolly, Gerald E. [D-VA-11]", House - Oversight and Reform        ,House - 07/20/2021 Committee Consideration and Mark-up Session Held. (,Introduced,https://www.congress.gov/bill/117th-congress/house-bill/4125?q=%7B%22search%22%3A%5B%22actionDate%3A%5C%22117%7C2021-07-20%5C%22+AND+%28billIsReserved%3A%5C%22N%5C%22+OR+type%3A%5C%22AMENDMENT%5C%22%29%22%5D%7D&s=1&r=41
07/20/2021,BILL,Butcher Block Act,"Rep. Johnson, Dusty [R-SD-At Large]", House - Agriculture        ,"House - 07/20/2021 Referred to the Subcommittee on Commodity Exchanges, Energy, and Credit. (",Introduced,https://www.congress.gov/bill/117th-congress/house-bill/4140?q=%7B%22search%22%3A%5B%22actionDate%3A%5C%22117%7C2021-07-20%5C%22+AND+%28billIsReserved%3A%5C%22N%5C%22+OR+type%3A%5C%22AMENDMENT%5C%22%29%22%5D%7D&s=1&r=42
07/20/2021,BILL,"To designate the facility of the United States Postal Service located at 6223 Maple Street, in Omaha, Nebraska, as the ""Petty Officer 1st Class Charles Jackson French Post Office"".","Rep. Bacon, Don [R-NE-2]", House - Oversight and Reform        ,House - 07/20/2021 Committee Consideration and Mark-up Session Held. (,Introduced,https://www.congress.gov/bill/117th-congress/house-bill/4168?q=%7B%22search%22%3A%5B%22actionDate%3A%5C%22117%7C2021-07-20%5C%22+AND+%28billIsReserved%3A%5C%22N%5C%22+OR+type%3A%5C%22AMENDMENT%5C%22%29%22%5D%7D&s=1&r=43
07/20/2021,BILL,To require the Director of the Court Services and Offender Supervision Agency for the District of Columbia and the Director of the District of Columbia Pretrial Services Agency to reside in the District of Columbia.,"Del. Norton, Eleanor Holmes [D-DC-At Large]", House - Oversight and Reform        ,House - 07/20/2021 Committee Consideration and Mark-up Session Held. (,Introduced,https://www.congress.gov/bill/117th-congress/house-bill/4393?q=%7B%22search%22%3A%5B%22actionDate%3A%5C%22117%7C2021-07-20%5C%22+AND+%28billIsReserved%3A%5C%22N%5C%22+OR+type%3A%5C%22AMENDMENT%5C%22%29%22%5D%7D&s=1&r=44
07/20/2021,BILL,Administrative Law Judges Competitive Service Restoration Act,"Rep. Connolly, Gerald E. [D-VA-11]", House - Oversight and Reform        ,House - 07/20/2021 Committee Consideration and Mark-up Session Held. (,Introduced,https://www.congress.gov/bill/117th-congress/house-bill/4448?q=%7B%22search%22%3A%5B%22actionDate%3A%5C%22117%7C2021-07-20%5C%22+AND+%28billIsReserved%3A%5C%22N%5C%22+OR+type%3A%5C%22AMENDMENT%5C%22%29%22%5D%7D&s=1&r=45
07/20/2021,BILL,Federally Funded Research and Technology Development Protection Act,"Rep. Lynch, Stephen F. [D-MA-8]", House - Oversight and Reform        ,House - 07/20/2021 Committee Consideration and Mark-up Session Held. (,Introduced,https://www.congress.gov/bill/117th-congress/house-bill/4465?q=%7B%22search%22%3A%5B%22actionDate%3A%5C%22117%7C2021-07-20%5C%22+AND+%28billIsReserved%3A%5C%22N%5C%22+OR+type%3A%5C%22AMENDMENT%5C%22%29%22%5D%7D&s=1&r=46
07/20/2021,BILL,AI in Counterterrorism Oversight Enhancement Act,"Rep. Maloney, Carolyn B. [D-NY-12]", House - Oversight and Reform; Homeland Security; Judiciary; Intelligence (Permanent Select)        ,House - 07/20/2021 Committee Consideration and Mark-up Session Held. (,Introduced,https://www.congress.gov/bill/117th-congress/house-bill/4469?q=%7B%22search%22%3A%5B%22actionDate%3A%5C%22117%7C2021-07-20%5C%22+AND+%28billIsReserved%3A%5C%22N%5C%22+OR+type%3A%5C%22AMENDMENT%5C%22%29%22%5D%7D&s=1&r=47
07/20/2021,BILL,Made in America Pandemic Preparedness Act,"Rep. Maloney, Carolyn B. [D-NY-12]", House - Ways and Means; Oversight and Reform        ,House - 07/20/2021 Committee Consideration and Mark-up Session Held. (,Introduced,https://www.congress.gov/bill/117th-congress/house-bill/4470?q=%7B%22search%22%3A%5B%22actionDate%3A%5C%22117%7C2021-07-20%5C%22+AND+%28billIsReserved%3A%5C%22N%5C%22+OR+type%3A%5C%22AMENDMENT%5C%22%29%22%5D%7D&s=1&r=48
07/20/2021,BILL,"To amend title 23, United States Code, to require transportation planners to consider projects and strategies to reduce greenhouse gas emissions, and for other purposes.","Rep. Huffman, Jared [D-CA-2]", House - Transportation and Infrastructure        ,House - 07/20/2021 Referred to the Subcommittee on Highways and Transit. (,Introduced,https://www.congress.gov/bill/117th-congress/house-bill/4520?q=%7B%22search%22%3A%5B%22actionDate%3A%5C%22117%7C2021-07-20%5C%22+AND+%28billIsReserved%3A%5C%22N%5C%22+OR+type%3A%5C%22AMENDMENT%5C%22%29%22%5D%7D&s=1&r=49
07/20/2021,BILL,To protect the rights of legally incompetent adults who are the subject of a legal guardianship or conservatorship.,"Rep. Crist, Charlie [D-FL-13]", House - Judiciary        ,House - 07/20/2021 Referred to the House Committee on the Judiciary. (,Introduced,https://www.congress.gov/bill/117th-congress/house-bill/4545?q=%7B%22search%22%3A%5B%22actionDate%3A%5C%22117%7C2021-07-20%5C%22+AND+%28billIsReserved%3A%5C%22N%5C%22+OR+type%3A%5C%22AMENDMENT%5C%22%29%22%5D%7D&s=1&r=50
07/20/2021,BILL,"To assist those subject to politically motivated charges in Turkey, and for other purposes.","Rep. Jeffries, Hakeem S. [D-NY-8]", House - Foreign Affairs; Financial Services        ,"House - 07/20/2021 Referred to the Committee on Foreign Affairs, and in addition to the Committee on Financial Services, for a period to be subsequently determined by the Speaker, in each case for consideration of such provisions as fall within the jurisdiction of the committee... (",Introduced,https://www.congress.gov/bill/117th-congress/house-bill/4546?q=%7B%22search%22%3A%5B%22actionDate%3A%5C%22117%7C2021-07-20%5C%22+AND+%28billIsReserved%3A%5C%22N%5C%22+OR+type%3A%5C%22AMENDMENT%5C%22%29%22%5D%7D&s=1&r=51
07/20/2021,BILL,"To amend the Employee Retirement Income Security Act of 1974 to establish additional criteria for determining when employers may join together in a group or association of employers that will be treated as an employer under section 3(5) of such Act for purposes of sponsoring a group health plan, and for other purposes.","Rep. Walberg, Tim [R-MI-7]", House - Education and Labor        ,House - 07/20/2021 Referred to the House Committee on Education and Labor. (,Introduced,https://www.congress.gov/bill/117th-congress/house-bill/4547?q=%7B%22search%22%3A%5B%22actionDate%3A%5C%22117%7C2021-07-20%5C%22+AND+%28billIsReserved%3A%5C%22N%5C%22+OR+type%3A%5C%22AMENDMENT%5C%22%29%22%5D%7D&s=1&r=52
07/20/2021,BILL,"To amend the Consumer Protection Act of 2010 to grant the Bureau of Consumer Financial Protection the authority to regulate certain acts and practices using processes and procedures consistent with and similar to those in place at the Federal Trade Commission, to encourage greater communication amongst regulators, and for other purposes.","Rep. Williams, Roger [R-TX-25]", House - Financial Services        ,House - 07/20/2021 Referred to the House Committee on Financial Services. (,Introduced,https://www.congress.gov/bill/117th-congress/house-bill/4548?q=%7B%22search%22%3A%5B%22actionDate%3A%5C%22117%7C2021-07-20%5C%22+AND+%28billIsReserved%3A%5C%22N%5C%22+OR+type%3A%5C%22AMENDMENT%5C%22%29%22%5D%7D&s=1&r=53
07/20/2021,BILL,"Energy and Water Development and Related Agencies Appropriations Act, 2022","Rep. Kaptur, Marcy [D-OH-9]", House - Appropriations        ,"House - 07/20/2021 Placed on the Union Calendar, Calendar No. 71. (",Introduced,https://www.congress.gov/bill/117th-congress/house-bill/4549?q=%7B%22search%22%3A%5B%22actionDate%3A%5C%22117%7C2021-07-20%5C%22+AND+%28billIsReserved%3A%5C%22N%5C%22+OR+type%3A%5C%22AMENDMENT%5C%22%29%22%5D%7D&s=1&r=54
07/20/2021,BILL,"Transportation, Housing and Urban Development, and Related Agencies Appropriations Act, 2022","Rep. Price, David E. [D-NC-4]", House - Appropriations        ,"House - 07/20/2021 Placed on the Union Calendar, Calendar No. 72. (",Introduced,https://www.congress.gov/bill/117th-congress/house-bill/4550?q=%7B%22search%22%3A%5B%22actionDate%3A%5C%22117%7C2021-07-20%5C%22+AND+%28billIsReserved%3A%5C%22N%5C%22+OR+type%3A%5C%22AMENDMENT%5C%22%29%22%5D%7D&s=1&r=55
07/20/2021,BILL,"To amend the U.S. SAFE WEB Act of 2006 to provide for reporting with respect to cross-border complaints involving ransomware or other cyber-related attacks, and for other purposes.","Rep. Bilirakis, Gus M. [R-FL-12]", House - Energy and Commerce        ,House - 07/20/2021 Referred to the House Committee on Energy and Commerce. (,Introduced,https://www.congress.gov/bill/117th-congress/house-bill/4551?q=%7B%22search%22%3A%5B%22actionDate%3A%5C%22117%7C2021-07-20%5C%22+AND+%28billIsReserved%3A%5C%22N%5C%22+OR+type%3A%5C%22AMENDMENT%5C%22%29%22%5D%7D&s=1&r=56
07/20/2021,BILL,To establish a Department of Agriculture loan program to support mentorship and apprenticeship opportunities for veterans of the Armed Forces to become farmers or ranchers.,"Rep. Bost, Mike [R-IL-12]", House - Agriculture; Veterans' Affairs        ,"House - 07/20/2021 Referred to the Committee on Agriculture, and in addition to the Committee on Veterans' Affairs, for a period to be subsequently determined by the Speaker, in each case for consideration of such provisions as fall within the jurisdiction of the committee concerned. (",Introduced,https://www.congress.gov/bill/117th-congress/house-bill/4552?q=%7B%22search%22%3A%5B%22actionDate%3A%5C%22117%7C2021-07-20%5C%22+AND+%28billIsReserved%3A%5C%22N%5C%22+OR+type%3A%5C%22AMENDMENT%5C%22%29%22%5D%7D&s=1&r=57
07/20/2021,BILL,To amend the Internal Revenue Code of 1986 to facilitate water leasing and water transfers to promote conservation and efficiency.,"Rep. Buck, Ken [R-CO-4]", House - Ways and Means        ,House - 07/20/2021 Referred to the House Committee on Ways and Means. (,Introduced,https://www.congress.gov/bill/117th-congress/house-bill/4553?q=%7B%22search%22%3A%5B%22actionDate%3A%5C%22117%7C2021-07-20%5C%22+AND+%28billIsReserved%3A%5C%22N%5C%22+OR+type%3A%5C%22AMENDMENT%5C%22%29%22%5D%7D&s=1&r=58
07/20/2021,BILL,"To amend title XIX of the Social Security Act to provide grants to support for States to identify and act on racial disparities, and for other purposes.","Rep. Butterfield, G. K. [D-NC-1]", House - Energy and Commerce        ,House - 07/20/2021 Referred to the House Committee on Energy and Commerce. (,Introduced,https://www.congress.gov/bill/117th-congress/house-bill/4554?q=%7B%22search%22%3A%5B%22actionDate%3A%5C%22117%7C2021-07-20%5C%22+AND+%28billIsReserved%3A%5C%22N%5C%22+OR+type%3A%5C%22AMENDMENT%5C%22%29%22%5D%7D&s=1&r=59
07/20/2021,BILL,To amend the Public Health Service Act to authorize a public education campaign across all relevant programs of the Health Resources and Services Administration to increase oral health literacy and awareness.,"Rep. Cardenas, Tony [D-CA-29]", House - Energy and Commerce        ,House - 07/20/2021 Referred to the House Committee on Energy and Commerce. (,Introduced,https://www.congress.gov/bill/117th-congress/house-bill/4555?q=%7B%22search%22%3A%5B%22actionDate%3A%5C%22117%7C2021-07-20%5C%22+AND+%28billIsReserved%3A%5C%22N%5C%22+OR+type%3A%5C%22AMENDMENT%5C%22%29%22%5D%7D&s=1&r=60
07/20/2021,BILL,"To direct the Federal Energy Regulatory Commission to find that certain rates for electricity are inherently unjust and unreasonable, and for other purposes.","Rep. Casten, Sean [D-IL-6]", House - Energy and Commerce        ,House - 07/20/2021 Referred to the House Committee on Energy and Commerce. (,Introduced,https://www.congress.gov/bill/117th-congress/house-bill/4556?q=%7B%22search%22%3A%5B%22actionDate%3A%5C%22117%7C2021-07-20%5C%22+AND+%28billIsReserved%3A%5C%22N%5C%22+OR+type%3A%5C%22AMENDMENT%5C%22%29%22%5D%7D&s=1&r=61
07/20/2021,BILL,"To amend the Immigration and Nationality Act to allow the Secretary of State to make available to the public certain records pertaining to the refusal of a visa or permit based on an alien's involvement in corruption or human rights abuse, and for other purposes.","Rep. Cohen, Steve [D-TN-9]", House - Judiciary        ,House - 07/20/2021 Referred to the House Committee on the Judiciary. (,Introduced,https://www.congress.gov/bill/117th-congress/house-bill/4557?q=%7B%22search%22%3A%5B%22actionDate%3A%5C%22117%7C2021-07-20%5C%22+AND+%28billIsReserved%3A%5C%22N%5C%22+OR+type%3A%5C%22AMENDMENT%5C%22%29%22%5D%7D&s=1&r=62
07/20/2021,BILL,To amend the Internal Revenue Code of 1986 to allow the deduction for health insurance costs in computing self-employment taxes.,"Rep. Delgado, Antonio [D-NY-19]", House - Ways and Means        ,House - 07/20/2021 Referred to the House Committee on Ways and Means. (,Introduced,https://www.congress.gov/bill/117th-congress/house-bill/4558?q=%7B%22search%22%3A%5B%22actionDate%3A%5C%22117%7C2021-07-20%5C%22+AND+%28billIsReserved%3A%5C%22N%5C%22+OR+type%3A%5C%22AMENDMENT%5C%22%29%22%5D%7D&s=1&r=63
07/20/2021,BILL,"To require the Secretary of Defense to enhance the readiness of the Department of Defense to challenges relating to climate change and to improve the energy and resource efficiency of the Department, and for other purposes.","Rep. Escobar, Veronica [D-TX-16]", House - Armed Services        ,House - 07/20/2021 Referred to the House Committee on Armed Services. (,Introduced,https://www.congress.gov/bill/117th-congress/house-bill/4559?q=%7B%22search%22%3A%5B%22actionDate%3A%5C%22117%7C2021-07-20%5C%22+AND+%28billIsReserved%3A%5C%22N%5C%22+OR+type%3A%5C%22AMENDMENT%5C%22%29%22%5D%7D&s=1&r=64
07/20/2021,BILL,"To require an annual report on cooperation between the National Guard and Taiwan, and for other purposes.","Rep. Gallagher, Mike [R-WI-8]", House - Foreign Affairs; Armed Services        ,"House - 07/20/2021 Referred to the Committee on Foreign Affairs, and in addition to the Committee on Armed Services, for a period to be subsequently determined by the Speaker, in each case for consideration of such provisions as fall within the jurisdiction of the committee concerned. (",Introduced,https://www.congress.gov/bill/117th-congress/house-bill/4560?q=%7B%22search%22%3A%5B%22actionDate%3A%5C%22117%7C2021-07-20%5C%22+AND+%28billIsReserved%3A%5C%22N%5C%22+OR+type%3A%5C%22AMENDMENT%5C%22%29%22%5D%7D&s=1&r=65
07/20/2021,BILL,"To require the Secretary of Commerce to certify, before removing an entity from the entity list, that the entity is no longer involved in activities contrary to the national security or foreign policy interests of the United States and that removing the entity from the list does not pose a threat to allies of the United States.","Rep. Gimenez, Carlos A. [R-FL-26]", House - Foreign Affairs        ,House - 07/20/2021 Referred to the House Committee on Foreign Affairs. (,Introduced,https://www.congress.gov/bill/117th-congress/house-bill/4561?q=%7B%22search%22%3A%5B%22actionDate%3A%5C%22117%7C2021-07-20%5C%22+AND+%28billIsReserved%3A%5C%22N%5C%22+OR+type%3A%5C%22AMENDMENT%5C%22%29%22%5D%7D&s=1&r=66
07/20/2021,BILL,"To sanction the parents and guardians of unaccompanied alien minors, and for other purposes.","Rep. Gooden, Lance [R-TX-5]", House - Judiciary        ,House - 07/20/2021 Referred to the House Committee on the Judiciary. (,Introduced,https://www.congress.gov/bill/117th-congress/house-bill/4562?q=%7B%22search%22%3A%5B%22actionDate%3A%5C%22117%7C2021-07-20%5C%22+AND+%28billIsReserved%3A%5C%22N%5C%22+OR+type%3A%5C%22AMENDMENT%5C%22%29%22%5D%7D&s=1&r=67
07/20/2021,BILL,To amend title 11 of the United States Code to make debts for student loans dischargeable.,"Rep. Grothman, Glenn [R-WI-6]", House - Judiciary        ,House - 07/20/2021 Referred to the House Committee on the Judiciary. (,Introduced,https://www.congress.gov/bill/117th-congress/house-bill/4563?q=%7B%22search%22%3A%5B%22actionDate%3A%5C%22117%7C2021-07-20%5C%22+AND+%28billIsReserved%3A%5C%22N%5C%22+OR+type%3A%5C%22AMENDMENT%5C%22%29%22%5D%7D&s=1&r=68
07/20/2021,BILL,"To amend the Federal Trade Commission Act to require the Federal Trade Commission to publish on the website of the Commission documents to be voted on by the Commission, and for other purposes.","Rep. Guthrie, Brett [R-KY-2]", House - Energy and Commerce        ,House - 07/20/2021 Referred to the House Committee on Energy and Commerce. (,Introduced,https://www.congress.gov/bill/117th-congress/house-bill/4564?q=%7B%22search%22%3A%5B%22actionDate%3A%5C%22117%7C2021-07-20%5C%22+AND+%28billIsReserved%3A%5C%22N%5C%22+OR+type%3A%5C%22AMENDMENT%5C%22%29%22%5D%7D&s=1&r=69
07/20/2021,BILL,"To amend the Omnibus Crime Control and Safe Streets Act of 1968 to authorize the use of grant amounts for providing training and resources for first responders on the use of containment devices to prevent secondary exposure to fentanyl and other potentially lethal substances, and purchasing such containment devices for use by first responders.","Rep. Joyce, David P. [R-OH-14]", House - Judiciary        ,House - 07/20/2021 Referred to the House Committee on the Judiciary. (,Introduced,https://www.congress.gov/bill/117th-congress/house-bill/4565?q=%7B%22search%22%3A%5B%22actionDate%3A%5C%22117%7C2021-07-20%5C%22+AND+%28billIsReserved%3A%5C%22N%5C%22+OR+type%3A%5C%22AMENDMENT%5C%22%29%22%5D%7D&s=1&r=70
07/20/2021,BILL,"To direct the Secretary of Health and Human Services, acting through the Director of the Centers for Disease Control and Prevention, to award grants to States to implement a tick identification pilot program.","Rep. Katko, John [R-NY-24]", House - Energy and Commerce        ,House - 07/20/2021 Referred to the House Committee on Energy and Commerce. (,Introduced,https://www.congress.gov/bill/117th-congress/house-bill/4566?q=%7B%22search%22%3A%5B%22actionDate%3A%5C%22117%7C2021-07-20%5C%22+AND+%28billIsReserved%3A%5C%22N%5C%22+OR+type%3A%5C%22AMENDMENT%5C%22%29%22%5D%7D&s=1&r=71
07/20/2021,BILL,"To direct the Administrator of the Environmental Protection Agency to establish a household well water testing website, and for other purposes.","Rep. Kildee, Daniel T. [D-MI-5]", House - Energy and Commerce        ,House - 07/20/2021 Referred to the House Committee on Energy and Commerce. (,Introduced,https://www.congress.gov/bill/117th-congress/house-bill/4567?q=%7B%22search%22%3A%5B%22actionDate%3A%5C%22117%7C2021-07-20%5C%22+AND+%28billIsReserved%3A%5C%22N%5C%22+OR+type%3A%5C%22AMENDMENT%5C%22%29%22%5D%7D&s=1&r=72
07/20/2021,BILL,"To amend the American Rescue Plan Act of 2021 to provide additional appropriations for, and oversight of, the Restaurant Revitalization Fund, and for other purposes.","Rep. Luetkemeyer, Blaine [R-MO-3]", House - Small Business; Oversight and Reform        ,"House - 07/20/2021 Referred to the Committee on Small Business, and in addition to the Committee on Oversight and Reform, for a period to be subsequently determined by the Speaker, in each case for consideration of such provisions as fall within the jurisdiction of the committee... (",Introduced,https://www.congress.gov/bill/117th-congress/house-bill/4568?q=%7B%22search%22%3A%5B%22actionDate%3A%5C%22117%7C2021-07-20%5C%22+AND+%28billIsReserved%3A%5C%22N%5C%22+OR+type%3A%5C%22AMENDMENT%5C%22%29%22%5D%7D&s=1&r=73
07/20/2021,BILL,"To require that only two alternatives be considered with respect to certain proposed collaborative forest management activities, and for other purposes.","Rep. McClintock, Tom [R-CA-4]", House - Natural Resources; Agriculture        ,"House - 07/20/2021 Referred to the Committee on Natural Resources, and in addition to the Committee on Agriculture, for a period to be subsequently determined by the Speaker, in each case for consideration of such provisions as fall within the jurisdiction of the committee concerned. (",Introduced,https://www.congress.gov/bill/117th-congress/house-bill/4569?q=%7B%22search%22%3A%5B%22actionDate%3A%5C%22117%7C2021-07-20%5C%22+AND+%28billIsReserved%3A%5C%22N%5C%22+OR+type%3A%5C%22AMENDMENT%5C%22%29%22%5D%7D&s=1&r=74
07/20/2021,BILL,"To amend the Federal Water Pollution Control Act to modify the definition of navigable waters, and for other purposes.","Rep. Miller, Mary E. [R-IL-15]", House - Transportation and Infrastructure        ,House - 07/21/2021 Referred to the Subcommittee on Water Resources and Environment. (,Introduced,https://www.congress.gov/bill/117th-congress/house-bill/4570?q=%7B%22search%22%3A%5B%22actionDate%3A%5C%22117%7C2021-07-20%5C%22+AND+%28billIsReserved%3A%5C%22N%5C%22+OR+type%3A%5C%22AMENDMENT%5C%22%29%22%5D%7D&s=1&r=75
07/20/2021,BILL,"To amend title 38, United States Code, to direct the Under Secretary for Health of the Department of Veterans Affairs to provide mammography screening for veterans who served in locations associated with toxic exposure.","Rep. Miller-Meeks, Mariannette [R-IA-2]", House - Veterans' Affairs        ,House - 07/20/2021 Referred to the House Committee on Veterans' Affairs. (,Introduced,https://www.congress.gov/bill/117th-congress/house-bill/4571?q=%7B%22search%22%3A%5B%22actionDate%3A%5C%22117%7C2021-07-20%5C%22+AND+%28billIsReserved%3A%5C%22N%5C%22+OR+type%3A%5C%22AMENDMENT%5C%22%29%22%5D%7D&s=1&r=76
