date,type,title,sponsor,committees,latest_action,tracker,url
07/20/2021,BILL,To amend the Internal Revenue Code of 1986 to provide an age rating adjustment to the applicable percentage used to determine the credit for coverage under qualified health plans.,"Rep. Murphy, Stephanie N. [D-FL-7]", House - Ways and Means        ,House - 07/20/2021 Referred to the House Committee on Ways and Means. (,Introduced,https://www.congress.gov/bill/117th-congress/house-bill/4572?q=%7B%22search%22%3A%5B%22actionDate%3A%5C%22117%7C2021-07-20%5C%22+AND+%28billIsReserved%3A%5C%22N%5C%22+OR+type%3A%5C%22AMENDMENT%5C%22%29%22%5D%7D&s=1&r=77
07/20/2021,BILL,"To establish a categorical exclusion to improve or restore National Forest System land or public land or reduce the risk of wildfire, and for other purposes.","Rep. Newhouse, Dan [R-WA-4]", House - Natural Resources; Agriculture        ,"House - 07/20/2021 Referred to the Committee on Natural Resources, and in addition to the Committee on Agriculture, for a period to be subsequently determined by the Speaker, in each case for consideration of such provisions as fall within the jurisdiction of the committee concerned. (",Introduced,https://www.congress.gov/bill/117th-congress/house-bill/4573?q=%7B%22search%22%3A%5B%22actionDate%3A%5C%22117%7C2021-07-20%5C%22+AND+%28billIsReserved%3A%5C%22N%5C%22+OR+type%3A%5C%22AMENDMENT%5C%22%29%22%5D%7D&s=1&r=78
07/20/2021,BILL,"To expedite certain activities related to salvage operations and reforestation activities on National Forest System lands or public lands in response to catastrophic events, and for other purposes.","Rep. Obernolte, Jay [R-CA-8]", House - Natural Resources; Agriculture        ,"House - 07/20/2021 Referred to the Committee on Natural Resources, and in addition to the Committee on Agriculture, for a period to be subsequently determined by the Speaker, in each case for consideration of such provisions as fall within the jurisdiction of the committee concerned. (",Introduced,https://www.congress.gov/bill/117th-congress/house-bill/4574?q=%7B%22search%22%3A%5B%22actionDate%3A%5C%22117%7C2021-07-20%5C%22+AND+%28billIsReserved%3A%5C%22N%5C%22+OR+type%3A%5C%22AMENDMENT%5C%22%29%22%5D%7D&s=1&r=79
07/20/2021,BILL,"To amend the VA MISSION Act of 2018, to expand the peer specialist support program of the Department of Veterans Affairs to all medical centers of the Department, and for other purposes.","Rep. Peters, Scott H. [D-CA-52]", House - Veterans' Affairs        ,House - 07/20/2021 Referred to the House Committee on Veterans' Affairs. (,Introduced,https://www.congress.gov/bill/117th-congress/house-bill/4575?q=%7B%22search%22%3A%5B%22actionDate%3A%5C%22117%7C2021-07-20%5C%22+AND+%28billIsReserved%3A%5C%22N%5C%22+OR+type%3A%5C%22AMENDMENT%5C%22%29%22%5D%7D&s=1&r=80
07/20/2021,BILL,"To allow Americans to receive paid leave time to process and address their own health needs and the health needs of their partners during the period following a pregnancy loss, an unsuccessful round of intrauterine insemination or of an assisted reproductive technology procedure, a failed adoption arrangement, a failed surrogacy arrangement, or a diagnosis or event that impacts pregnancy or fertility, to support related research and education, and for other purposes.","Rep. Pressley, Ayanna [D-MA-7]", House - Education and Labor; House Administration; Oversight and Reform; Judiciary        ,"House - 07/20/2021 Referred to the Committee on Education and Labor, and in addition to the Committees on House Administration, Oversight and Reform, and the Judiciary, for a period to be subsequently determined by the Speaker, in each case for consideration of such provisions as... (",Introduced,https://www.congress.gov/bill/117th-congress/house-bill/4576?q=%7B%22search%22%3A%5B%22actionDate%3A%5C%22117%7C2021-07-20%5C%22+AND+%28billIsReserved%3A%5C%22N%5C%22+OR+type%3A%5C%22AMENDMENT%5C%22%29%22%5D%7D&s=1&r=81
07/20/2021,BILL,"To direct the Secretary of the Interior to establish a Park District Community Support Grant Program, and for other purposes.","Rep. Quigley, Mike [D-IL-5]", House - Natural Resources        ,House - 07/20/2021 Referred to the House Committee on Natural Resources. (,Introduced,https://www.congress.gov/bill/117th-congress/house-bill/4577?q=%7B%22search%22%3A%5B%22actionDate%3A%5C%22117%7C2021-07-20%5C%22+AND+%28billIsReserved%3A%5C%22N%5C%22+OR+type%3A%5C%22AMENDMENT%5C%22%29%22%5D%7D&s=1&r=82
07/20/2021,BILL,"To expand the H-2B visa program, and for other purposes.","Rep. Rice, Tom [R-SC-7]", House - Judiciary        ,House - 07/20/2021 Referred to the House Committee on the Judiciary. (,Introduced,https://www.congress.gov/bill/117th-congress/house-bill/4578?q=%7B%22search%22%3A%5B%22actionDate%3A%5C%22117%7C2021-07-20%5C%22+AND+%28billIsReserved%3A%5C%22N%5C%22+OR+type%3A%5C%22AMENDMENT%5C%22%29%22%5D%7D&s=1&r=83
07/20/2021,BILL,"To establish an arbitration process pilot program as an alternative dispute resolution process for certain objections or protests to qualified forest management activities, and for other purposes.","Rep. Rosendale Sr., Matthew M. [R-MT-At Large]", House - Natural Resources; Agriculture; Judiciary        ,"House - 07/20/2021 Referred to the Committee on Natural Resources, and in addition to the Committees on Agriculture, and the Judiciary, for a period to be subsequently determined by the Speaker, in each case for consideration of such provisions as fall within the jurisdiction of the... (",Introduced,https://www.congress.gov/bill/117th-congress/house-bill/4579?q=%7B%22search%22%3A%5B%22actionDate%3A%5C%22117%7C2021-07-20%5C%22+AND+%28billIsReserved%3A%5C%22N%5C%22+OR+type%3A%5C%22AMENDMENT%5C%22%29%22%5D%7D&s=1&r=84
07/20/2021,BILL,"To amend the Specialty Crops Competitiveness Act of 2004 to provide recovery payments to seasonal and perishable crop growers who experienced low prices caused by imports, and for other purposes.","Rep. Ruiz, Raul [D-CA-36]", House - Agriculture        ,House - 07/20/2021 Referred to the House Committee on Agriculture. (,Introduced,https://www.congress.gov/bill/117th-congress/house-bill/4580?q=%7B%22search%22%3A%5B%22actionDate%3A%5C%22117%7C2021-07-20%5C%22+AND+%28billIsReserved%3A%5C%22N%5C%22+OR+type%3A%5C%22AMENDMENT%5C%22%29%22%5D%7D&s=1&r=85
07/20/2021,BILL,"To provide for the issuance of a commemorative postage stamp in honor of Mamie Till-Mobley, and for other purposes.","Rep. Rush, Bobby L. [D-IL-1]", House - Oversight and Reform        ,House - 07/20/2021 Referred to the House Committee on Oversight and Reform. (,Introduced,https://www.congress.gov/bill/117th-congress/house-bill/4581?q=%7B%22search%22%3A%5B%22actionDate%3A%5C%22117%7C2021-07-20%5C%22+AND+%28billIsReserved%3A%5C%22N%5C%22+OR+type%3A%5C%22AMENDMENT%5C%22%29%22%5D%7D&s=1&r=86
07/20/2021,BILL,"To amend the definition of State in title I of the Omnibus Crime Control and Safe Streets Act of 1968, and for other purposes.","Del. Sablan, Gregorio Kilili Camacho [D-MP-At Large]", House - Judiciary        ,House - 07/20/2021 Referred to the House Committee on the Judiciary. (,Introduced,https://www.congress.gov/bill/117th-congress/house-bill/4582?q=%7B%22search%22%3A%5B%22actionDate%3A%5C%22117%7C2021-07-20%5C%22+AND+%28billIsReserved%3A%5C%22N%5C%22+OR+type%3A%5C%22AMENDMENT%5C%22%29%22%5D%7D&s=1&r=87
07/20/2021,BILL,"To amend title XIX of the Social Security Act to expand the requirement for States to suspend, rather than terminate, an individual's eligibility for medical assistance under the State Medicaid plan while the individual is an inmate of a public institution, to apply to inmates of any age.","Rep. Scott, Robert C. ""Bobby"" [D-VA-3]", House - Energy and Commerce        ,House - 07/20/2021 Referred to the House Committee on Energy and Commerce. (,Introduced,https://www.congress.gov/bill/117th-congress/house-bill/4583?q=%7B%22search%22%3A%5B%22actionDate%3A%5C%22117%7C2021-07-20%5C%22+AND+%28billIsReserved%3A%5C%22N%5C%22+OR+type%3A%5C%22AMENDMENT%5C%22%29%22%5D%7D&s=1&r=88
07/20/2021,BILL,"To establish a categorical exclusion for certain forest management activities relating to early successional forests and a categorical exclusion for certain activities relating to outdoor recreation, and for other purposes.","Rep. Stauber, Pete [R-MN-8]", House - Natural Resources; Agriculture        ,"House - 07/20/2021 Referred to the Committee on Natural Resources, and in addition to the Committee on Agriculture, for a period to be subsequently determined by the Speaker, in each case for consideration of such provisions as fall within the jurisdiction of the committee concerned. (",Introduced,https://www.congress.gov/bill/117th-congress/house-bill/4584?q=%7B%22search%22%3A%5B%22actionDate%3A%5C%22117%7C2021-07-20%5C%22+AND+%28billIsReserved%3A%5C%22N%5C%22+OR+type%3A%5C%22AMENDMENT%5C%22%29%22%5D%7D&s=1&r=89
07/20/2021,BILL,"To amend the Internal Revenue Code of 1986 to provide for flexible giving accounts, and for other purposes.","Rep. Suozzi, Thomas R. [D-NY-3]", House - Ways and Means        ,House - 07/20/2021 Referred to the House Committee on Ways and Means. (,Introduced,https://www.congress.gov/bill/117th-congress/house-bill/4585?q=%7B%22search%22%3A%5B%22actionDate%3A%5C%22117%7C2021-07-20%5C%22+AND+%28billIsReserved%3A%5C%22N%5C%22+OR+type%3A%5C%22AMENDMENT%5C%22%29%22%5D%7D&s=1&r=90
07/20/2021,BILL,To amend the Securities Exchange Act of 1934 with respect to risk-based examinations of Nationally Recognized Statistical Rating Organizations.,"Rep. Wagner, Ann [R-MO-2]", House - Financial Services        ,House - 07/20/2021 Referred to the House Committee on Financial Services. (,Introduced,https://www.congress.gov/bill/117th-congress/house-bill/4586?q=%7B%22search%22%3A%5B%22actionDate%3A%5C%22117%7C2021-07-20%5C%22+AND+%28billIsReserved%3A%5C%22N%5C%22+OR+type%3A%5C%22AMENDMENT%5C%22%29%22%5D%7D&s=1&r=91
07/20/2021,BILL,"To direct the Secretary of Health and Human Services to revise certain regulations in relation to the Medicare shared savings program and other advanced alternative payment arrangements to encourage participation in such program, and for other purposes.","Rep. Welch, Peter [D-VT-At Large]", House - Ways and Means; Energy and Commerce        ,"House - 07/20/2021 Referred to the Committee on Ways and Means, and in addition to the Committee on Energy and Commerce, for a period to be subsequently determined by the Speaker, in each case for consideration of such provisions as fall within the jurisdiction of the committee... (",Introduced,https://www.congress.gov/bill/117th-congress/house-bill/4587?q=%7B%22search%22%3A%5B%22actionDate%3A%5C%22117%7C2021-07-20%5C%22+AND+%28billIsReserved%3A%5C%22N%5C%22+OR+type%3A%5C%22AMENDMENT%5C%22%29%22%5D%7D&s=1&r=92
07/20/2021,BILL,"To amend the Stevenson-Wydler Technology Innovation Act of 1980 to establish a regional technology and innovation hub program, and for other purposes.","Rep. Wild, Susan [D-PA-7]"," House - Science, Space, and Technology        ","House - 07/20/2021 Referred to the House Committee on Science, Space, and Technology. (",Introduced,https://www.congress.gov/bill/117th-congress/house-bill/4588?q=%7B%22search%22%3A%5B%22actionDate%3A%5C%22117%7C2021-07-20%5C%22+AND+%28billIsReserved%3A%5C%22N%5C%22+OR+type%3A%5C%22AMENDMENT%5C%22%29%22%5D%7D&s=1&r=93
07/20/2021,CONCURRENT RESOLUTION,Authorizing the use of the Capitol Grounds for the National Peace Officers Memorial Service and the National Honor Guard and Pipe Band Exhibition.,"Rep. Titus, Dina [D-NV-1]", House - Transportation and Infrastructure        ,"House - 07/21/2021 Referred to the Subcommittee on Economic Development, Public Buildings, and Emergency Management. (",Introduced,https://www.congress.gov/bill/117th-congress/house-concurrent-resolution/41?q=%7B%22search%22%3A%5B%22actionDate%3A%5C%22117%7C2021-07-20%5C%22+AND+%28billIsReserved%3A%5C%22N%5C%22+OR+type%3A%5C%22AMENDMENT%5C%22%29%22%5D%7D&s=1&r=94
07/20/2021,RESOLUTION,Reaffirming the commitment to media diversity and pledging to work with media entities and diverse stakeholders to develop common ground solutions to eliminate barriers to media diversity.,"Rep. Demings, Val Butler [D-FL-10]", House - Energy and Commerce        ,House - 07/20/2021 Pursuant to section 7 of ,Agreed to in House,https://www.congress.gov/bill/117th-congress/house-resolution/277?q=%7B%22search%22%3A%5B%22actionDate%3A%5C%22117%7C2021-07-20%5C%22+AND+%28billIsReserved%3A%5C%22N%5C%22+OR+type%3A%5C%22AMENDMENT%5C%22%29%22%5D%7D&s=1&r=95
07/20/2021,RESOLUTION,Encouraging reunions of divided Korean-American families.,"Rep. Bass, Karen [D-CA-37]", House - Foreign Affairs        ,House - 07/20/2021 Pursuant to section 7 of ,Agreed to in House,https://www.congress.gov/bill/117th-congress/house-resolution/294?q=%7B%22search%22%3A%5B%22actionDate%3A%5C%22117%7C2021-07-20%5C%22+AND+%28billIsReserved%3A%5C%22N%5C%22+OR+type%3A%5C%22AMENDMENT%5C%22%29%22%5D%7D&s=1&r=96
07/20/2021,RESOLUTION,"Providing for consideration of the bill (H.R. 2467) to require the Administrator of the Environmental Protection Agency to designate per- and polyfluoroalkyl substances as hazardous substances under the Comprehensive Environmental Response, Compensation, and Liability Act of 1980; providing for consideration of the bill (H.R. 2668) to amend the Federal Trade Commission Act to affirmatively confirm the authority of the Federal Trade Commission to seek permanent injunctions and other equitable relief for violations of any provision of law enforced by the Commission; and providing for consideration of the bill (H.R. 3985) to amend the Afghan Allies Protection Act of 2009 to expedite the special immigrant visa process for certain Afghan allies, and for other purposes.","Rep. Ross, Deborah K. [D-NC-2]", House - Rules        ,House - 07/20/2021 Motion to reconsider laid on the table Agreed to without objection. (,Agreed to in House,https://www.congress.gov/bill/117th-congress/house-resolution/535?q=%7B%22search%22%3A%5B%22actionDate%3A%5C%22117%7C2021-07-20%5C%22+AND+%28billIsReserved%3A%5C%22N%5C%22+OR+type%3A%5C%22AMENDMENT%5C%22%29%22%5D%7D&s=1&r=97
07/20/2021,RESOLUTION,"Expressing the sense of the House of Representatives regarding the motivations of the members of the Texas Legislature who have fled to the Nation's capital from Texas and urging the Sergeant at Arms of the House, the United States Capitol Police, and Department of Justice to cooperate with the Texas Department of Public Safety in their efforts to return these members to Texas.","Rep. Van Duyne, Beth [R-TX-24]", House - Judiciary; House Administration        ,"House - 07/20/2021 Referred to the Committee on the Judiciary, and in addition to the Committee on House Administration, for a period to be subsequently determined by the Speaker, in each case for consideration of such provisions as fall within the jurisdiction of the committee... (",Introduced,https://www.congress.gov/bill/117th-congress/house-resolution/540?q=%7B%22search%22%3A%5B%22actionDate%3A%5C%22117%7C2021-07-20%5C%22+AND+%28billIsReserved%3A%5C%22N%5C%22+OR+type%3A%5C%22AMENDMENT%5C%22%29%22%5D%7D&s=1&r=98
07/20/2021,RESOLUTION,"Expressing support for the recognition of July as ""Muslim-American Heritage Month"" and celebrating the heritage and culture of Muslim Americans in the United States.","Rep. Bass, Karen [D-CA-37]", House - Oversight and Reform        ,House - 07/20/2021 Referred to the House Committee on Oversight and Reform. (,Introduced,https://www.congress.gov/bill/117th-congress/house-resolution/541?q=%7B%22search%22%3A%5B%22actionDate%3A%5C%22117%7C2021-07-20%5C%22+AND+%28billIsReserved%3A%5C%22N%5C%22+OR+type%3A%5C%22AMENDMENT%5C%22%29%22%5D%7D&s=1&r=99
07/20/2021,RESOLUTION,"Expressing support for the designation of July 2021 as ""American Grown Flower and Foliage Month"".","Rep. Carbajal, Salud O. [D-CA-24]", House - Agriculture        ,House - 07/20/2021 Referred to the House Committee on Agriculture. (,Introduced,https://www.congress.gov/bill/117th-congress/house-resolution/542?q=%7B%22search%22%3A%5B%22actionDate%3A%5C%22117%7C2021-07-20%5C%22+AND+%28billIsReserved%3A%5C%22N%5C%22+OR+type%3A%5C%22AMENDMENT%5C%22%29%22%5D%7D&s=1&r=100
07/21/2021,BILL,Construction Consensus Procurement Improvement Act of 2021,"Rep. Comer, James [R-KY-1]", House - Oversight and Reform; Budget | Senate - Homeland Security and Governmental Affairs        ,,To President,https://www.congress.gov/bill/117th-congress/house-bill/26?q=%7B%22search%22%3A%5B%22actionDate%3A%5C%22117%7C2021-07-21%5C%22+AND+%28billIsReserved%3A%5C%22N%5C%22+OR+type%3A%5C%22AMENDMENT%5C%22%29%22%5D%7D&s=1&r=1
07/21/2021,BILL,Immunization Infrastructure Modernization Act of 2021,"Rep. Kuster, Ann M. [D-NH-2]", House - Energy and Commerce        ,House - 07/21/2021 Ordered to be Reported (Amended) by Voice Vote. (,Introduced,https://www.congress.gov/bill/117th-congress/house-bill/550?q=%7B%22search%22%3A%5B%22actionDate%3A%5C%22117%7C2021-07-21%5C%22+AND+%28billIsReserved%3A%5C%22N%5C%22+OR+type%3A%5C%22AMENDMENT%5C%22%29%22%5D%7D&s=1&r=2
07/21/2021,BILL,Drug-Free Communities Pandemic Relief Act,"Rep. Joyce, David P. [R-OH-14]", House - Energy and Commerce        ,House - 07/21/2021 Ordered to be Reported (Amended) by Voice Vote. (,Introduced,https://www.congress.gov/bill/117th-congress/house-bill/654?q=%7B%22search%22%3A%5B%22actionDate%3A%5C%22117%7C2021-07-21%5C%22+AND+%28billIsReserved%3A%5C%22N%5C%22+OR+type%3A%5C%22AMENDMENT%5C%22%29%22%5D%7D&s=1&r=3
07/21/2021,BILL,PHONE Act of 2021,"Rep. Thompson, Mike [D-CA-5]"," House - Energy and Commerce | Senate - Commerce, Science, and Transportation        ","Senate - 07/21/2021 Received in the Senate and Read twice and referred to the Committee on Commerce, Science, and Transportation. (",Passed House,https://www.congress.gov/bill/117th-congress/house-bill/678?q=%7B%22search%22%3A%5B%22actionDate%3A%5C%22117%7C2021-07-21%5C%22+AND+%28billIsReserved%3A%5C%22N%5C%22+OR+type%3A%5C%22AMENDMENT%5C%22%29%22%5D%7D&s=1&r=4
07/21/2021,BILL,Maternal Vaccination Act,"Rep. Sewell, Terri A. [D-AL-7]", House - Energy and Commerce        ,House - 07/21/2021 Ordered to be Reported by Voice Vote. (,Introduced,https://www.congress.gov/bill/117th-congress/house-bill/951?q=%7B%22search%22%3A%5B%22actionDate%3A%5C%22117%7C2021-07-21%5C%22+AND+%28billIsReserved%3A%5C%22N%5C%22+OR+type%3A%5C%22AMENDMENT%5C%22%29%22%5D%7D&s=1&r=5
07/21/2021,BILL,Bassam Barabandi Rewards for Justice Act,"Rep. Wilson, Joe [R-SC-2]", House - Foreign Affairs | Senate - Foreign Relations        ,Senate - 07/21/2021 Received in the Senate and Read twice and referred to the Committee on Foreign Relations. (,Passed House,https://www.congress.gov/bill/117th-congress/house-bill/1036?q=%7B%22search%22%3A%5B%22actionDate%3A%5C%22117%7C2021-07-21%5C%22+AND+%28billIsReserved%3A%5C%22N%5C%22+OR+type%3A%5C%22AMENDMENT%5C%22%29%22%5D%7D&s=1&r=6
07/21/2021,BILL,Desert Locust Control Act,"Rep. Smith, Christopher H. [R-NJ-4]", House - Foreign Affairs | Senate - Foreign Relations        ,Senate - 07/21/2021 Received in the Senate and Read twice and referred to the Committee on Foreign Relations. (,Passed House,https://www.congress.gov/bill/117th-congress/house-bill/1079?q=%7B%22search%22%3A%5B%22actionDate%3A%5C%22117%7C2021-07-21%5C%22+AND+%28billIsReserved%3A%5C%22N%5C%22+OR+type%3A%5C%22AMENDMENT%5C%22%29%22%5D%7D&s=1&r=7
07/21/2021,BILL,Refugee Sanitation Facility Safety Act of 2021,"Rep. Meng, Grace [D-NY-6]", House - Foreign Affairs | Senate - Foreign Relations        ,Senate - 07/21/2021 Received in the Senate and Read twice and referred to the Committee on Foreign Relations. (,Passed House,https://www.congress.gov/bill/117th-congress/house-bill/1158?q=%7B%22search%22%3A%5B%22actionDate%3A%5C%22117%7C2021-07-21%5C%22+AND+%28billIsReserved%3A%5C%22N%5C%22+OR+type%3A%5C%22AMENDMENT%5C%22%29%22%5D%7D&s=1&r=8
07/21/2021,BILL,Emergency Reporting Act,"Rep. Matsui, Doris O. [D-CA-6]"," House - Energy and Commerce | Senate - Commerce, Science, and Transportation        ","Senate - 07/21/2021 Received in the Senate and Read twice and referred to the Committee on Commerce, Science, and Transportation. (",Passed House,https://www.congress.gov/bill/117th-congress/house-bill/1250?q=%7B%22search%22%3A%5B%22actionDate%3A%5C%22117%7C2021-07-21%5C%22+AND+%28billIsReserved%3A%5C%22N%5C%22+OR+type%3A%5C%22AMENDMENT%5C%22%29%22%5D%7D&s=1&r=9
07/21/2021,BILL,PREVENT HPV Cancers Act of 2021,"Rep. Castor, Kathy [D-FL-14]", House - Energy and Commerce        ,House - 07/21/2021 Ordered to be Reported (Amended) by Voice Vote. (,Introduced,https://www.congress.gov/bill/117th-congress/house-bill/1550?q=%7B%22search%22%3A%5B%22actionDate%3A%5C%22117%7C2021-07-21%5C%22+AND+%28billIsReserved%3A%5C%22N%5C%22+OR+type%3A%5C%22AMENDMENT%5C%22%29%22%5D%7D&s=1&r=10
07/21/2021,LAW,VOCA Fix to Sustain the Crime Victims Fund Act of 2021,"Rep. Nadler, Jerrold [D-NY-10]", House - Judiciary        ,,Became Law,https://www.congress.gov/bill/117th-congress/house-bill/1652?q=%7B%22search%22%3A%5B%22actionDate%3A%5C%22117%7C2021-07-21%5C%22+AND+%28billIsReserved%3A%5C%22N%5C%22+OR+type%3A%5C%22AMENDMENT%5C%22%29%22%5D%7D&s=1&r=11
07/21/2021,BILL,Native American Child Protection Act,"Rep. Gallego, Ruben [D-AZ-7]", House - Natural Resources | Senate - Indian Affairs        ,Senate - 07/21/2021 Committee on Indian Affairs. Hearings held. (,Passed House,https://www.congress.gov/bill/117th-congress/house-bill/1688?q=%7B%22search%22%3A%5B%22actionDate%3A%5C%22117%7C2021-07-21%5C%22+AND+%28billIsReserved%3A%5C%22N%5C%22+OR+type%3A%5C%22AMENDMENT%5C%22%29%22%5D%7D&s=1&r=12
07/21/2021,BILL,EQUAL Act,"Rep. Jeffries, Hakeem S. [D-NY-8]", House - Judiciary; Energy and Commerce        ,House - 07/21/2021 Ordered to be Reported (Amended). (,Introduced,https://www.congress.gov/bill/117th-congress/house-bill/1693?q=%7B%22search%22%3A%5B%22actionDate%3A%5C%22117%7C2021-07-21%5C%22+AND+%28billIsReserved%3A%5C%22N%5C%22+OR+type%3A%5C%22AMENDMENT%5C%22%29%22%5D%7D&s=1&r=13
07/21/2021,BILL,MEDIA Diversity Act of 2021,"Rep. Long, Billy [R-MO-7]"," House - Energy and Commerce | Senate - Commerce, Science, and Transportation        ","Senate - 07/21/2021 Received in the Senate and Read twice and referred to the Committee on Commerce, Science, and Transportation. (",Passed House,https://www.congress.gov/bill/117th-congress/house-bill/1754?q=%7B%22search%22%3A%5B%22actionDate%3A%5C%22117%7C2021-07-21%5C%22+AND+%28billIsReserved%3A%5C%22N%5C%22+OR+type%3A%5C%22AMENDMENT%5C%22%29%22%5D%7D&s=1&r=14
07/21/2021,BILL,DHS Industrial Control Systems Capabilities Enhancement Act of 2021,"Rep. Katko, John [R-NY-24]", House - Homeland Security | Senate - Homeland Security and Governmental Affairs        ,Senate - 07/21/2021 Received in the Senate and Read twice and referred to the Committee on Homeland Security and Governmental Affairs. (,Passed House,https://www.congress.gov/bill/117th-congress/house-bill/1833?q=%7B%22search%22%3A%5B%22actionDate%3A%5C%22117%7C2021-07-21%5C%22+AND+%28billIsReserved%3A%5C%22N%5C%22+OR+type%3A%5C%22AMENDMENT%5C%22%29%22%5D%7D&s=1&r=15
07/21/2021,BILL,Supporting Research and Development for First Responders Act,"Rep. Rice, Kathleen M. [D-NY-4]", House - Homeland Security | Senate - Homeland Security and Governmental Affairs        ,Senate - 07/21/2021 Received in the Senate and Read twice and referred to the Committee on Homeland Security and Governmental Affairs. (,Passed House,https://www.congress.gov/bill/117th-congress/house-bill/1850?q=%7B%22search%22%3A%5B%22actionDate%3A%5C%22117%7C2021-07-21%5C%22+AND+%28billIsReserved%3A%5C%22N%5C%22+OR+type%3A%5C%22AMENDMENT%5C%22%29%22%5D%7D&s=1&r=16
07/21/2021,BILL,Strengthening Local Transportation Security Capabilities Act of 2021,"Rep. Barragan, Nanette Diaz [D-CA-44]", House - Homeland Security | Senate - Homeland Security and Governmental Affairs        ,Senate - 07/21/2021 Received in the Senate and Read twice and referred to the Committee on Homeland Security and Governmental Affairs. (,Passed House,https://www.congress.gov/bill/117th-congress/house-bill/1870?q=%7B%22search%22%3A%5B%22actionDate%3A%5C%22117%7C2021-07-21%5C%22+AND+%28billIsReserved%3A%5C%22N%5C%22+OR+type%3A%5C%22AMENDMENT%5C%22%29%22%5D%7D&s=1&r=17
07/21/2021,BILL,Transportation Security Transparency Improvement Act,"Rep. Bishop, Dan [R-NC-9]"," House - Homeland Security | Senate - Commerce, Science, and Transportation        ","Senate - 07/21/2021 Received in the Senate and Read twice and referred to the Committee on Commerce, Science, and Transportation. (",Passed House,https://www.congress.gov/bill/117th-congress/house-bill/1871?q=%7B%22search%22%3A%5B%22actionDate%3A%5C%22117%7C2021-07-21%5C%22+AND+%28billIsReserved%3A%5C%22N%5C%22+OR+type%3A%5C%22AMENDMENT%5C%22%29%22%5D%7D&s=1&r=18
07/21/2021,BILL,Security Screening During COVID-19 Act,"Rep. Cleaver, Emanuel [D-MO-5]"," House - Homeland Security | Senate - Commerce, Science, and Transportation        ","Senate - 07/21/2021 Received in the Senate and Read twice and referred to the Committee on Commerce, Science, and Transportation. (",Passed House,https://www.congress.gov/bill/117th-congress/house-bill/1877?q=%7B%22search%22%3A%5B%22actionDate%3A%5C%22117%7C2021-07-21%5C%22+AND+%28billIsReserved%3A%5C%22N%5C%22+OR+type%3A%5C%22AMENDMENT%5C%22%29%22%5D%7D&s=1&r=19
