date,type,title,sponsor,committees,latest_action,tracker,url
10/28/2021,BILL,"A bill to require the use of the voice and vote of the United States in international financial institutions to advance the cause of transitioning the global economy to a clean energy economy and to prohibit United States Government assistance to countries or entities to support fossil fuel activity, and for other purposes.","Sen. Merkley, Jeff [D-OR]", Senate - Foreign Relations        ,Senate - 10/28/2021 Read twice and referred to the Committee on Foreign Relations. (,Introduced,https://www.congress.gov/bill/117th-congress/senate-bill/3106?q=%7B%22search%22%3A%5B%22actionDate%3A%5C%22117%7C2021-10-28%5C%22+AND+%28billIsReserved%3A%5C%22N%5C%22+OR+type%3A%5C%22AMENDMENT%5C%22%29%22%2C%22%5C%22117%7C2021-10-28%5C%22%22%5D%7D&s=1&r=65
10/28/2021,BILL,"A bill to provide incentives for States to eliminate statutes of limitation related to child sexual abuse, and for other purposes.","Sen. Gillibrand, Kirsten [D-NY]", Senate - Judiciary        ,Senate - 10/28/2021 Read twice and referred to the Committee on the Judiciary. (,Introduced,https://www.congress.gov/bill/117th-congress/senate-bill/3107?q=%7B%22search%22%3A%5B%22actionDate%3A%5C%22117%7C2021-10-28%5C%22+AND+%28billIsReserved%3A%5C%22N%5C%22+OR+type%3A%5C%22AMENDMENT%5C%22%29%22%2C%22%5C%22117%7C2021-10-28%5C%22%22%5D%7D&s=1&r=66
10/28/2021,BILL,"A bill to provide counsel for unaccompanied children, and for other purposes.","Sen. Hirono, Mazie [D-HI]", Senate - Judiciary        ,Senate - 10/28/2021 Read twice and referred to the Committee on the Judiciary. (Sponsor introductory remarks on measure: CR ,Introduced,https://www.congress.gov/bill/117th-congress/senate-bill/3108?q=%7B%22search%22%3A%5B%22actionDate%3A%5C%22117%7C2021-10-28%5C%22+AND+%28billIsReserved%3A%5C%22N%5C%22+OR+type%3A%5C%22AMENDMENT%5C%22%29%22%2C%22%5C%22117%7C2021-10-28%5C%22%22%5D%7D&s=1&r=67
10/27/2021,AMENDMENT,,,,,,https://www.congress.gov/search?q=%7B%22congress%22%3A%22all%22%2C%22source%22%3A%22legislation%22%2C%22search%22%3A%22actionDate%3A%5C%22117%7C2021-10-27%5C%22+AND+%28billIsReserved%3A%5C%22N%5C%22+OR+type%3A%5C%22AMENDMENT%5C%22%29%22%7D&pageSort=documentNumber%3Aasc
10/26/2021,BILL,Family Violence Prevention and Services Improvement Act of 2021,"Rep. McBath, Lucy [D-GA-6]", House - Education and Labor        ,Senate - 10/27/2021 Received in the Senate. Read twice. Placed on Senate Legislative Calendar under General Orders. Calendar No. 156. (,Passed House,https://www.congress.gov/bill/117th-congress/house-bill/2119?q=%7B%22search%22%3A%5B%22actionDate%3A%5C%22117%7C2021-10-26%5C%22+AND+%28billIsReserved%3A%5C%22N%5C%22+OR+type%3A%5C%22AMENDMENT%5C%22%29%22%2C%22%5C%22117%7C2021-10-26%5C%22%22%5D%7D&s=1&r=2
10/26/2021,BILL,Financial Exploitation Prevention Act of 2021,"Rep. Wagner, Ann [R-MO-2]"," House - Financial Services | Senate - Banking, Housing, and Urban Affairs        ","Senate - 10/26/2021 Received in the Senate and Read twice and referred to the Committee on Banking, Housing, and Urban Affairs. (",Passed House,https://www.congress.gov/bill/117th-congress/house-bill/2265?q=%7B%22search%22%3A%5B%22actionDate%3A%5C%22117%7C2021-10-26%5C%22+AND+%28billIsReserved%3A%5C%22N%5C%22+OR+type%3A%5C%22AMENDMENT%5C%22%29%22%2C%22%5C%22117%7C2021-10-26%5C%22%22%5D%7D&s=1&r=3
10/26/2021,BILL,Financial Transparency Act of 2021,"Rep. Maloney, Carolyn B. [D-NY-12]"," House - Financial Services; Agriculture | Senate - Banking, Housing, and Urban Affairs        ","Senate - 10/26/2021 Received in the Senate and Read twice and referred to the Committee on Banking, Housing, and Urban Affairs. (",Passed House,https://www.congress.gov/bill/117th-congress/house-bill/2989?q=%7B%22search%22%3A%5B%22actionDate%3A%5C%22117%7C2021-10-26%5C%22+AND+%28billIsReserved%3A%5C%22N%5C%22+OR+type%3A%5C%22AMENDMENT%5C%22%29%22%2C%22%5C%22117%7C2021-10-26%5C%22%22%5D%7D&s=1&r=4
10/26/2021,BILL,PUMP for Nursing Mothers Act,"Rep. Maloney, Carolyn B. [D-NY-12]", House - Education and Labor        ,Senate - 10/26/2021 Read twice. Placed on Senate Legislative Calendar under General Orders. Calendar No. 155. (,Passed House,https://www.congress.gov/bill/117th-congress/house-bill/3110?q=%7B%22search%22%3A%5B%22actionDate%3A%5C%22117%7C2021-10-26%5C%22+AND+%28billIsReserved%3A%5C%22N%5C%22+OR+type%3A%5C%22AMENDMENT%5C%22%29%22%2C%22%5C%22117%7C2021-10-26%5C%22%22%5D%7D&s=1&r=5
10/26/2021,BILL,American Cybersecurity Literacy Act,"Rep. Kinzinger, Adam [R-IL-16]", House - Energy and Commerce        ,"House - 10/26/2021 Placed on the Union Calendar, Calendar No. 113. (",Introduced,https://www.congress.gov/bill/117th-congress/house-bill/4055?q=%7B%22search%22%3A%5B%22actionDate%3A%5C%22117%7C2021-10-26%5C%22+AND+%28billIsReserved%3A%5C%22N%5C%22+OR+type%3A%5C%22AMENDMENT%5C%22%29%22%2C%22%5C%22117%7C2021-10-26%5C%22%22%5D%7D&s=1&r=6
10/26/2021,BILL,Sovereign Debt Contract Capacity Act,"Rep. Waters, Maxine [D-CA-43]", House - Financial Services | Senate - Foreign Relations        ,Senate - 10/26/2021 Received in the Senate and Read twice and referred to the Committee on Foreign Relations. (,Passed House,https://www.congress.gov/bill/117th-congress/house-bill/4111?q=%7B%22search%22%3A%5B%22actionDate%3A%5C%22117%7C2021-10-26%5C%22+AND+%28billIsReserved%3A%5C%22N%5C%22+OR+type%3A%5C%22AMENDMENT%5C%22%29%22%2C%22%5C%22117%7C2021-10-26%5C%22%22%5D%7D&s=1&r=7
10/26/2021,BILL,Department of Homeland Security Office for Civil Rights and Civil Liberties Authorization Act,"Rep. Green, Al [D-TX-9]", House - Homeland Security        ,House - 10/26/2021 Ordered to be Reported (Amended) by Voice Vote. (,Introduced,https://www.congress.gov/bill/117th-congress/house-bill/4349?q=%7B%22search%22%3A%5B%22actionDate%3A%5C%22117%7C2021-10-26%5C%22+AND+%28billIsReserved%3A%5C%22N%5C%22+OR+type%3A%5C%22AMENDMENT%5C%22%29%22%2C%22%5C%22117%7C2021-10-26%5C%22%22%5D%7D&s=1&r=8
10/26/2021,BILL,DHS Trade and Economic Security Council Act of 2021,"Rep. Meijer, Peter [R-MI-3]", House - Homeland Security; Energy and Commerce        ,House - 10/26/2021 Ordered to be Reported (Amended) by Voice Vote. (,Introduced,https://www.congress.gov/bill/117th-congress/house-bill/4476?q=%7B%22search%22%3A%5B%22actionDate%3A%5C%22117%7C2021-10-26%5C%22+AND+%28billIsReserved%3A%5C%22N%5C%22+OR+type%3A%5C%22AMENDMENT%5C%22%29%22%2C%22%5C%22117%7C2021-10-26%5C%22%22%5D%7D&s=1&r=9
10/26/2021,BILL,"To award posthumously a Congressional Gold Medal, in commemoration to the servicemembers who perished in Afghanistan on August 26, 2021, during the evacuation of citizens of the United States and Afghan allies at Hamid Karzai International Airport, and for other purposes.","Rep. McClain, Lisa C. [R-MI-10]", House - Financial Services; House Administration        ,Senate - 10/26/2021 Received in the Senate. (,Passed House,https://www.congress.gov/bill/117th-congress/house-bill/5142?q=%7B%22search%22%3A%5B%22actionDate%3A%5C%22117%7C2021-10-26%5C%22+AND+%28billIsReserved%3A%5C%22N%5C%22+OR+type%3A%5C%22AMENDMENT%5C%22%29%22%2C%22%5C%22117%7C2021-10-26%5C%22%22%5D%7D&s=1&r=10
10/26/2021,BILL,TRANSLATE Act,"Rep. Titus, Dina [D-NV-1]", House - Homeland Security        ,House - 10/26/2021 Ordered to be Reported (Amended) by Voice Vote. (,Introduced,https://www.congress.gov/bill/117th-congress/house-bill/5574?q=%7B%22search%22%3A%5B%22actionDate%3A%5C%22117%7C2021-10-26%5C%22+AND+%28billIsReserved%3A%5C%22N%5C%22+OR+type%3A%5C%22AMENDMENT%5C%22%29%22%2C%22%5C%22117%7C2021-10-26%5C%22%22%5D%7D&s=1&r=11
10/26/2021,BILL,Homeland Security Capabilities Preservation Act,"Rep. Demings, Val Butler [D-FL-10]", House - Homeland Security        ,House - 10/26/2021 Ordered to be Reported by Voice Vote. (,Introduced,https://www.congress.gov/bill/117th-congress/house-bill/5615?q=%7B%22search%22%3A%5B%22actionDate%3A%5C%22117%7C2021-10-26%5C%22+AND+%28billIsReserved%3A%5C%22N%5C%22+OR+type%3A%5C%22AMENDMENT%5C%22%29%22%2C%22%5C%22117%7C2021-10-26%5C%22%22%5D%7D&s=1&r=12
10/28/2021,BILL,"A bill to improve commercialization activities in the SBIR and STTR programs, and for other purposes.","Sen. Coons, Christopher [D-DE]", Senate - Small Business and Entrepreneurship        ,Senate - 10/28/2021 Read twice and referred to the Committee on Small Business and Entrepreneurship. (,Introduced,https://www.congress.gov/bill/117th-congress/senate-bill/3109?q=%7B%22search%22%3A%5B%22actionDate%3A%5C%22117%7C2021-10-28%5C%22+AND+%28billIsReserved%3A%5C%22N%5C%22+OR+type%3A%5C%22AMENDMENT%5C%22%29%22%2C%22%5C%22117%7C2021-10-28%5C%22%22%5D%7D&s=1&r=68
10/28/2021,BILL,A bill to require the Director of the Office of Management and Budget to issue guidance relating to reporting by agencies on Federal financial assistance programs that do not provide Federal financial assistance during the 1-year period preceding the date of the report.,"Sen. Ernst, Joni [R-IA]", Senate - Homeland Security and Governmental Affairs        ,Senate - 10/28/2021 Read twice and referred to the Committee on Homeland Security and Governmental Affairs. (,Introduced,https://www.congress.gov/bill/117th-congress/senate-bill/3110?q=%7B%22search%22%3A%5B%22actionDate%3A%5C%22117%7C2021-10-28%5C%22+AND+%28billIsReserved%3A%5C%22N%5C%22+OR+type%3A%5C%22AMENDMENT%5C%22%29%22%2C%22%5C%22117%7C2021-10-28%5C%22%22%5D%7D&s=1&r=69
10/28/2021,BILL,"A bill to require the Secretary of Energy to establish a grant program to support hydrogen-fueled equipment at ports and to conduct a study with the Secretary of Transportation and the Secretary of Homeland Security on the feasibility and safety of using hydrogen-derived fuels, including ammonia, as a shipping fuel.","Sen. Cornyn, John [R-TX]"," Senate - Commerce, Science, and Transportation        ","Senate - 10/28/2021 Read twice and referred to the Committee on Commerce, Science, and Transportation. (",Introduced,https://www.congress.gov/bill/117th-congress/senate-bill/3111?q=%7B%22search%22%3A%5B%22actionDate%3A%5C%22117%7C2021-10-28%5C%22+AND+%28billIsReserved%3A%5C%22N%5C%22+OR+type%3A%5C%22AMENDMENT%5C%22%29%22%2C%22%5C%22117%7C2021-10-28%5C%22%22%5D%7D&s=1&r=70
10/28/2021,BILL,"A bill to amend the Energy Policy Act of 2005 to establish a Hydrogen Technologies for Heavy Industry Grant Program, and for other purposes.","Sen. Coons, Christopher [D-DE]", Senate - Energy and Natural Resources        ,Senate - 10/28/2021 Read twice and referred to the Committee on Energy and Natural Resources. (,Introduced,https://www.congress.gov/bill/117th-congress/senate-bill/3112?q=%7B%22search%22%3A%5B%22actionDate%3A%5C%22117%7C2021-10-28%5C%22+AND+%28billIsReserved%3A%5C%22N%5C%22+OR+type%3A%5C%22AMENDMENT%5C%22%29%22%2C%22%5C%22117%7C2021-10-28%5C%22%22%5D%7D&s=1&r=71
10/28/2021,BILL,"A bill to authorize the Attorney General to make grants to State and Tribal courts in order to allow the electronic service of certain court orders, and for other purposes.","Sen. Sullivan, Dan [R-AK]", Senate - Judiciary        ,Senate - 10/28/2021 Read twice and referred to the Committee on the Judiciary. (,Introduced,https://www.congress.gov/bill/117th-congress/senate-bill/3113?q=%7B%22search%22%3A%5B%22actionDate%3A%5C%22117%7C2021-10-28%5C%22+AND+%28billIsReserved%3A%5C%22N%5C%22+OR+type%3A%5C%22AMENDMENT%5C%22%29%22%2C%22%5C%22117%7C2021-10-28%5C%22%22%5D%7D&s=1&r=72
10/28/2021,BILL,"A bill to expand and improve the Legal Assistance for Victims Grant Program to ensure legal assistance is provided for survivors in proceedings related to domestic violence and sexual assault, and for other purposes.","Sen. Sullivan, Dan [R-AK]", Senate - Judiciary        ,Senate - 10/28/2021 Read twice and referred to the Committee on the Judiciary. (,Introduced,https://www.congress.gov/bill/117th-congress/senate-bill/3114?q=%7B%22search%22%3A%5B%22actionDate%3A%5C%22117%7C2021-10-28%5C%22+AND+%28billIsReserved%3A%5C%22N%5C%22+OR+type%3A%5C%22AMENDMENT%5C%22%29%22%2C%22%5C%22117%7C2021-10-28%5C%22%22%5D%7D&s=1&r=73
10/28/2021,BILL,A bill to remove the 4-year sunset from the Pro bono Work to Empower and Represent Act of 2018.,"Sen. Sullivan, Dan [R-AK]", Senate - Judiciary        ,Senate - 10/28/2021 Read twice and referred to the Committee on the Judiciary. (,Introduced,https://www.congress.gov/bill/117th-congress/senate-bill/3115?q=%7B%22search%22%3A%5B%22actionDate%3A%5C%22117%7C2021-10-28%5C%22+AND+%28billIsReserved%3A%5C%22N%5C%22+OR+type%3A%5C%22AMENDMENT%5C%22%29%22%2C%22%5C%22117%7C2021-10-28%5C%22%22%5D%7D&s=1&r=74
10/28/2021,BILL,"A bill to amend title 36, United States Code, to designate October 1 as Choose Respect Day, and for other purposes.","Sen. Sullivan, Dan [R-AK]", Senate - Judiciary        ,Senate - 10/28/2021 Read twice and referred to the Committee on the Judiciary. (,Introduced,https://www.congress.gov/bill/117th-congress/senate-bill/3116?q=%7B%22search%22%3A%5B%22actionDate%3A%5C%22117%7C2021-10-28%5C%22+AND+%28billIsReserved%3A%5C%22N%5C%22+OR+type%3A%5C%22AMENDMENT%5C%22%29%22%2C%22%5C%22117%7C2021-10-28%5C%22%22%5D%7D&s=1&r=75
10/28/2021,BILL,"A bill to require the Financial Crimes Enforcement Network to issue an advisory about how homegrown violent extremists and other perpetrators of domestic terrorism procure firearms and firearm accessories, and for other purposes.","Sen. Markey, Edward [D-MA]"," Senate - Banking, Housing, and Urban Affairs        ","Senate - 10/28/2021 Read twice and referred to the Committee on Banking, Housing, and Urban Affairs. (",Introduced,https://www.congress.gov/bill/117th-congress/senate-bill/3117?q=%7B%22search%22%3A%5B%22actionDate%3A%5C%22117%7C2021-10-28%5C%22+AND+%28billIsReserved%3A%5C%22N%5C%22+OR+type%3A%5C%22AMENDMENT%5C%22%29%22%2C%22%5C%22117%7C2021-10-28%5C%22%22%5D%7D&s=1&r=76
10/28/2021,BILL,"A bill to require the Secretary of Energy to establish a hydrogen infrastructure finance and innovation pilot program, and for other purposes.","Sen. Cornyn, John [R-TX]", Senate - Energy and Natural Resources        ,Senate - 10/28/2021 Read twice and referred to the Committee on Energy and Natural Resources. (,Introduced,https://www.congress.gov/bill/117th-congress/senate-bill/3118?q=%7B%22search%22%3A%5B%22actionDate%3A%5C%22117%7C2021-10-28%5C%22+AND+%28billIsReserved%3A%5C%22N%5C%22+OR+type%3A%5C%22AMENDMENT%5C%22%29%22%2C%22%5C%22117%7C2021-10-28%5C%22%22%5D%7D&s=1&r=77
10/28/2021,BILL,"A bill to require the President to certify to Congress that a member of the Quadrilateral Security Dialogue is not participating in quadrilateral cooperation between Australia, India, Japan, and the United States on security matters that are critical to United States strategic interests before imposing sanctions under section 231 of the Countering America's Adversaries Through Sanctions Act with respect to a transaction of that member.","Sen. Cruz, Ted [R-TX]"," Senate - Banking, Housing, and Urban Affairs        ","Senate - 10/28/2021 Read twice and referred to the Committee on Banking, Housing, and Urban Affairs. (",Introduced,https://www.congress.gov/bill/117th-congress/senate-bill/3119?q=%7B%22search%22%3A%5B%22actionDate%3A%5C%22117%7C2021-10-28%5C%22+AND+%28billIsReserved%3A%5C%22N%5C%22+OR+type%3A%5C%22AMENDMENT%5C%22%29%22%2C%22%5C%22117%7C2021-10-28%5C%22%22%5D%7D&s=1&r=78
10/26/2021,BILL,DHS Basic Training Accreditation Improvement Act of 2021,"Rep. Demings, Val Butler [D-FL-10]", House - Homeland Security; Judiciary        ,House - 10/26/2021 Ordered to be Reported by Voice Vote. (,Introduced,https://www.congress.gov/bill/117th-congress/house-bill/5616?q=%7B%22search%22%3A%5B%22actionDate%3A%5C%22117%7C2021-10-26%5C%22+AND+%28billIsReserved%3A%5C%22N%5C%22+OR+type%3A%5C%22AMENDMENT%5C%22%29%22%2C%22%5C%22117%7C2021-10-26%5C%22%22%5D%7D&s=1&r=13
10/26/2021,BILL,Department of Homeland Security Inspector General Transparency Act,"Rep. Thompson, Bennie G. [D-MS-2]", House - Homeland Security        ,House - 10/26/2021 Ordered to be Reported (Amended) by Voice Vote. (,Introduced,https://www.congress.gov/bill/117th-congress/house-bill/5633?q=%7B%22search%22%3A%5B%22actionDate%3A%5C%22117%7C2021-10-26%5C%22+AND+%28billIsReserved%3A%5C%22N%5C%22+OR+type%3A%5C%22AMENDMENT%5C%22%29%22%2C%22%5C%22117%7C2021-10-26%5C%22%22%5D%7D&s=1&r=14
10/26/2021,BILL,DHS Acquisition Review Board Act of 2021,"Rep. Van Drew, Jefferson [R-NJ-2]", House - Homeland Security        ,House - 10/26/2021 Ordered to be Reported by Voice Vote. (,Introduced,https://www.congress.gov/bill/117th-congress/house-bill/5652?q=%7B%22search%22%3A%5B%22actionDate%3A%5C%22117%7C2021-10-26%5C%22+AND+%28billIsReserved%3A%5C%22N%5C%22+OR+type%3A%5C%22AMENDMENT%5C%22%29%22%2C%22%5C%22117%7C2021-10-26%5C%22%22%5D%7D&s=1&r=15
10/26/2021,BILL,DHS Roles and Responsibilities in Cyber Space Act,"Rep. Bacon, Don [R-NE-2]", House - Homeland Security        ,House - 10/26/2021 Ordered to be Reported (Amended) by Voice Vote. (,Introduced,https://www.congress.gov/bill/117th-congress/house-bill/5658?q=%7B%22search%22%3A%5B%22actionDate%3A%5C%22117%7C2021-10-26%5C%22+AND+%28billIsReserved%3A%5C%22N%5C%22+OR+type%3A%5C%22AMENDMENT%5C%22%29%22%2C%22%5C%22117%7C2021-10-26%5C%22%22%5D%7D&s=1&r=16
10/26/2021,BILL,Shadow Wolves Enhancement Act,"Rep. Katko, John [R-NY-24]", House - Homeland Security        ,House - 10/26/2021 Ordered to be Reported by Voice Vote. (,Introduced,https://www.congress.gov/bill/117th-congress/house-bill/5681?q=%7B%22search%22%3A%5B%22actionDate%3A%5C%22117%7C2021-10-26%5C%22+AND+%28billIsReserved%3A%5C%22N%5C%22+OR+type%3A%5C%22AMENDMENT%5C%22%29%22%2C%22%5C%22117%7C2021-10-26%5C%22%22%5D%7D&s=1&r=17
10/26/2021,BILL,CBP Donations Acceptance Program Reauthorization Act,"Rep. Barragan, Nanette Diaz [D-CA-44]", House - Homeland Security; Ways and Means; Transportation and Infrastructure        ,House - 10/26/2021 Ordered to be Reported by Voice Vote. (,Introduced,https://www.congress.gov/bill/117th-congress/house-bill/5682?q=%7B%22search%22%3A%5B%22actionDate%3A%5C%22117%7C2021-10-26%5C%22+AND+%28billIsReserved%3A%5C%22N%5C%22+OR+type%3A%5C%22AMENDMENT%5C%22%29%22%2C%22%5C%22117%7C2021-10-26%5C%22%22%5D%7D&s=1&r=18
10/26/2021,BILL,Department of Homeland Security Border Support Services Contracts Review Act,"Rep. Cammack, Kat [R-FL-3]", House - Homeland Security        ,House - 10/26/2021 Ordered to be Reported (Amended) by Voice Vote. (,Introduced,https://www.congress.gov/bill/117th-congress/house-bill/5683?q=%7B%22search%22%3A%5B%22actionDate%3A%5C%22117%7C2021-10-26%5C%22+AND+%28billIsReserved%3A%5C%22N%5C%22+OR+type%3A%5C%22AMENDMENT%5C%22%29%22%2C%22%5C%22117%7C2021-10-26%5C%22%22%5D%7D&s=1&r=19
10/26/2021,BILL,Stop Sexual Assault and Harassment in Transportation Act,"Rep. DeFazio, Peter A. [D-OR-4]", House - Transportation and Infrastructure; Judiciary; Budget        ,House - 10/26/2021 Referred to the Subcommittee on Coast Guard and Maritime Transportation. (,Introduced,https://www.congress.gov/bill/117th-congress/house-bill/5706?q=%7B%22search%22%3A%5B%22actionDate%3A%5C%22117%7C2021-10-26%5C%22+AND+%28billIsReserved%3A%5C%22N%5C%22+OR+type%3A%5C%22AMENDMENT%5C%22%29%22%2C%22%5C%22117%7C2021-10-26%5C%22%22%5D%7D&s=1&r=20
10/26/2021,BILL,To protect our Social Security system and improve benefits for current and future generations.,"Rep. Larson, John B. [D-CT-1]", House - Ways and Means; Education and Labor; Energy and Commerce        ,"House - 10/26/2021 Referred to the Committee on Ways and Means, and in addition to the Committees on Education and Labor, and Energy and Commerce, for a period to be subsequently determined by the Speaker, in each case for consideration of such provisions as fall within the... (",Introduced,https://www.congress.gov/bill/117th-congress/house-bill/5723?q=%7B%22search%22%3A%5B%22actionDate%3A%5C%22117%7C2021-10-26%5C%22+AND+%28billIsReserved%3A%5C%22N%5C%22+OR+type%3A%5C%22AMENDMENT%5C%22%29%22%2C%22%5C%22117%7C2021-10-26%5C%22%22%5D%7D&s=1&r=21
10/26/2021,BILL,"To authorize a White House Conference on Food, Nutrition, Hunger, and Health, and for other purposes.","Rep. McGovern, James P. [D-MA-2]", House - Agriculture; Rules        ,"House - 10/26/2021 Referred to the Committee on Agriculture, and in addition to the Committee on Rules, for a period to be subsequently determined by the Speaker, in each case for consideration of such provisions as fall within the jurisdiction of the committee concerned. (",Introduced,https://www.congress.gov/bill/117th-congress/house-bill/5724?q=%7B%22search%22%3A%5B%22actionDate%3A%5C%22117%7C2021-10-26%5C%22+AND+%28billIsReserved%3A%5C%22N%5C%22+OR+type%3A%5C%22AMENDMENT%5C%22%29%22%2C%22%5C%22117%7C2021-10-26%5C%22%22%5D%7D&s=1&r=22
10/26/2021,BILL,"To codify a final rule of the United States Fish and Wildlife Service relating to endangered and threatened species, and for other purposes.","Rep. Buck, Ken [R-CO-4]", House - Natural Resources        ,House - 10/26/2021 Referred to the House Committee on Natural Resources. (,Introduced,https://www.congress.gov/bill/117th-congress/house-bill/5725?q=%7B%22search%22%3A%5B%22actionDate%3A%5C%22117%7C2021-10-26%5C%22+AND+%28billIsReserved%3A%5C%22N%5C%22+OR+type%3A%5C%22AMENDMENT%5C%22%29%22%2C%22%5C%22117%7C2021-10-26%5C%22%22%5D%7D&s=1&r=23
10/28/2021,BILL,"A bill to improve the productivity and energy efficiency of the manufacturing sector by directing the Secretary of Energy, in coordination with the National Academies and other appropriate Federal agencies, to provide assistance to small and medium manufacturers in implementing smart manufacturing programs, and for other purposes.","Sen. Shaheen, Jeanne [D-NH]", Senate - Energy and Natural Resources        ,Senate - 10/28/2021 Read twice and referred to the Committee on Energy and Natural Resources. (,Introduced,https://www.congress.gov/bill/117th-congress/senate-bill/3120?q=%7B%22search%22%3A%5B%22actionDate%3A%5C%22117%7C2021-10-28%5C%22+AND+%28billIsReserved%3A%5C%22N%5C%22+OR+type%3A%5C%22AMENDMENT%5C%22%29%22%2C%22%5C%22117%7C2021-10-28%5C%22%22%5D%7D&s=1&r=79
10/28/2021,BILL,"A bill to require the Secretary of Energy to establish a council to conduct a survey and analysis of the employment figures and demographics in the energy, energy efficiency, and motor vehicle sectors of the United States, and for other purposes.","Sen. Shaheen, Jeanne [D-NH]", Senate - Energy and Natural Resources        ,Senate - 10/28/2021 Read twice and referred to the Committee on Energy and Natural Resources. (,Introduced,https://www.congress.gov/bill/117th-congress/senate-bill/3121?q=%7B%22search%22%3A%5B%22actionDate%3A%5C%22117%7C2021-10-28%5C%22+AND+%28billIsReserved%3A%5C%22N%5C%22+OR+type%3A%5C%22AMENDMENT%5C%22%29%22%2C%22%5C%22117%7C2021-10-28%5C%22%22%5D%7D&s=1&r=80
10/28/2021,BILL,"A bill to provide an extension of Federal-aid highway, highway safety, and transit programs, and for other purposes.","Sen. Carper, Thomas [D-DE]", Senate - Environment and Public Works        ,,Introduced,https://www.congress.gov/bill/117th-congress/senate-bill/3122?q=%7B%22search%22%3A%5B%22actionDate%3A%5C%22117%7C2021-10-28%5C%22+AND+%28billIsReserved%3A%5C%22N%5C%22+OR+type%3A%5C%22AMENDMENT%5C%22%29%22%2C%22%5C%22117%7C2021-10-28%5C%22%22%5D%7D&s=1&r=81
10/28/2021,CONCURRENT RESOLUTION,A concurrent resolution celebrating the first anniversary of the coalition of signatory countries to the Geneva Consensus Declaration on Promoting Women's Health and Strengthening the Family.,"Sen. Daines, Steve [R-MT]", Senate - Foreign Relations        ,Senate - 10/28/2021 Referred to the Committee on Foreign Relations. (text: CR ,Introduced,https://www.congress.gov/bill/117th-congress/senate-concurrent-resolution/17?q=%7B%22search%22%3A%5B%22actionDate%3A%5C%22117%7C2021-10-28%5C%22+AND+%28billIsReserved%3A%5C%22N%5C%22+OR+type%3A%5C%22AMENDMENT%5C%22%29%22%2C%22%5C%22117%7C2021-10-28%5C%22%22%5D%7D&s=1&r=82
10/28/2021,RESOLUTION,"A resolution reiterating United States support for the people of the Republic of South Sudan in their quest for lasting peace, stability, and democracy after 10 years of independence and calling for a review of United States policy toward South Sudan.","Sen. Risch, James [R-ID]", Senate - Foreign Relations        ,Senate - 10/28/2021 Placed on Senate Legislative Calendar under General Orders. Calendar No. 160. (,Introduced,https://www.congress.gov/bill/117th-congress/senate-resolution/380?q=%7B%22search%22%3A%5B%22actionDate%3A%5C%22117%7C2021-10-28%5C%22+AND+%28billIsReserved%3A%5C%22N%5C%22+OR+type%3A%5C%22AMENDMENT%5C%22%29%22%2C%22%5C%22117%7C2021-10-28%5C%22%22%5D%7D&s=1&r=83
10/28/2021,RESOLUTION,A resolution supporting the right of parents to be the leading voice in the education of their children.,"Sen. Scott, Rick [R-FL]"," Senate - Health, Education, Labor, and Pensions        ","Senate - 10/28/2021 Referred to the Committee on Health, Education, Labor, and Pensions. (text: CR ",Introduced,https://www.congress.gov/bill/117th-congress/senate-resolution/431?q=%7B%22search%22%3A%5B%22actionDate%3A%5C%22117%7C2021-10-28%5C%22+AND+%28billIsReserved%3A%5C%22N%5C%22+OR+type%3A%5C%22AMENDMENT%5C%22%29%22%2C%22%5C%22117%7C2021-10-28%5C%22%22%5D%7D&s=1&r=84
10/28/2021,RESOLUTION,A resolution recognizing the month of October 2021 as Filipino American History Month and celebrating the history and culture of Filipino Americans and their immense contributions to the United States.,"Sen. Hirono, Mazie [D-HI]", Senate - Judiciary        ,Senate - 10/28/2021 Referred to the Committee on the Judiciary. (Sponsor introductory remarks on measure: CR ,Introduced,https://www.congress.gov/bill/117th-congress/senate-resolution/432?q=%7B%22search%22%3A%5B%22actionDate%3A%5C%22117%7C2021-10-28%5C%22+AND+%28billIsReserved%3A%5C%22N%5C%22+OR+type%3A%5C%22AMENDMENT%5C%22%29%22%2C%22%5C%22117%7C2021-10-28%5C%22%22%5D%7D&s=1&r=85
