date,type,title,sponsor,committees,latest_action,tracker,url
10/25/2021,CONCURRENT RESOLUTION,"Condemning the Government of the People's Republic of China and the People's Liberation Army for continued military aggression against Taiwan, most notably the October 4th incursion of Taiwan's Air Defense Identification Zone.","Rep. Fallon, Pat [R-TX-4]", House - Foreign Affairs        ,House - 10/25/2021 Referred to the House Committee on Foreign Affairs. (,Introduced,https://www.congress.gov/bill/117th-congress/house-concurrent-resolution/56?q=%7B%22search%22%3A%5B%22actionDate%3A%5C%22117%7C2021-10-25%5C%22+AND+%28billIsReserved%3A%5C%22N%5C%22+OR+type%3A%5C%22AMENDMENT%5C%22%29%22%2C%22%5C%22117%7C2021-10-25%5C%22%22%5D%7D&s=1&r=31
10/25/2021,RESOLUTION,Condemning the Government of Iran's state-sponsored persecution of its Baha'i minority and its continued violation of the Universal Declaration of Human Rights and the International Covenant on Civil and Political Rights.,"Rep. Deutch, Theodore E. [D-FL-22]", House - Foreign Affairs        ,House - 10/25/2021 Referred to the House Committee on Foreign Affairs. (,Introduced,https://www.congress.gov/bill/117th-congress/house-resolution/744?q=%7B%22search%22%3A%5B%22actionDate%3A%5C%22117%7C2021-10-25%5C%22+AND+%28billIsReserved%3A%5C%22N%5C%22+OR+type%3A%5C%22AMENDMENT%5C%22%29%22%2C%22%5C%22117%7C2021-10-25%5C%22%22%5D%7D&s=1&r=32
10/25/2021,RESOLUTION,"Expressing support for the designation of the week of October 24, 2021, to October 31, 2021, as ""BatWeek"".","Rep. Welch, Peter [D-VT-At Large]", House - Agriculture        ,House - 10/25/2021 Referred to the House Committee on Agriculture. (,Introduced,https://www.congress.gov/bill/117th-congress/house-resolution/745?q=%7B%22search%22%3A%5B%22actionDate%3A%5C%22117%7C2021-10-25%5C%22+AND+%28billIsReserved%3A%5C%22N%5C%22+OR+type%3A%5C%22AMENDMENT%5C%22%29%22%2C%22%5C%22117%7C2021-10-25%5C%22%22%5D%7D&s=1&r=33
10/25/2021,BILL,"A bill to amend title 18, United States Code, to enhance criminal penalties for health related stalking, and for other purposes.","Sen. Klobuchar, Amy [D-MN]", Senate - Judiciary        ,Senate - 10/25/2021 Read twice and referred to the Committee on the Judiciary. (,Introduced,https://www.congress.gov/bill/117th-congress/senate-bill/3057?q=%7B%22search%22%3A%5B%22actionDate%3A%5C%22117%7C2021-10-25%5C%22+AND+%28billIsReserved%3A%5C%22N%5C%22+OR+type%3A%5C%22AMENDMENT%5C%22%29%22%2C%22%5C%22117%7C2021-10-25%5C%22%22%5D%7D&s=1&r=34
10/28/2021,BILL,To amend the definition of eligible program under the Higher Education Act of 1965 for the purposes of eligibility for Federal financial aid.,"Rep. Keller, Fred [R-PA-12]", House - Education and Labor        ,House - 10/28/2021 Referred to the House Committee on Education and Labor. (,Introduced,https://www.congress.gov/bill/117th-congress/house-bill/5777?q=%7B%22search%22%3A%5B%22actionDate%3A%5C%22117%7C2021-10-28%5C%22+AND+%28billIsReserved%3A%5C%22N%5C%22+OR+type%3A%5C%22AMENDMENT%5C%22%29%22%2C%22%5C%22117%7C2021-10-28%5C%22%22%5D%7D&s=1&r=24
10/28/2021,BILL,"To cancel and waive certain debts owed to the United States with respect to Hurricane Sandy, and for other purposes.","Rep. Kim, Andy [D-NJ-3]", House - Transportation and Infrastructure; Financial Services; Small Business        ,"House - 10/28/2021 Referred to the Committee on Transportation and Infrastructure, and in addition to the Committees on Financial Services, and Small Business, for a period to be subsequently determined by the Speaker, in each case for consideration of such provisions as fall within... (",Introduced,https://www.congress.gov/bill/117th-congress/house-bill/5778?q=%7B%22search%22%3A%5B%22actionDate%3A%5C%22117%7C2021-10-28%5C%22+AND+%28billIsReserved%3A%5C%22N%5C%22+OR+type%3A%5C%22AMENDMENT%5C%22%29%22%2C%22%5C%22117%7C2021-10-28%5C%22%22%5D%7D&s=1&r=25
10/28/2021,BILL,To amend the Higher Education Act of 1965 to require the Secretary of Education to create a personal finance education portal on a centralized website of the Department of Education pertaining to Federal financial aid.,"Rep. Leger Fernandez, Teresa [D-NM-3]", House - Education and Labor        ,House - 10/28/2021 Referred to the House Committee on Education and Labor. (,Introduced,https://www.congress.gov/bill/117th-congress/house-bill/5779?q=%7B%22search%22%3A%5B%22actionDate%3A%5C%22117%7C2021-10-28%5C%22+AND+%28billIsReserved%3A%5C%22N%5C%22+OR+type%3A%5C%22AMENDMENT%5C%22%29%22%2C%22%5C%22117%7C2021-10-28%5C%22%22%5D%7D&s=1&r=26
10/28/2021,BILL,"To amend the Robert T. Stafford Disaster Relief and Emergency Assistance Act to improve the provision of certain disaster assistance, and for other purposes.","Rep. Lofgren, Zoe [D-CA-19]", House - Transportation and Infrastructure        ,House - 10/28/2021 Referred to the House Committee on Transportation and Infrastructure. (,Introduced,https://www.congress.gov/bill/117th-congress/house-bill/5780?q=%7B%22search%22%3A%5B%22actionDate%3A%5C%22117%7C2021-10-28%5C%22+AND+%28billIsReserved%3A%5C%22N%5C%22+OR+type%3A%5C%22AMENDMENT%5C%22%29%22%2C%22%5C%22117%7C2021-10-28%5C%22%22%5D%7D&s=1&r=27
10/28/2021,BILL,"To improve the Federal effort to reduce wildland fire risks, and for other purposes.","Rep. Lofgren, Zoe [D-CA-19]"," House - Science, Space, and Technology; Transportation and Infrastructure        ","House - 10/28/2021 Referred to the Committee on Science, Space, and Technology, and in addition to the Committee on Transportation and Infrastructure, for a period to be subsequently determined by the Speaker, in each case for consideration of such provisions as fall within the... (",Introduced,https://www.congress.gov/bill/117th-congress/house-bill/5781?q=%7B%22search%22%3A%5B%22actionDate%3A%5C%22117%7C2021-10-28%5C%22+AND+%28billIsReserved%3A%5C%22N%5C%22+OR+type%3A%5C%22AMENDMENT%5C%22%29%22%2C%22%5C%22117%7C2021-10-28%5C%22%22%5D%7D&s=1&r=28
10/28/2021,BILL,"To amend the Robert T. Stafford Disaster Relief and Emergency Assistance Act to improve the provision of certain disaster assistance, and for other purposes.","Rep. Lofgren, Zoe [D-CA-19]", House - Transportation and Infrastructure; Financial Services        ,"House - 10/28/2021 Referred to the Committee on Transportation and Infrastructure, and in addition to the Committee on Financial Services, for a period to be subsequently determined by the Speaker, in each case for consideration of such provisions as fall within the jurisdiction of... (",Introduced,https://www.congress.gov/bill/117th-congress/house-bill/5782?q=%7B%22search%22%3A%5B%22actionDate%3A%5C%22117%7C2021-10-28%5C%22+AND+%28billIsReserved%3A%5C%22N%5C%22+OR+type%3A%5C%22AMENDMENT%5C%22%29%22%2C%22%5C%22117%7C2021-10-28%5C%22%22%5D%7D&s=1&r=29
10/28/2021,BILL,"To amend title 38, United States Code, to improve homeless veterans reintegration programs, and for other purposes.","Rep. Mann, Tracey [R-KS-1]", House - Veterans' Affairs        ,House - 10/28/2021 Referred to the House Committee on Veterans' Affairs. (,Introduced,https://www.congress.gov/bill/117th-congress/house-bill/5783?q=%7B%22search%22%3A%5B%22actionDate%3A%5C%22117%7C2021-10-28%5C%22+AND+%28billIsReserved%3A%5C%22N%5C%22+OR+type%3A%5C%22AMENDMENT%5C%22%29%22%2C%22%5C%22117%7C2021-10-28%5C%22%22%5D%7D&s=1&r=30
10/28/2021,BILL,"To amend the Coastal Zone Management Act of 1972 to allow the District of Columbia to receive Federal funding under such Act, and for other purposes.","Del. Norton, Eleanor Holmes [D-DC-At Large]", House - Natural Resources        ,House - 10/28/2021 Referred to the House Committee on Natural Resources. (,Introduced,https://www.congress.gov/bill/117th-congress/house-bill/5784?q=%7B%22search%22%3A%5B%22actionDate%3A%5C%22117%7C2021-10-28%5C%22+AND+%28billIsReserved%3A%5C%22N%5C%22+OR+type%3A%5C%22AMENDMENT%5C%22%29%22%2C%22%5C%22117%7C2021-10-28%5C%22%22%5D%7D&s=1&r=31
10/28/2021,BILL,"To require the Secretary of Housing and Urban Development to improve services for survivors of domestic violence, dating violence, sexual assault, or stalking and their families.","Rep. O'Halleran, Tom [D-AZ-1]", House - Financial Services        ,House - 10/28/2021 Referred to the House Committee on Financial Services. (,Introduced,https://www.congress.gov/bill/117th-congress/house-bill/5785?q=%7B%22search%22%3A%5B%22actionDate%3A%5C%22117%7C2021-10-28%5C%22+AND+%28billIsReserved%3A%5C%22N%5C%22+OR+type%3A%5C%22AMENDMENT%5C%22%29%22%2C%22%5C%22117%7C2021-10-28%5C%22%22%5D%7D&s=1&r=32
10/28/2021,BILL,"To limit the sale and purchase of certain securities, and for other purposes.","Rep. Perry, Scott [R-PA-10]", House - Foreign Affairs; Financial Services; Armed Services        ,"House - 10/28/2021 Referred to the Committee on Foreign Affairs, and in addition to the Committees on Financial Services, and Armed Services, for a period to be subsequently determined by the Speaker, in each case for consideration of such provisions as fall within the jurisdiction... (",Introduced,https://www.congress.gov/bill/117th-congress/house-bill/5786?q=%7B%22search%22%3A%5B%22actionDate%3A%5C%22117%7C2021-10-28%5C%22+AND+%28billIsReserved%3A%5C%22N%5C%22+OR+type%3A%5C%22AMENDMENT%5C%22%29%22%2C%22%5C%22117%7C2021-10-28%5C%22%22%5D%7D&s=1&r=33
10/28/2021,BILL,To direct the Secretary of Veterans Affairs to develop a strategy for telehealth furnished by the Veterans Health Administration and submit a report on end-user devices distributed by the Secretary to veterans to facilitate such telehealth.,"Rep. Rosendale Sr., Matthew M. [R-MT-At Large]", House - Veterans' Affairs        ,House - 10/28/2021 Referred to the House Committee on Veterans' Affairs. (,Introduced,https://www.congress.gov/bill/117th-congress/house-bill/5787?q=%7B%22search%22%3A%5B%22actionDate%3A%5C%22117%7C2021-10-28%5C%22+AND+%28billIsReserved%3A%5C%22N%5C%22+OR+type%3A%5C%22AMENDMENT%5C%22%29%22%2C%22%5C%22117%7C2021-10-28%5C%22%22%5D%7D&s=1&r=34
10/27/2021,BILL,"A bill to amend title 10, United States Code, to improve veterinary care for retired military working dogs, and for other purposes.","Sen. Blackburn, Marsha [R-TN]", Senate - Armed Services        ,Senate - 10/27/2021 Read twice and referred to the Committee on Armed Services. (,Introduced,https://www.congress.gov/bill/117th-congress/senate-bill/3083?q=%7B%22search%22%3A%5B%22actionDate%3A%5C%22117%7C2021-10-27%5C%22+AND+%28billIsReserved%3A%5C%22N%5C%22+OR+type%3A%5C%22AMENDMENT%5C%22%29%22%2C%22%5C%22117%7C2021-10-27%5C%22%22%5D%7D&s=1&r=35
10/27/2021,BILL,"A bill to amend the Servicemembers Civil Relief Act to provide for the termination of telephone, multichannel video programming, and internet access service contracts by servicemembers after the receipt of stop movement orders due to an emergency situation, and for other purposes.","Sen. Hassan, Maggie [D-NH]", Senate - Veterans' Affairs        ,Senate - 10/27/2021 Read twice and referred to the Committee on Veterans' Affairs. (,Introduced,https://www.congress.gov/bill/117th-congress/senate-bill/3084?q=%7B%22search%22%3A%5B%22actionDate%3A%5C%22117%7C2021-10-27%5C%22+AND+%28billIsReserved%3A%5C%22N%5C%22+OR+type%3A%5C%22AMENDMENT%5C%22%29%22%2C%22%5C%22117%7C2021-10-27%5C%22%22%5D%7D&s=1&r=36
10/27/2021,BILL,"A bill to assist in the transition of a certain hospital to a Medicare rural emergency hospital, and for other purposes.","Sen. Inhofe, Jim [R-OK]", Senate - Finance        ,Senate - 10/27/2021 Read twice and referred to the Committee on Finance. (,Introduced,https://www.congress.gov/bill/117th-congress/senate-bill/3085?q=%7B%22search%22%3A%5B%22actionDate%3A%5C%22117%7C2021-10-27%5C%22+AND+%28billIsReserved%3A%5C%22N%5C%22+OR+type%3A%5C%22AMENDMENT%5C%22%29%22%2C%22%5C%22117%7C2021-10-27%5C%22%22%5D%7D&s=1&r=37
10/27/2021,BILL,"A bill to require the Energy Information Administration to submit to Congress and make publicly available an annual report on Federal agency policies and regulations and Executive orders that have increased or may increase energy prices in the United States, and for other purposes.","Sen. Scott, Rick [R-FL]", Senate - Energy and Natural Resources        ,Senate - 10/27/2021 Read twice and referred to the Committee on Energy and Natural Resources. (,Introduced,https://www.congress.gov/bill/117th-congress/senate-bill/3086?q=%7B%22search%22%3A%5B%22actionDate%3A%5C%22117%7C2021-10-27%5C%22+AND+%28billIsReserved%3A%5C%22N%5C%22+OR+type%3A%5C%22AMENDMENT%5C%22%29%22%2C%22%5C%22117%7C2021-10-27%5C%22%22%5D%7D&s=1&r=38
10/27/2021,BILL,A bill to amend the Internal Revenue Code of 1986 to provide authority to add additional vaccines to the list of taxable vaccines.,"Sen. Casey, Bob [D-PA]", Senate - Finance        ,Senate - 10/27/2021 Read twice and referred to the Committee on Finance. (,Introduced,https://www.congress.gov/bill/117th-congress/senate-bill/3087?q=%7B%22search%22%3A%5B%22actionDate%3A%5C%22117%7C2021-10-27%5C%22+AND+%28billIsReserved%3A%5C%22N%5C%22+OR+type%3A%5C%22AMENDMENT%5C%22%29%22%2C%22%5C%22117%7C2021-10-27%5C%22%22%5D%7D&s=1&r=39
10/27/2021,BILL,"A bill to ensure America's children have the freedom to be healthy, to be economically secure, to learn, to not be hungry, and to be safe from harm.","Sen. Casey, Bob [D-PA]", Senate - Finance        ,Senate - 10/27/2021 Read twice and referred to the Committee on Finance. (,Introduced,https://www.congress.gov/bill/117th-congress/senate-bill/3088?q=%7B%22search%22%3A%5B%22actionDate%3A%5C%22117%7C2021-10-27%5C%22+AND+%28billIsReserved%3A%5C%22N%5C%22+OR+type%3A%5C%22AMENDMENT%5C%22%29%22%2C%22%5C%22117%7C2021-10-27%5C%22%22%5D%7D&s=1&r=40
10/27/2021,BILL,"A bill to amend section 721 of the Defense Production Act of 1950 to include the Secretary of Agriculture and the Secretary of Health and Human Services as members of the Committee on Foreign Investment in the United States and to require the Committee to consider the security of the food and agriculture systems of the United States as a factor to be considered when determining to take action with respect to foreign investment, and for other purposes.","Sen. Grassley, Charles [R-IA]"," Senate - Banking, Housing, and Urban Affairs        ","Senate - 10/27/2021 Read twice and referred to the Committee on Banking, Housing, and Urban Affairs. (",Introduced,https://www.congress.gov/bill/117th-congress/senate-bill/3089?q=%7B%22search%22%3A%5B%22actionDate%3A%5C%22117%7C2021-10-27%5C%22+AND+%28billIsReserved%3A%5C%22N%5C%22+OR+type%3A%5C%22AMENDMENT%5C%22%29%22%2C%22%5C%22117%7C2021-10-27%5C%22%22%5D%7D&s=1&r=41
10/27/2021,BILL,A bill to address the participation of Taiwan in the Inter-American Development Bank.,"Sen. Menendez, Robert [D-NJ]", Senate - Foreign Relations        ,Senate - 10/27/2021 Read twice and referred to the Committee on Foreign Relations. (,Introduced,https://www.congress.gov/bill/117th-congress/senate-bill/3090?q=%7B%22search%22%3A%5B%22actionDate%3A%5C%22117%7C2021-10-27%5C%22+AND+%28billIsReserved%3A%5C%22N%5C%22+OR+type%3A%5C%22AMENDMENT%5C%22%29%22%2C%22%5C%22117%7C2021-10-27%5C%22%22%5D%7D&s=1&r=42
10/27/2021,BILL,A bill to amend the Internal Revenue Code of 1986 to establish the advanced solar manufacturing production credit.,"Sen. Ossoff, Jon [D-GA]", Senate - Finance        ,Senate - 10/27/2021 Read twice and referred to the Committee on Finance. (,Introduced,https://www.congress.gov/bill/117th-congress/senate-bill/3091?q=%7B%22search%22%3A%5B%22actionDate%3A%5C%22117%7C2021-10-27%5C%22+AND+%28billIsReserved%3A%5C%22N%5C%22+OR+type%3A%5C%22AMENDMENT%5C%22%29%22%2C%22%5C%22117%7C2021-10-27%5C%22%22%5D%7D&s=1&r=43
10/27/2021,BILL,"A bill to amend the Robert T. Stafford Disaster Relief and Emergency Assistance Act to improve the provision of certain disaster assistance, and for other purposes.","Sen. Padilla, Alex [D-CA]", Senate - Homeland Security and Governmental Affairs        ,Senate - 10/27/2021 Read twice and referred to the Committee on Homeland Security and Governmental Affairs. (,Introduced,https://www.congress.gov/bill/117th-congress/senate-bill/3092?q=%7B%22search%22%3A%5B%22actionDate%3A%5C%22117%7C2021-10-27%5C%22+AND+%28billIsReserved%3A%5C%22N%5C%22+OR+type%3A%5C%22AMENDMENT%5C%22%29%22%2C%22%5C%22117%7C2021-10-27%5C%22%22%5D%7D&s=1&r=44
10/27/2021,BILL,"A bill to amend the Robert T. Stafford Disaster Relief and Emergency Assistance Act to improve the provision of certain disaster assistance, and for other purposes.","Sen. Padilla, Alex [D-CA]", Senate - Homeland Security and Governmental Affairs        ,Senate - 10/27/2021 Read twice and referred to the Committee on Homeland Security and Governmental Affairs. (,Introduced,https://www.congress.gov/bill/117th-congress/senate-bill/3093?q=%7B%22search%22%3A%5B%22actionDate%3A%5C%22117%7C2021-10-27%5C%22+AND+%28billIsReserved%3A%5C%22N%5C%22+OR+type%3A%5C%22AMENDMENT%5C%22%29%22%2C%22%5C%22117%7C2021-10-27%5C%22%22%5D%7D&s=1&r=45
10/25/2021,BILL,"Department of Homeland Security Appropriations Act, 2022","Sen. Murphy, Christopher [D-CT]", Senate - Appropriations        ,Senate - 10/25/2021 Read twice and referred to the Committee on Appropriations. (,Introduced,https://www.congress.gov/bill/117th-congress/senate-bill/3058?q=%7B%22search%22%3A%5B%22actionDate%3A%5C%22117%7C2021-10-25%5C%22+AND+%28billIsReserved%3A%5C%22N%5C%22+OR+type%3A%5C%22AMENDMENT%5C%22%29%22%2C%22%5C%22117%7C2021-10-25%5C%22%22%5D%7D&s=1&r=35
10/25/2021,BILL,"A bill to amend the Ethics in Government Act of 1978 to provide for a periodic transaction reporting requirement for Federal judicial officers and the online publication of financial disclosure reports of Federal judicial officers, and for other purposes.","Sen. Cornyn, John [R-TX]", Senate - Homeland Security and Governmental Affairs        ,Senate - 10/25/2021 Read twice and referred to the Committee on Homeland Security and Governmental Affairs. (,Introduced,https://www.congress.gov/bill/117th-congress/senate-bill/3059?q=%7B%22search%22%3A%5B%22actionDate%3A%5C%22117%7C2021-10-25%5C%22+AND+%28billIsReserved%3A%5C%22N%5C%22+OR+type%3A%5C%22AMENDMENT%5C%22%29%22%2C%22%5C%22117%7C2021-10-25%5C%22%22%5D%7D&s=1&r=36
10/25/2021,BILL,"A bill to amend title 18, United States Code, to establish an Office of Prison Education, and for other purposes.","Sen. Schatz, Brian [D-HI]", Senate - Judiciary        ,Senate - 10/25/2021 Read twice and referred to the Committee on the Judiciary. (,Introduced,https://www.congress.gov/bill/117th-congress/senate-bill/3060?q=%7B%22search%22%3A%5B%22actionDate%3A%5C%22117%7C2021-10-25%5C%22+AND+%28billIsReserved%3A%5C%22N%5C%22+OR+type%3A%5C%22AMENDMENT%5C%22%29%22%2C%22%5C%22117%7C2021-10-25%5C%22%22%5D%7D&s=1&r=37
10/25/2021,BILL,A bill to amend title XVIII of the Social Security Act to eliminate the 190-day lifetime limit on inpatient psychiatric hospital services under the Medicare Program.,"Sen. Collins, Susan [R-ME]", Senate - Finance        ,,Introduced,https://www.congress.gov/bill/117th-congress/senate-bill/3061?q=%7B%22search%22%3A%5B%22actionDate%3A%5C%22117%7C2021-10-25%5C%22+AND+%28billIsReserved%3A%5C%22N%5C%22+OR+type%3A%5C%22AMENDMENT%5C%22%29%22%2C%22%5C%22117%7C2021-10-25%5C%22%22%5D%7D&s=1&r=38
10/25/2021,BILL,"Departments of Labor, Health and Human Services, and Education, and Related Agencies Appropriations Act, 2022","Sen. Murray, Patty [D-WA]", Senate - Appropriations        ,Senate - 10/25/2021 Read twice and referred to the Committee on Appropriations. (,Introduced,https://www.congress.gov/bill/117th-congress/senate-bill/3062?q=%7B%22search%22%3A%5B%22actionDate%3A%5C%22117%7C2021-10-25%5C%22+AND+%28billIsReserved%3A%5C%22N%5C%22+OR+type%3A%5C%22AMENDMENT%5C%22%29%22%2C%22%5C%22117%7C2021-10-25%5C%22%22%5D%7D&s=1&r=39
10/25/2021,CONCURRENT RESOLUTION,A concurrent resolution commemorating the 30th anniversary of Operation Provide Comfort.,"Sen. Van Hollen, Chris [D-MD]", Senate - Foreign Relations        ,Senate - 10/25/2021 Referred to the Committee on Foreign Relations. (text: CR ,Introduced,https://www.congress.gov/bill/117th-congress/senate-concurrent-resolution/16?q=%7B%22search%22%3A%5B%22actionDate%3A%5C%22117%7C2021-10-25%5C%22+AND+%28billIsReserved%3A%5C%22N%5C%22+OR+type%3A%5C%22AMENDMENT%5C%22%29%22%2C%22%5C%22117%7C2021-10-25%5C%22%22%5D%7D&s=1&r=40
10/25/2021,AMENDMENT,,,,,,https://www.congress.gov/search?q=%7B%22congress%22%3A%22all%22%2C%22source%22%3A%22legislation%22%2C%22search%22%3A%22actionDate%3A%5C%22117%7C2021-10-25%5C%22+AND+%28billIsReserved%3A%5C%22N%5C%22+OR+type%3A%5C%22AMENDMENT%5C%22%29%22%7D&pageSort=documentNumber%3Aasc
10/25/2021,AMENDMENT,,,,,,https://www.congress.gov/search?q=%7B%22congress%22%3A%22all%22%2C%22source%22%3A%22legislation%22%2C%22search%22%3A%22actionDate%3A%5C%22117%7C2021-10-25%5C%22+AND+%28billIsReserved%3A%5C%22N%5C%22+OR+type%3A%5C%22AMENDMENT%5C%22%29%22%7D&pageSort=documentNumber%3Aasc
10/25/2021,AMENDMENT,,,,,,https://www.congress.gov/search?q=%7B%22congress%22%3A%22all%22%2C%22source%22%3A%22legislation%22%2C%22search%22%3A%22actionDate%3A%5C%22117%7C2021-10-25%5C%22+AND+%28billIsReserved%3A%5C%22N%5C%22+OR+type%3A%5C%22AMENDMENT%5C%22%29%22%7D&pageSort=documentNumber%3Aasc
10/25/2021,AMENDMENT,,,,,,https://www.congress.gov/search?q=%7B%22congress%22%3A%22all%22%2C%22source%22%3A%22legislation%22%2C%22search%22%3A%22actionDate%3A%5C%22117%7C2021-10-25%5C%22+AND+%28billIsReserved%3A%5C%22N%5C%22+OR+type%3A%5C%22AMENDMENT%5C%22%29%22%7D&pageSort=documentNumber%3Aasc
10/25/2021,AMENDMENT,,,,,,https://www.congress.gov/search?q=%7B%22congress%22%3A%22all%22%2C%22source%22%3A%22legislation%22%2C%22search%22%3A%22actionDate%3A%5C%22117%7C2021-10-25%5C%22+AND+%28billIsReserved%3A%5C%22N%5C%22+OR+type%3A%5C%22AMENDMENT%5C%22%29%22%7D&pageSort=documentNumber%3Aasc
10/25/2021,AMENDMENT,,,,,,https://www.congress.gov/search?q=%7B%22congress%22%3A%22all%22%2C%22source%22%3A%22legislation%22%2C%22search%22%3A%22actionDate%3A%5C%22117%7C2021-10-25%5C%22+AND+%28billIsReserved%3A%5C%22N%5C%22+OR+type%3A%5C%22AMENDMENT%5C%22%29%22%7D&pageSort=documentNumber%3Aasc
10/28/2021,BILL,"To authorize the Attorney General to make grants for the creation and operation of veterans response teams within law enforcement agencies, and for other purposes.","Rep. Salazar, Maria Elvira [R-FL-27]", House - Judiciary        ,House - 10/28/2021 Referred to the House Committee on the Judiciary. (,Introduced,https://www.congress.gov/bill/117th-congress/house-bill/5788?q=%7B%22search%22%3A%5B%22actionDate%3A%5C%22117%7C2021-10-28%5C%22+AND+%28billIsReserved%3A%5C%22N%5C%22+OR+type%3A%5C%22AMENDMENT%5C%22%29%22%2C%22%5C%22117%7C2021-10-28%5C%22%22%5D%7D&s=1&r=35
10/28/2021,BILL,To direct the Secretary of Veterans Affairs to improve the ability of veterans to make appointments for mental health care furnished by the Secretary.,"Rep. Steil, Bryan [R-WI-1]", House - Veterans' Affairs        ,House - 10/28/2021 Referred to the House Committee on Veterans' Affairs. (,Introduced,https://www.congress.gov/bill/117th-congress/house-bill/5789?q=%7B%22search%22%3A%5B%22actionDate%3A%5C%22117%7C2021-10-28%5C%22+AND+%28billIsReserved%3A%5C%22N%5C%22+OR+type%3A%5C%22AMENDMENT%5C%22%29%22%2C%22%5C%22117%7C2021-10-28%5C%22%22%5D%7D&s=1&r=36
10/28/2021,BILL,To provide for working with allies to seek increased compliance by China with certain OECD export credit standards.,"Rep. Zeldin, Lee M. [R-NY-1]", House - Financial Services        ,House - 10/28/2021 Referred to the House Committee on Financial Services. (,Introduced,https://www.congress.gov/bill/117th-congress/house-bill/5790?q=%7B%22search%22%3A%5B%22actionDate%3A%5C%22117%7C2021-10-28%5C%22+AND+%28billIsReserved%3A%5C%22N%5C%22+OR+type%3A%5C%22AMENDMENT%5C%22%29%22%2C%22%5C%22117%7C2021-10-28%5C%22%22%5D%7D&s=1&r=37
10/28/2021,JOINT RESOLUTION,Proposing an amendment to the Constitution of the United States to repeal the sixteenth article of amendment.,"Rep. Davidson, Warren [R-OH-8]", House - Judiciary        ,House - 10/28/2021 Referred to the House Committee on the Judiciary. (,Introduced,https://www.congress.gov/bill/117th-congress/house-joint-resolution/61?q=%7B%22search%22%3A%5B%22actionDate%3A%5C%22117%7C2021-10-28%5C%22+AND+%28billIsReserved%3A%5C%22N%5C%22+OR+type%3A%5C%22AMENDMENT%5C%22%29%22%2C%22%5C%22117%7C2021-10-28%5C%22%22%5D%7D&s=1&r=38
10/28/2021,RESOLUTION,Recognizing the month of October 2021 as Filipino American History Month and celebrating the history and culture of Filipino Americans and their immense contributions to the United States.,"Rep. Case, Ed [D-HI-1]", House - Oversight and Reform        ,,Introduced,https://www.congress.gov/bill/117th-congress/house-resolution/724?q=%7B%22search%22%3A%5B%22actionDate%3A%5C%22117%7C2021-10-28%5C%22+AND+%28billIsReserved%3A%5C%22N%5C%22+OR+type%3A%5C%22AMENDMENT%5C%22%29%22%2C%22%5C%22117%7C2021-10-28%5C%22%22%5D%7D&s=1&r=39
10/28/2021,RESOLUTION,"Expressing support for the designation of October 28, 2021, as ""Honoring the Nation's First Responders Day"".","Rep. DeLauro, Rosa L. [D-CT-3]", House - Transportation and Infrastructure        ,House - 10/28/2021 Referred to the House Committee on Transportation and Infrastructure. (,Introduced,https://www.congress.gov/bill/117th-congress/house-resolution/750?q=%7B%22search%22%3A%5B%22actionDate%3A%5C%22117%7C2021-10-28%5C%22+AND+%28billIsReserved%3A%5C%22N%5C%22+OR+type%3A%5C%22AMENDMENT%5C%22%29%22%2C%22%5C%22117%7C2021-10-28%5C%22%22%5D%7D&s=1&r=40
