date,type,title,sponsor,committees,latest_action,tracker,url
12/01/2021,BILL,Courthouse Ethics and Transparency Act,"Rep. Ross, Deborah K. [D-NC-2]", House - Judiciary        ,Senate - 12/02/2021 Received in the Senate. (,Passed House,https://www.congress.gov/bill/117th-congress/house-bill/5720?q=%7B%22search%22%3A%5B%22actionDate%3A%5C%22117%7C2021-12-01%5C%22+AND+%28billIsReserved%3A%5C%22N%5C%22+OR+type%3A%5C%22AMENDMENT%5C%22%29%22%2C%22%5C%22117%7C2021-12-01%5C%22%22%5D%7D&s=1&r=21
11/29/2021,AMENDMENT,,,,,,https://www.congress.gov/search?q=%7B%22congress%22%3A%22all%22%2C%22source%22%3A%22legislation%22%2C%22search%22%3A%22actionDate%3A%5C%22117%7C2021-11-29%5C%22+AND+%28billIsReserved%3A%5C%22N%5C%22+OR+type%3A%5C%22AMENDMENT%5C%22%29%22%7D&pageSort=documentNumber%3Aasc
11/29/2021,AMENDMENT,,,,,,https://www.congress.gov/search?q=%7B%22congress%22%3A%22all%22%2C%22source%22%3A%22legislation%22%2C%22search%22%3A%22actionDate%3A%5C%22117%7C2021-11-29%5C%22+AND+%28billIsReserved%3A%5C%22N%5C%22+OR+type%3A%5C%22AMENDMENT%5C%22%29%22%7D&pageSort=documentNumber%3Aasc
11/29/2021,AMENDMENT,,,,,,https://www.congress.gov/search?q=%7B%22congress%22%3A%22all%22%2C%22source%22%3A%22legislation%22%2C%22search%22%3A%22actionDate%3A%5C%22117%7C2021-11-29%5C%22+AND+%28billIsReserved%3A%5C%22N%5C%22+OR+type%3A%5C%22AMENDMENT%5C%22%29%22%7D&pageSort=documentNumber%3Aasc
12/01/2021,BILL,"To make revisions in title 5, United States Code, as necessary to keep the title current, and to make technical amendments to improve the United States Code.","Rep. Neguse, Joe [D-CO-2]", House - Judiciary        ,"House - 12/01/2021 At the conclusion of debate, the Yeas and Nays were demanded and ordered. Pursuant to the provisions of clause 8, rule XX, the Chair announced that further proceedings on the motion would be postponed. (",Introduced,https://www.congress.gov/bill/117th-congress/house-bill/5961?q=%7B%22search%22%3A%5B%22actionDate%3A%5C%22117%7C2021-12-01%5C%22+AND+%28billIsReserved%3A%5C%22N%5C%22+OR+type%3A%5C%22AMENDMENT%5C%22%29%22%2C%22%5C%22117%7C2021-12-01%5C%22%22%5D%7D&s=1&r=22
12/01/2021,BILL,"To make revisions in title 51, United States Code, as necessary to keep the title current, and to make technical amendments to improve the United States Code.","Rep. Fischbach, Michelle [R-MN-7]", House - Judiciary        ,"House - 12/01/2021 At the conclusion of debate, the Yeas and Nays were demanded and ordered. Pursuant to the provisions of clause 8, rule XX, the Chair announced that further proceedings on the motion would be postponed. (",Introduced,https://www.congress.gov/bill/117th-congress/house-bill/5982?q=%7B%22search%22%3A%5B%22actionDate%3A%5C%22117%7C2021-12-01%5C%22+AND+%28billIsReserved%3A%5C%22N%5C%22+OR+type%3A%5C%22AMENDMENT%5C%22%29%22%2C%22%5C%22117%7C2021-12-01%5C%22%22%5D%7D&s=1&r=23
11/29/2021,AMENDMENT,,,,,,https://www.congress.gov/search?q=%7B%22congress%22%3A%22all%22%2C%22source%22%3A%22legislation%22%2C%22search%22%3A%22actionDate%3A%5C%22117%7C2021-11-29%5C%22+AND+%28billIsReserved%3A%5C%22N%5C%22+OR+type%3A%5C%22AMENDMENT%5C%22%29%22%7D&pageSort=documentNumber%3Aasc
11/29/2021,AMENDMENT,,,,,,https://www.congress.gov/search?q=%7B%22congress%22%3A%22all%22%2C%22source%22%3A%22legislation%22%2C%22search%22%3A%22actionDate%3A%5C%22117%7C2021-11-29%5C%22+AND+%28billIsReserved%3A%5C%22N%5C%22+OR+type%3A%5C%22AMENDMENT%5C%22%29%22%7D&pageSort=documentNumber%3Aasc
11/29/2021,AMENDMENT,,,,,,https://www.congress.gov/search?q=%7B%22congress%22%3A%22all%22%2C%22source%22%3A%22legislation%22%2C%22search%22%3A%22actionDate%3A%5C%22117%7C2021-11-29%5C%22+AND+%28billIsReserved%3A%5C%22N%5C%22+OR+type%3A%5C%22AMENDMENT%5C%22%29%22%7D&pageSort=documentNumber%3Aasc
12/01/2021,BILL,"To replace references to ""fetus"" in Federal law with references to ""unborn child"", and for other purposes.","Rep. Lamborn, Doug [R-CO-5]", House - Judiciary        ,House - 12/01/2021 Referred to the House Committee on the Judiciary. (,Introduced,https://www.congress.gov/bill/117th-congress/house-bill/6099?q=%7B%22search%22%3A%5B%22actionDate%3A%5C%22117%7C2021-12-01%5C%22+AND+%28billIsReserved%3A%5C%22N%5C%22+OR+type%3A%5C%22AMENDMENT%5C%22%29%22%2C%22%5C%22117%7C2021-12-01%5C%22%22%5D%7D&s=1&r=24
12/01/2021,BILL,"To amend the Animal Welfare Act to increase enforcement with respect to violations of that Act, and for other purposes.","Rep. Axne, Cynthia [D-IA-3]", House - Agriculture        ,House - 12/01/2021 Referred to the House Committee on Agriculture. (,Introduced,https://www.congress.gov/bill/117th-congress/house-bill/6100?q=%7B%22search%22%3A%5B%22actionDate%3A%5C%22117%7C2021-12-01%5C%22+AND+%28billIsReserved%3A%5C%22N%5C%22+OR+type%3A%5C%22AMENDMENT%5C%22%29%22%2C%22%5C%22117%7C2021-12-01%5C%22%22%5D%7D&s=1&r=25
11/29/2021,AMENDMENT,,,,,,https://www.congress.gov/search?q=%7B%22congress%22%3A%22all%22%2C%22source%22%3A%22legislation%22%2C%22search%22%3A%22actionDate%3A%5C%22117%7C2021-11-29%5C%22+AND+%28billIsReserved%3A%5C%22N%5C%22+OR+type%3A%5C%22AMENDMENT%5C%22%29%22%7D&pageSort=documentNumber%3Aasc
11/29/2021,AMENDMENT,,,,,,https://www.congress.gov/search?q=%7B%22congress%22%3A%22all%22%2C%22source%22%3A%22legislation%22%2C%22search%22%3A%22actionDate%3A%5C%22117%7C2021-11-29%5C%22+AND+%28billIsReserved%3A%5C%22N%5C%22+OR+type%3A%5C%22AMENDMENT%5C%22%29%22%7D&pageSort=documentNumber%3Aasc
11/29/2021,AMENDMENT,,,,,,https://www.congress.gov/search?q=%7B%22congress%22%3A%22all%22%2C%22source%22%3A%22legislation%22%2C%22search%22%3A%22actionDate%3A%5C%22117%7C2021-11-29%5C%22+AND+%28billIsReserved%3A%5C%22N%5C%22+OR+type%3A%5C%22AMENDMENT%5C%22%29%22%7D&pageSort=documentNumber%3Aasc
12/01/2021,BILL,To amend title XIX of the Social Security Act to improve transparency and prevent the use of abusive spread pricing and related practices in the Medicaid program.,"Rep. Carter, Earl L. ""Buddy"" [R-GA-1]", House - Energy and Commerce        ,House - 12/01/2021 Referred to the House Committee on Energy and Commerce. (,Introduced,https://www.congress.gov/bill/117th-congress/house-bill/6101?q=%7B%22search%22%3A%5B%22actionDate%3A%5C%22117%7C2021-12-01%5C%22+AND+%28billIsReserved%3A%5C%22N%5C%22+OR+type%3A%5C%22AMENDMENT%5C%22%29%22%2C%22%5C%22117%7C2021-12-01%5C%22%22%5D%7D&s=1&r=26
12/01/2021,BILL,"To ensure that claims for benefits under the Black Lung Benefits Act are processed in a fair and timely manner, to better protect miners from pneumoconiosis (commonly known as ""black lung disease""), and for other purposes.","Rep. Cartwright, Matt [D-PA-8]", House - Education and Labor; Ways and Means        ,"House - 12/01/2021 Referred to the Committee on Education and Labor, and in addition to the Committee on Ways and Means, for a period to be subsequently determined by the Speaker, in each case for consideration of such provisions as fall within the jurisdiction of the committee... (",Introduced,https://www.congress.gov/bill/117th-congress/house-bill/6102?q=%7B%22search%22%3A%5B%22actionDate%3A%5C%22117%7C2021-12-01%5C%22+AND+%28billIsReserved%3A%5C%22N%5C%22+OR+type%3A%5C%22AMENDMENT%5C%22%29%22%2C%22%5C%22117%7C2021-12-01%5C%22%22%5D%7D&s=1&r=27
11/29/2021,AMENDMENT,,,,,,https://www.congress.gov/search?q=%7B%22congress%22%3A%22all%22%2C%22source%22%3A%22legislation%22%2C%22search%22%3A%22actionDate%3A%5C%22117%7C2021-11-29%5C%22+AND+%28billIsReserved%3A%5C%22N%5C%22+OR+type%3A%5C%22AMENDMENT%5C%22%29%22%7D&pageSort=documentNumber%3Aasc
11/29/2021,AMENDMENT,,,,,,https://www.congress.gov/search?q=%7B%22congress%22%3A%22all%22%2C%22source%22%3A%22legislation%22%2C%22search%22%3A%22actionDate%3A%5C%22117%7C2021-11-29%5C%22+AND+%28billIsReserved%3A%5C%22N%5C%22+OR+type%3A%5C%22AMENDMENT%5C%22%29%22%7D&pageSort=documentNumber%3Aasc
11/29/2021,AMENDMENT,,,,,,https://www.congress.gov/search?q=%7B%22congress%22%3A%22all%22%2C%22source%22%3A%22legislation%22%2C%22search%22%3A%22actionDate%3A%5C%22117%7C2021-11-29%5C%22+AND+%28billIsReserved%3A%5C%22N%5C%22+OR+type%3A%5C%22AMENDMENT%5C%22%29%22%7D&pageSort=documentNumber%3Aasc
12/01/2021,BILL,"To provide for automatic renewal protections, and for other purposes.","Rep. Clarke, Yvette D. [D-NY-9]", House - Energy and Commerce        ,House - 12/01/2021 Referred to the House Committee on Energy and Commerce. (,Introduced,https://www.congress.gov/bill/117th-congress/house-bill/6103?q=%7B%22search%22%3A%5B%22actionDate%3A%5C%22117%7C2021-12-01%5C%22+AND+%28billIsReserved%3A%5C%22N%5C%22+OR+type%3A%5C%22AMENDMENT%5C%22%29%22%2C%22%5C%22117%7C2021-12-01%5C%22%22%5D%7D&s=1&r=28
12/01/2021,BILL,"To promote Federal internships and fellowships to prepare the next generation of Federal employees, and for other purposes.","Rep. Connolly, Gerald E. [D-VA-11]", House - Oversight and Reform        ,House - 12/01/2021 Referred to the House Committee on Oversight and Reform. (,Introduced,https://www.congress.gov/bill/117th-congress/house-bill/6104?q=%7B%22search%22%3A%5B%22actionDate%3A%5C%22117%7C2021-12-01%5C%22+AND+%28billIsReserved%3A%5C%22N%5C%22+OR+type%3A%5C%22AMENDMENT%5C%22%29%22%2C%22%5C%22117%7C2021-12-01%5C%22%22%5D%7D&s=1&r=29
11/29/2021,AMENDMENT,,,,,,https://www.congress.gov/search?q=%7B%22congress%22%3A%22all%22%2C%22source%22%3A%22legislation%22%2C%22search%22%3A%22actionDate%3A%5C%22117%7C2021-11-29%5C%22+AND+%28billIsReserved%3A%5C%22N%5C%22+OR+type%3A%5C%22AMENDMENT%5C%22%29%22%7D&pageSort=documentNumber%3Aasc
11/29/2021,AMENDMENT,,,,,,https://www.congress.gov/search?q=%7B%22congress%22%3A%22all%22%2C%22source%22%3A%22legislation%22%2C%22search%22%3A%22actionDate%3A%5C%22117%7C2021-11-29%5C%22+AND+%28billIsReserved%3A%5C%22N%5C%22+OR+type%3A%5C%22AMENDMENT%5C%22%29%22%7D&pageSort=documentNumber%3Aasc
11/29/2021,AMENDMENT,,,,,,https://www.congress.gov/search?q=%7B%22congress%22%3A%22all%22%2C%22source%22%3A%22legislation%22%2C%22search%22%3A%22actionDate%3A%5C%22117%7C2021-11-29%5C%22+AND+%28billIsReserved%3A%5C%22N%5C%22+OR+type%3A%5C%22AMENDMENT%5C%22%29%22%7D&pageSort=documentNumber%3Aasc
12/01/2021,BILL,"To terminate the public health emergency with respect to COVID-19 on December 25, 2021.","Rep. Gohmert, Louie [R-TX-1]", House - Energy and Commerce        ,House - 12/01/2021 Referred to the House Committee on Energy and Commerce. (,Introduced,https://www.congress.gov/bill/117th-congress/house-bill/6105?q=%7B%22search%22%3A%5B%22actionDate%3A%5C%22117%7C2021-12-01%5C%22+AND+%28billIsReserved%3A%5C%22N%5C%22+OR+type%3A%5C%22AMENDMENT%5C%22%29%22%2C%22%5C%22117%7C2021-12-01%5C%22%22%5D%7D&s=1&r=30
12/01/2021,BILL,"To amend title III of the Public Health Service Act to terminate the effective time period for immunity for manufacturers of COVID-19 vaccines, and for other purposes.","Rep. Gooden, Lance [R-TX-5]", House - Energy and Commerce        ,House - 12/01/2021 Referred to the House Committee on Energy and Commerce. (,Introduced,https://www.congress.gov/bill/117th-congress/house-bill/6106?q=%7B%22search%22%3A%5B%22actionDate%3A%5C%22117%7C2021-12-01%5C%22+AND+%28billIsReserved%3A%5C%22N%5C%22+OR+type%3A%5C%22AMENDMENT%5C%22%29%22%2C%22%5C%22117%7C2021-12-01%5C%22%22%5D%7D&s=1&r=31
12/01/2021,BILL,"To amend title 5, United States Code, to require disclosure of conflicts of interest with respect to rule making, and for other purposes.","Rep. Jayapal, Pramila [D-WA-7]", House - Judiciary; Oversight and Reform        ,"House - 12/01/2021 Referred to the Committee on the Judiciary, and in addition to the Committee on Oversight and Reform, for a period to be subsequently determined by the Speaker, in each case for consideration of such provisions as fall within the jurisdiction of the committee... (",Introduced,https://www.congress.gov/bill/117th-congress/house-bill/6107?q=%7B%22search%22%3A%5B%22actionDate%3A%5C%22117%7C2021-12-01%5C%22+AND+%28billIsReserved%3A%5C%22N%5C%22+OR+type%3A%5C%22AMENDMENT%5C%22%29%22%2C%22%5C%22117%7C2021-12-01%5C%22%22%5D%7D&s=1&r=32
12/01/2021,BILL,"To amend the Higher Education Act of 1965 to support community college and industry partnerships, and for other purposes.","Rep. Kelly, Robin L. [D-IL-2]", House - Education and Labor        ,House - 12/01/2021 Referred to the House Committee on Education and Labor. (,Introduced,https://www.congress.gov/bill/117th-congress/house-bill/6108?q=%7B%22search%22%3A%5B%22actionDate%3A%5C%22117%7C2021-12-01%5C%22+AND+%28billIsReserved%3A%5C%22N%5C%22+OR+type%3A%5C%22AMENDMENT%5C%22%29%22%2C%22%5C%22117%7C2021-12-01%5C%22%22%5D%7D&s=1&r=33
12/01/2021,BILL,To amend the Internal Revenue Code of 1986 to increase the income cap for and make permanent the mortgage insurance premium deduction.,"Rep. Kind, Ron [D-WI-3]", House - Ways and Means        ,House - 12/01/2021 Referred to the House Committee on Ways and Means. (,Introduced,https://www.congress.gov/bill/117th-congress/house-bill/6109?q=%7B%22search%22%3A%5B%22actionDate%3A%5C%22117%7C2021-12-01%5C%22+AND+%28billIsReserved%3A%5C%22N%5C%22+OR+type%3A%5C%22AMENDMENT%5C%22%29%22%2C%22%5C%22117%7C2021-12-01%5C%22%22%5D%7D&s=1&r=34
12/01/2021,BILL,"To require the Department of Housing and Urban Development to conduct an annual risk assessment of properties receiving tenant-based or project-based rental assistance for lead-based hazards, and for other purposes.","Rep. Lawson, Al, Jr. [D-FL-5]", House - Financial Services        ,House - 12/01/2021 Referred to the House Committee on Financial Services. (,Introduced,https://www.congress.gov/bill/117th-congress/house-bill/6110?q=%7B%22search%22%3A%5B%22actionDate%3A%5C%22117%7C2021-12-01%5C%22+AND+%28billIsReserved%3A%5C%22N%5C%22+OR+type%3A%5C%22AMENDMENT%5C%22%29%22%2C%22%5C%22117%7C2021-12-01%5C%22%22%5D%7D&s=1&r=35
12/01/2021,BILL,"To modernize laws and policies, and eliminate discrimination, with respect to people living with HIV/AIDS, and for other purposes.","Rep. Lee, Barbara [D-CA-13]", House - Judiciary; Energy and Commerce; Armed Services        ,"House - 12/01/2021 Referred to the Committee on the Judiciary, and in addition to the Committees on Energy and Commerce, and Armed Services, for a period to be subsequently determined by the Speaker, in each case for consideration of such provisions as fall within the jurisdiction of... (",Introduced,https://www.congress.gov/bill/117th-congress/house-bill/6111?q=%7B%22search%22%3A%5B%22actionDate%3A%5C%22117%7C2021-12-01%5C%22+AND+%28billIsReserved%3A%5C%22N%5C%22+OR+type%3A%5C%22AMENDMENT%5C%22%29%22%2C%22%5C%22117%7C2021-12-01%5C%22%22%5D%7D&s=1&r=36
12/01/2021,BILL,To extend the delimiting period for certain individuals to use educational assistance benefits administered by the Department of Veterans Affairs.,"Rep. Levin, Mike [D-CA-49]", House - Veterans' Affairs        ,House - 12/01/2021 Referred to the House Committee on Veterans' Affairs. (,Introduced,https://www.congress.gov/bill/117th-congress/house-bill/6112?q=%7B%22search%22%3A%5B%22actionDate%3A%5C%22117%7C2021-12-01%5C%22+AND+%28billIsReserved%3A%5C%22N%5C%22+OR+type%3A%5C%22AMENDMENT%5C%22%29%22%2C%22%5C%22117%7C2021-12-01%5C%22%22%5D%7D&s=1&r=37
12/01/2021,BILL,"To amend the Fair Labor Standards Act of 1938 to prohibit employers from inquiring about vaccination status, and for other purposes.","Rep. Mast, Brian J. [R-FL-18]", House - Education and Labor        ,House - 12/01/2021 Referred to the House Committee on Education and Labor. (,Introduced,https://www.congress.gov/bill/117th-congress/house-bill/6113?q=%7B%22search%22%3A%5B%22actionDate%3A%5C%22117%7C2021-12-01%5C%22+AND+%28billIsReserved%3A%5C%22N%5C%22+OR+type%3A%5C%22AMENDMENT%5C%22%29%22%2C%22%5C%22117%7C2021-12-01%5C%22%22%5D%7D&s=1&r=38
12/01/2021,BILL,To promote United States trade leadership in the Indo-Pacific region and to require a report on the long-term economic and trade relationship between the United States and the People's Republic of China.,"Rep. Miller, Carol D. [R-WV-3]", House - Ways and Means        ,House - 12/01/2021 Referred to the House Committee on Ways and Means. (,Introduced,https://www.congress.gov/bill/117th-congress/house-bill/6114?q=%7B%22search%22%3A%5B%22actionDate%3A%5C%22117%7C2021-12-01%5C%22+AND+%28billIsReserved%3A%5C%22N%5C%22+OR+type%3A%5C%22AMENDMENT%5C%22%29%22%2C%22%5C%22117%7C2021-12-01%5C%22%22%5D%7D&s=1&r=39
12/01/2021,BILL,"To amend the Federal Funding Accountability and Transparency Act of 2006 to require the Director of the Office of Management and Budget and the Secretary of the Treasury to track and disclose funding and outlays relating to disasters and emergencies on a centralized website, and for other purposes.","Rep. Peters, Scott H. [D-CA-52]", House - Oversight and Reform        ,House - 12/01/2021 Referred to the House Committee on Oversight and Reform. (,Introduced,https://www.congress.gov/bill/117th-congress/house-bill/6115?q=%7B%22search%22%3A%5B%22actionDate%3A%5C%22117%7C2021-12-01%5C%22+AND+%28billIsReserved%3A%5C%22N%5C%22+OR+type%3A%5C%22AMENDMENT%5C%22%29%22%2C%22%5C%22117%7C2021-12-01%5C%22%22%5D%7D&s=1&r=40
12/01/2021,BILL,"To amend title 5, United States Code, to prohibit the use of Federal property for political conventions or fundraising, and for other purposes.","Rep. Phillips, Dean [D-MN-3]", House - Oversight and Reform        ,House - 12/01/2021 Referred to the House Committee on Oversight and Reform. (,Introduced,https://www.congress.gov/bill/117th-congress/house-bill/6116?q=%7B%22search%22%3A%5B%22actionDate%3A%5C%22117%7C2021-12-01%5C%22+AND+%28billIsReserved%3A%5C%22N%5C%22+OR+type%3A%5C%22AMENDMENT%5C%22%29%22%2C%22%5C%22117%7C2021-12-01%5C%22%22%5D%7D&s=1&r=41
12/01/2021,BILL,To increase access to pre-exposure prophylaxis to reduce the transmission of HIV.,"Rep. Schiff, Adam B. [D-CA-28]", House - Energy and Commerce; Oversight and Reform; Ways and Means; Veterans' Affairs; Armed Services; Natural Resources; Financial Services        ,"House - 12/01/2021 Referred to the Committee on Energy and Commerce, and in addition to the Committees on Oversight and Reform, Ways and Means, Veterans' Affairs, Armed Services, Natural Resources, and Financial Services, for a period to be subsequently determined by the Speaker, in... (",Introduced,https://www.congress.gov/bill/117th-congress/house-bill/6117?q=%7B%22search%22%3A%5B%22actionDate%3A%5C%22117%7C2021-12-01%5C%22+AND+%28billIsReserved%3A%5C%22N%5C%22+OR+type%3A%5C%22AMENDMENT%5C%22%29%22%2C%22%5C%22117%7C2021-12-01%5C%22%22%5D%7D&s=1&r=42
12/01/2021,BILL,"To establish a National Manufacturing Extension Partnership Supply Chain Database, and for other purposes.","Rep. Torres, Norma J. [D-CA-35]"," House - Science, Space, and Technology        ","House - 12/01/2021 Referred to the House Committee on Science, Space, and Technology. (",Introduced,https://www.congress.gov/bill/117th-congress/house-bill/6118?q=%7B%22search%22%3A%5B%22actionDate%3A%5C%22117%7C2021-12-01%5C%22+AND+%28billIsReserved%3A%5C%22N%5C%22+OR+type%3A%5C%22AMENDMENT%5C%22%29%22%2C%22%5C%22117%7C2021-12-01%5C%22%22%5D%7D&s=1&r=43
12/01/2021,RESOLUTION,Electing a certain Member to certain standing committees of the House of Representatives.,"Rep. Jeffries, Hakeem S. [D-NY-8]",,House - 12/01/2021 Motion to reconsider laid on the table Agreed to without objection. (,Agreed to in House,https://www.congress.gov/bill/117th-congress/house-resolution/825?q=%7B%22search%22%3A%5B%22actionDate%3A%5C%22117%7C2021-12-01%5C%22+AND+%28billIsReserved%3A%5C%22N%5C%22+OR+type%3A%5C%22AMENDMENT%5C%22%29%22%2C%22%5C%22117%7C2021-12-01%5C%22%22%5D%7D&s=1&r=44
12/01/2021,RESOLUTION,Electing a Member to certain standing committees of the House of Representatives.,"Rep. Johnson, Mike [R-LA-4]",,House - 12/01/2021 Motion to reconsider laid on the table Agreed to without objection. (,Agreed to in House,https://www.congress.gov/bill/117th-congress/house-resolution/826?q=%7B%22search%22%3A%5B%22actionDate%3A%5C%22117%7C2021-12-01%5C%22+AND+%28billIsReserved%3A%5C%22N%5C%22+OR+type%3A%5C%22AMENDMENT%5C%22%29%22%2C%22%5C%22117%7C2021-12-01%5C%22%22%5D%7D&s=1&r=45
12/01/2021,RESOLUTION,Recognizing the contributions made by the 305-meter radio telescope at the Arecibo Observatory.,"Resident Commissioner Gonzlez-Coln, Jenniffer [R-PR-At Large]"," House - Science, Space, and Technology        ","House - 12/01/2021 Referred to the House Committee on Science, Space, and Technology. (",Introduced,https://www.congress.gov/bill/117th-congress/house-resolution/827?q=%7B%22search%22%3A%5B%22actionDate%3A%5C%22117%7C2021-12-01%5C%22+AND+%28billIsReserved%3A%5C%22N%5C%22+OR+type%3A%5C%22AMENDMENT%5C%22%29%22%2C%22%5C%22117%7C2021-12-01%5C%22%22%5D%7D&s=1&r=46
12/01/2021,RESOLUTION,Congratulating the Washington Spirit on winning the 2021 National Women's Soccer League championship.,"Del. Norton, Eleanor Holmes [D-DC-At Large]", House - Oversight and Reform        ,House - 12/01/2021 Referred to the House Committee on Oversight and Reform. (,Introduced,https://www.congress.gov/bill/117th-congress/house-resolution/828?q=%7B%22search%22%3A%5B%22actionDate%3A%5C%22117%7C2021-12-01%5C%22+AND+%28billIsReserved%3A%5C%22N%5C%22+OR+type%3A%5C%22AMENDMENT%5C%22%29%22%2C%22%5C%22117%7C2021-12-01%5C%22%22%5D%7D&s=1&r=47
12/01/2021,BILL,Better Cybercrime Metrics Act,"Sen. Schatz, Brian [D-HI]", Senate - Judiciary        ,Senate - 12/01/2021 Placed on Senate Legislative Calendar under General Orders. Calendar No. 173. (,Introduced,https://www.congress.gov/bill/117th-congress/senate-bill/2629?q=%7B%22search%22%3A%5B%22actionDate%3A%5C%22117%7C2021-12-01%5C%22+AND+%28billIsReserved%3A%5C%22N%5C%22+OR+type%3A%5C%22AMENDMENT%5C%22%29%22%2C%22%5C%22117%7C2021-12-01%5C%22%22%5D%7D&s=1&r=48
12/01/2021,BILL,"A bill to designate the United States Courthouse and Federal Building located at 111 North Adams Street in Tallahassee, Florida, as the ""Joseph Woodrow Hatchett United States Courthouse and Federal Building"", and for other purposes.","Sen. Rubio, Marco [R-FL]", Senate - Environment and Public Works        ,Senate - 12/01/2021 Placed on Senate Legislative Calendar under General Orders. Calendar No. 170. (,Introduced,https://www.congress.gov/bill/117th-congress/senate-bill/2938?q=%7B%22search%22%3A%5B%22actionDate%3A%5C%22117%7C2021-12-01%5C%22+AND+%28billIsReserved%3A%5C%22N%5C%22+OR+type%3A%5C%22AMENDMENT%5C%22%29%22%2C%22%5C%22117%7C2021-12-01%5C%22%22%5D%7D&s=1&r=49
12/01/2021,BILL,"A bill to amend the Federal Funding Accountability and Transparency Act of 2006 to require the Director of the Office of Management and Budget and the Secretary of the Treasury to track and disclose funding and outlays relating to disasters and emergencies on a centralized website, and for other purposes.","Sen. Peters, Gary [D-MI]", Senate - Homeland Security and Governmental Affairs        ,Senate - 12/01/2021 Read twice and referred to the Committee on Homeland Security and Governmental Affairs. (,Introduced,https://www.congress.gov/bill/117th-congress/senate-bill/3289?q=%7B%22search%22%3A%5B%22actionDate%3A%5C%22117%7C2021-12-01%5C%22+AND+%28billIsReserved%3A%5C%22N%5C%22+OR+type%3A%5C%22AMENDMENT%5C%22%29%22%2C%22%5C%22117%7C2021-12-01%5C%22%22%5D%7D&s=1&r=50
12/01/2021,BILL,"A bill to establish a National Manufacturing Extension Partnership Supply Chain Database, and for other purposes.","Sen. Menendez, Robert [D-NJ]"," Senate - Commerce, Science, and Transportation        ","Senate - 12/01/2021 Read twice and referred to the Committee on Commerce, Science, and Transportation. (",Introduced,https://www.congress.gov/bill/117th-congress/senate-bill/3290?q=%7B%22search%22%3A%5B%22actionDate%3A%5C%22117%7C2021-12-01%5C%22+AND+%28billIsReserved%3A%5C%22N%5C%22+OR+type%3A%5C%22AMENDMENT%5C%22%29%22%2C%22%5C%22117%7C2021-12-01%5C%22%22%5D%7D&s=1&r=51
12/01/2021,BILL,"A bill to amend the Public Health Service Act to enhance efforts to address antibiotic resistance, and for other purposes.","Sen. Brown, Sherrod [D-OH]"," Senate - Health, Education, Labor, and Pensions        ","Senate - 12/01/2021 Read twice and referred to the Committee on Health, Education, Labor, and Pensions. (",Introduced,https://www.congress.gov/bill/117th-congress/senate-bill/3291?q=%7B%22search%22%3A%5B%22actionDate%3A%5C%22117%7C2021-12-01%5C%22+AND+%28billIsReserved%3A%5C%22N%5C%22+OR+type%3A%5C%22AMENDMENT%5C%22%29%22%2C%22%5C%22117%7C2021-12-01%5C%22%22%5D%7D&s=1&r=52
12/01/2021,BILL,"A bill to require the Secretary of Agriculture to initiate hearings to review Federal milk marketing orders relating to pricing of Class I skim milk, and for other purposes.","Sen. Gillibrand, Kirsten [D-NY]"," Senate - Agriculture, Nutrition, and Forestry        ","Senate - 12/01/2021 Read twice and referred to the Committee on Agriculture, Nutrition, and Forestry. (",Introduced,https://www.congress.gov/bill/117th-congress/senate-bill/3292?q=%7B%22search%22%3A%5B%22actionDate%3A%5C%22117%7C2021-12-01%5C%22+AND+%28billIsReserved%3A%5C%22N%5C%22+OR+type%3A%5C%22AMENDMENT%5C%22%29%22%2C%22%5C%22117%7C2021-12-01%5C%22%22%5D%7D&s=1&r=53
12/01/2021,BILL,"A bill to expand access of veterans to mental health care from the Department of Veterans Affairs, and for other purposes.","Sen. Tester, Jon [D-MT]", Senate - Veterans' Affairs        ,Senate - 12/01/2021 Read twice and referred to the Committee on Veterans' Affairs. (,Introduced,https://www.congress.gov/bill/117th-congress/senate-bill/3293?q=%7B%22search%22%3A%5B%22actionDate%3A%5C%22117%7C2021-12-01%5C%22+AND+%28billIsReserved%3A%5C%22N%5C%22+OR+type%3A%5C%22AMENDMENT%5C%22%29%22%2C%22%5C%22117%7C2021-12-01%5C%22%22%5D%7D&s=1&r=54
