date,type,title,sponsor,committees,latest_action,tracker,url
08/03/2021,BILL,"To amend the Indian Health Care Improvement Act to expand the Purchased/Referred Care Delivery Area for the Tunica-Biloxi Tribe of Louisiana to include Brazoria County and Harris County in the State of Texas, and for other purposes.","Rep. Letlow, Julia [R-LA-5]", House - Natural Resources; Energy and Commerce        ,"House - 08/03/2021 Referred to the Committee on Natural Resources, and in addition to the Committee on Energy and Commerce, for a period to be subsequently determined by the Speaker, in each case for consideration of such provisions as fall within the jurisdiction of the committee... (",Introduced,https://www.congress.gov/bill/117th-congress/house-bill/4913?q=%7B%22search%22%3A%5B%22actionDate%3A%5C%22117%7C2021-08-03%5C%22+AND+%28billIsReserved%3A%5C%22N%5C%22+OR+type%3A%5C%22AMENDMENT%5C%22%29%22%5D%7D&s=1&r=13
08/03/2021,BILL,"To impose sanctions against foreign persons and foreign governments in response to certain clandestine attacks on United States personnel, and for other purposes.","Rep. McCaul, Michael T. [R-TX-10]", House - Foreign Affairs; Judiciary; Financial Services        ,"House - 08/03/2021 Referred to the Committee on Foreign Affairs, and in addition to the Committees on the Judiciary, and Financial Services, for a period to be subsequently determined by the Speaker, in each case for consideration of such provisions as fall within the jurisdiction of... (",Introduced,https://www.congress.gov/bill/117th-congress/house-bill/4914?q=%7B%22search%22%3A%5B%22actionDate%3A%5C%22117%7C2021-08-03%5C%22+AND+%28billIsReserved%3A%5C%22N%5C%22+OR+type%3A%5C%22AMENDMENT%5C%22%29%22%5D%7D&s=1&r=14
08/03/2021,BILL,"To authorize the Secretary of the Interior to coordinate Federal and State permitting processes related to the construction of new surface water storage projects on lands under the jurisdiction of the Secretary of the Interior and the Secretary of Agriculture and to designate the Bureau of Reclamation as the lead agency for permit processing, and for other purposes.","Rep. McClintock, Tom [R-CA-4]", House - Natural Resources        ,House - 08/03/2021 Referred to the House Committee on Natural Resources. (,Introduced,https://www.congress.gov/bill/117th-congress/house-bill/4915?q=%7B%22search%22%3A%5B%22actionDate%3A%5C%22117%7C2021-08-03%5C%22+AND+%28billIsReserved%3A%5C%22N%5C%22+OR+type%3A%5C%22AMENDMENT%5C%22%29%22%5D%7D&s=1&r=15
08/03/2021,BILL,"To study the extent to which individuals are more at risk of maternal mortality or severe maternal morbidity as a result of being a victim of intimate partner violence, and for other purposes.","Rep. Moore, Gwen [D-WI-4]", House - Energy and Commerce        ,House - 08/03/2021 Referred to the House Committee on Energy and Commerce. (,Introduced,https://www.congress.gov/bill/117th-congress/house-bill/4916?q=%7B%22search%22%3A%5B%22actionDate%3A%5C%22117%7C2021-08-03%5C%22+AND+%28billIsReserved%3A%5C%22N%5C%22+OR+type%3A%5C%22AMENDMENT%5C%22%29%22%5D%7D&s=1&r=16
08/03/2021,BILL,"To amend the Federal Food, Drug, and Cosmetic Act to strengthen requirements related to nutrient information on food labels, and for other purposes.","Rep. Pallone, Frank, Jr. [D-NJ-6]", House - Energy and Commerce        ,House - 08/03/2021 Referred to the House Committee on Energy and Commerce. (,Introduced,https://www.congress.gov/bill/117th-congress/house-bill/4917?q=%7B%22search%22%3A%5B%22actionDate%3A%5C%22117%7C2021-08-03%5C%22+AND+%28billIsReserved%3A%5C%22N%5C%22+OR+type%3A%5C%22AMENDMENT%5C%22%29%22%5D%7D&s=1&r=17
08/03/2021,BILL,To amend title XVIII of the Social Security Act to include store-and-forward technologies as telecommunications systems through which telehealth services may be furnished for payment under the Medicare program.,"Rep. Rosendale Sr., Matthew M. [R-MT-At Large]", House - Energy and Commerce; Ways and Means        ,"House - 08/03/2021 Referred to the Committee on Energy and Commerce, and in addition to the Committee on Ways and Means, for a period to be subsequently determined by the Speaker, in each case for consideration of such provisions as fall within the jurisdiction of the committee... (",Introduced,https://www.congress.gov/bill/117th-congress/house-bill/4918?q=%7B%22search%22%3A%5B%22actionDate%3A%5C%22117%7C2021-08-03%5C%22+AND+%28billIsReserved%3A%5C%22N%5C%22+OR+type%3A%5C%22AMENDMENT%5C%22%29%22%5D%7D&s=1&r=18
08/04/2021,BILL,"To require the Administrator of the Federal Aviation Administration to notify the public of proposed new Performance Based Navigation Implementation Process flight procedures, and for other purposes.","Rep. Speier, Jackie [D-CA-14]", House - Transportation and Infrastructure        ,House - 08/04/2021 Referred to the Subcommittee on Aviation. (,Introduced,https://www.congress.gov/bill/117th-congress/house-bill/4927?q=%7B%22search%22%3A%5B%22actionDate%3A%5C%22117%7C2021-08-04%5C%22+AND+%28billIsReserved%3A%5C%22N%5C%22+OR+type%3A%5C%22AMENDMENT%5C%22%29%22%5D%7D&s=1&r=12
08/04/2021,BILL,"To require the Administrator of the Federal Aviation Administration to respond to requests for information from Members of Congress, and for other purposes.","Rep. Speier, Jackie [D-CA-14]", House - Transportation and Infrastructure        ,House - 08/04/2021 Referred to the Subcommittee on Aviation. (,Introduced,https://www.congress.gov/bill/117th-congress/house-bill/4928?q=%7B%22search%22%3A%5B%22actionDate%3A%5C%22117%7C2021-08-04%5C%22+AND+%28billIsReserved%3A%5C%22N%5C%22+OR+type%3A%5C%22AMENDMENT%5C%22%29%22%5D%7D&s=1&r=13
08/04/2021,BILL,"To amend title 49, United States Code, to allow airports to impose an access restriction for certain hours, to assess certain penalties against air carriers or aircraft operators, and for other purposes.","Rep. Speier, Jackie [D-CA-14]", House - Transportation and Infrastructure        ,House - 08/04/2021 Referred to the Subcommittee on Aviation. (,Introduced,https://www.congress.gov/bill/117th-congress/house-bill/4929?q=%7B%22search%22%3A%5B%22actionDate%3A%5C%22117%7C2021-08-04%5C%22+AND+%28billIsReserved%3A%5C%22N%5C%22+OR+type%3A%5C%22AMENDMENT%5C%22%29%22%5D%7D&s=1&r=14
08/04/2021,BILL,"To require the Administrator of the Federal Aviation Administration to continue processing the proposed SFO NIITE Departure Southbound Transition and the OAK HUSSH Departure Southbound Transition, and for other purposes.","Rep. Speier, Jackie [D-CA-14]", House - Transportation and Infrastructure        ,House - 08/04/2021 Referred to the Subcommittee on Aviation. (,Introduced,https://www.congress.gov/bill/117th-congress/house-bill/4930?q=%7B%22search%22%3A%5B%22actionDate%3A%5C%22117%7C2021-08-04%5C%22+AND+%28billIsReserved%3A%5C%22N%5C%22+OR+type%3A%5C%22AMENDMENT%5C%22%29%22%5D%7D&s=1&r=15
08/04/2021,BILL,"To amend title 49, United States Code, to establish a program at San Francisco International Airport for purposes of soundproofing residential buildings in surrounding communities.","Rep. Speier, Jackie [D-CA-14]", House - Transportation and Infrastructure        ,House - 08/04/2021 Referred to the Subcommittee on Aviation. (,Introduced,https://www.congress.gov/bill/117th-congress/house-bill/4931?q=%7B%22search%22%3A%5B%22actionDate%3A%5C%22117%7C2021-08-04%5C%22+AND+%28billIsReserved%3A%5C%22N%5C%22+OR+type%3A%5C%22AMENDMENT%5C%22%29%22%5D%7D&s=1&r=16
08/04/2021,BILL,Composite Standards Act of 2021,"Sen. Capito, Shelley Moore [R-WV]"," Senate - Commerce, Science, and Transportation        ","Senate - 08/04/2021 Committee on Commerce, Science, and Transportation. Ordered to be reported without amendment favorably. (",Introduced,https://www.congress.gov/bill/117th-congress/senate-bill/451?q=%7B%22search%22%3A%5B%22actionDate%3A%5C%22117%7C2021-08-04%5C%22+AND+%28billIsReserved%3A%5C%22N%5C%22+OR+type%3A%5C%22AMENDMENT%5C%22%29%22%5D%7D&s=1&r=17
08/04/2021,BILL,Native American Language Resource Center Act of 2021,"Sen. Schatz, Brian [D-HI]", Senate - Indian Affairs        ,Senate - 08/04/2021 Committee on Indian Affairs. Ordered to be reported with an amendment in the nature of a substitute favorably. (,Introduced,https://www.congress.gov/bill/117th-congress/senate-bill/989?q=%7B%22search%22%3A%5B%22actionDate%3A%5C%22117%7C2021-08-04%5C%22+AND+%28billIsReserved%3A%5C%22N%5C%22+OR+type%3A%5C%22AMENDMENT%5C%22%29%22%5D%7D&s=1&r=18
08/04/2021,BILL,Durbin Feeling Native American Languages Act of 2021,"Sen. Schatz, Brian [D-HI]", Senate - Indian Affairs        ,Senate - 08/04/2021 Committee on Indian Affairs. Ordered to be reported without amendment favorably. (,Introduced,https://www.congress.gov/bill/117th-congress/senate-bill/1402?q=%7B%22search%22%3A%5B%22actionDate%3A%5C%22117%7C2021-08-04%5C%22+AND+%28billIsReserved%3A%5C%22N%5C%22+OR+type%3A%5C%22AMENDMENT%5C%22%29%22%5D%7D&s=1&r=19
08/04/2021,BILL,Secure Equipment Act of 2021,"Sen. Rubio, Marco [R-FL]"," Senate - Commerce, Science, and Transportation        ","Senate - 08/04/2021 Committee on Commerce, Science, and Transportation. Ordered to be reported with an amendment in the nature of a substitute favorably. (",Introduced,https://www.congress.gov/bill/117th-congress/senate-bill/1790?q=%7B%22search%22%3A%5B%22actionDate%3A%5C%22117%7C2021-08-04%5C%22+AND+%28billIsReserved%3A%5C%22N%5C%22+OR+type%3A%5C%22AMENDMENT%5C%22%29%22%5D%7D&s=1&r=20
08/05/2021,BILL,"A bill to award a Congressional gold medal to the 369th Infantry Regiment, commonly known as the ""Harlem Hellfighters"", in recognition of their bravery and outstanding service during World War I.","Sen. Gillibrand, Kirsten [D-NY]"," Senate - Banking, Housing, and Urban Affairs        ","Senate - 08/05/2021 Read twice and referred to the Committee on Banking, Housing, and Urban Affairs. (",Introduced,https://www.congress.gov/bill/117th-congress/senate-bill/2647?q=%7B%22search%22%3A%5B%22actionDate%3A%5C%22117%7C2021-08-05%5C%22+AND+%28billIsReserved%3A%5C%22N%5C%22+OR+type%3A%5C%22AMENDMENT%5C%22%29%22%5D%7D&s=1&r=34
08/05/2021,BILL,"A bill to amend the Omnibus Public Land Management Act of 2009 to reauthorize the Kenai Mountains-Turnagain Arm National Heritage Area in the State of Alaska, and for other purposes.","Sen. Murkowski, Lisa [R-AK]", Senate - Energy and Natural Resources        ,Senate - 08/05/2021 Read twice and referred to the Committee on Energy and Natural Resources. (,Introduced,https://www.congress.gov/bill/117th-congress/senate-bill/2648?q=%7B%22search%22%3A%5B%22actionDate%3A%5C%22117%7C2021-08-05%5C%22+AND+%28billIsReserved%3A%5C%22N%5C%22+OR+type%3A%5C%22AMENDMENT%5C%22%29%22%5D%7D&s=1&r=35
08/05/2021,BILL,"A bill to establish a demonstration program to provide integrated care for Medicare beneficiaries with end-stage renal disease, and for other purposes.","Sen. Young, Todd [R-IN]", Senate - Finance        ,Senate - 08/05/2021 Read twice and referred to the Committee on Finance. (,Introduced,https://www.congress.gov/bill/117th-congress/senate-bill/2649?q=%7B%22search%22%3A%5B%22actionDate%3A%5C%22117%7C2021-08-05%5C%22+AND+%28billIsReserved%3A%5C%22N%5C%22+OR+type%3A%5C%22AMENDMENT%5C%22%29%22%5D%7D&s=1&r=36
08/05/2021,BILL,"A bill to provide mandatory funding for hazardous fuels reduction projects on certain Federal land, and for other purposes.","Sen. Merkley, Jeff [D-OR]", Senate - Energy and Natural Resources        ,Senate - 08/05/2021 Read twice and referred to the Committee on Energy and Natural Resources. (,Introduced,https://www.congress.gov/bill/117th-congress/senate-bill/2650?q=%7B%22search%22%3A%5B%22actionDate%3A%5C%22117%7C2021-08-05%5C%22+AND+%28billIsReserved%3A%5C%22N%5C%22+OR+type%3A%5C%22AMENDMENT%5C%22%29%22%5D%7D&s=1&r=37
08/05/2021,BILL,"A bill to amend the Federal Power Act to establish a procedure for the siting of certain interstate electric transmission facilities, and for other purposes.","Sen. Whitehouse, Sheldon [D-RI]", Senate - Energy and Natural Resources        ,Senate - 08/05/2021 Read twice and referred to the Committee on Energy and Natural Resources. (,Introduced,https://www.congress.gov/bill/117th-congress/senate-bill/2651?q=%7B%22search%22%3A%5B%22actionDate%3A%5C%22117%7C2021-08-05%5C%22+AND+%28billIsReserved%3A%5C%22N%5C%22+OR+type%3A%5C%22AMENDMENT%5C%22%29%22%5D%7D&s=1&r=38
08/05/2021,BILL,"A bill to amend title XVIII of the Social Security Act to clarify congressional intent and preserve patient access to home infusion therapy under the Medicare program, and for other purposes.","Sen. Warner, Mark [D-VA]", Senate - Finance        ,Senate - 08/05/2021 Read twice and referred to the Committee on Finance. (,Introduced,https://www.congress.gov/bill/117th-congress/senate-bill/2652?q=%7B%22search%22%3A%5B%22actionDate%3A%5C%22117%7C2021-08-05%5C%22+AND+%28billIsReserved%3A%5C%22N%5C%22+OR+type%3A%5C%22AMENDMENT%5C%22%29%22%5D%7D&s=1&r=39
08/05/2021,BILL,A bill to amend the Internal Revenue Code of 1986 to provide for collegiate housing and infrastructure grants.,"Sen. Cardin, Ben [D-MD]", Senate - Finance        ,Senate - 08/05/2021 Read twice and referred to the Committee on Finance. (,Introduced,https://www.congress.gov/bill/117th-congress/senate-bill/2653?q=%7B%22search%22%3A%5B%22actionDate%3A%5C%22117%7C2021-08-05%5C%22+AND+%28billIsReserved%3A%5C%22N%5C%22+OR+type%3A%5C%22AMENDMENT%5C%22%29%22%5D%7D&s=1&r=40
08/05/2021,BILL,"A bill to require a declassification review of certain investigation documents concerning foreign support for the terrorist attacks of September 11, 2001, and for other purposes.","Sen. Menendez, Robert [D-NJ]", Senate - Intelligence (Select)        ,Senate - 08/05/2021 Read twice and referred to the Select Committee on Intelligence. (,Introduced,https://www.congress.gov/bill/117th-congress/senate-bill/2654?q=%7B%22search%22%3A%5B%22actionDate%3A%5C%22117%7C2021-08-05%5C%22+AND+%28billIsReserved%3A%5C%22N%5C%22+OR+type%3A%5C%22AMENDMENT%5C%22%29%22%5D%7D&s=1&r=41
08/05/2021,BILL,A bill to provide funding for demonstration grants to support clinical training of health care providers to administer medical forensic examinations and treatments to survivors of interpersonal violence of all ages.,"Sen. Murkowski, Lisa [R-AK]"," Senate - Health, Education, Labor, and Pensions        ","Senate - 08/05/2021 Read twice and referred to the Committee on Health, Education, Labor, and Pensions. (",Introduced,https://www.congress.gov/bill/117th-congress/senate-bill/2655?q=%7B%22search%22%3A%5B%22actionDate%3A%5C%22117%7C2021-08-05%5C%22+AND+%28billIsReserved%3A%5C%22N%5C%22+OR+type%3A%5C%22AMENDMENT%5C%22%29%22%5D%7D&s=1&r=42
08/02/2021,AMENDMENT,,,,,,https://www.congress.gov/search?q=%7B%22congress%22%3A%22all%22%2C%22source%22%3A%22legislation%22%2C%22search%22%3A%22actionDate%3A%5C%22117%7C2021-08-02%5C%22+AND+%28billIsReserved%3A%5C%22N%5C%22+OR+type%3A%5C%22AMENDMENT%5C%22%29%22%7D&pageSort=documentNumber%3Aasc
08/02/2021,AMENDMENT,,,,,,https://www.congress.gov/search?q=%7B%22congress%22%3A%22all%22%2C%22source%22%3A%22legislation%22%2C%22search%22%3A%22actionDate%3A%5C%22117%7C2021-08-02%5C%22+AND+%28billIsReserved%3A%5C%22N%5C%22+OR+type%3A%5C%22AMENDMENT%5C%22%29%22%7D&pageSort=documentNumber%3Aasc
08/02/2021,AMENDMENT,,,,,,https://www.congress.gov/search?q=%7B%22congress%22%3A%22all%22%2C%22source%22%3A%22legislation%22%2C%22search%22%3A%22actionDate%3A%5C%22117%7C2021-08-02%5C%22+AND+%28billIsReserved%3A%5C%22N%5C%22+OR+type%3A%5C%22AMENDMENT%5C%22%29%22%7D&pageSort=documentNumber%3Aasc
08/02/2021,AMENDMENT,,,,,,https://www.congress.gov/search?q=%7B%22congress%22%3A%22all%22%2C%22source%22%3A%22legislation%22%2C%22search%22%3A%22actionDate%3A%5C%22117%7C2021-08-02%5C%22+AND+%28billIsReserved%3A%5C%22N%5C%22+OR+type%3A%5C%22AMENDMENT%5C%22%29%22%7D&pageSort=documentNumber%3Aasc
08/02/2021,AMENDMENT,,,,,,https://www.congress.gov/search?q=%7B%22congress%22%3A%22all%22%2C%22source%22%3A%22legislation%22%2C%22search%22%3A%22actionDate%3A%5C%22117%7C2021-08-02%5C%22+AND+%28billIsReserved%3A%5C%22N%5C%22+OR+type%3A%5C%22AMENDMENT%5C%22%29%22%7D&pageSort=documentNumber%3Aasc
08/02/2021,AMENDMENT,,,,,,https://www.congress.gov/search?q=%7B%22congress%22%3A%22all%22%2C%22source%22%3A%22legislation%22%2C%22search%22%3A%22actionDate%3A%5C%22117%7C2021-08-02%5C%22+AND+%28billIsReserved%3A%5C%22N%5C%22+OR+type%3A%5C%22AMENDMENT%5C%22%29%22%7D&pageSort=documentNumber%3Aasc
08/02/2021,AMENDMENT,,,,,,https://www.congress.gov/search?q=%7B%22congress%22%3A%22all%22%2C%22source%22%3A%22legislation%22%2C%22search%22%3A%22actionDate%3A%5C%22117%7C2021-08-02%5C%22+AND+%28billIsReserved%3A%5C%22N%5C%22+OR+type%3A%5C%22AMENDMENT%5C%22%29%22%7D&pageSort=documentNumber%3Aasc
08/02/2021,AMENDMENT,,,,,,https://www.congress.gov/search?q=%7B%22congress%22%3A%22all%22%2C%22source%22%3A%22legislation%22%2C%22search%22%3A%22actionDate%3A%5C%22117%7C2021-08-02%5C%22+AND+%28billIsReserved%3A%5C%22N%5C%22+OR+type%3A%5C%22AMENDMENT%5C%22%29%22%7D&pageSort=documentNumber%3Aasc
08/02/2021,AMENDMENT,,,,,,https://www.congress.gov/search?q=%7B%22congress%22%3A%22all%22%2C%22source%22%3A%22legislation%22%2C%22search%22%3A%22actionDate%3A%5C%22117%7C2021-08-02%5C%22+AND+%28billIsReserved%3A%5C%22N%5C%22+OR+type%3A%5C%22AMENDMENT%5C%22%29%22%7D&pageSort=documentNumber%3Aasc
08/02/2021,AMENDMENT,,Record Vote Number: 292,,", under the order of 8/2/2021, having achieved 60 votes in the affirmative, was agreed to in Senate by Yea-Nay Vote. 95 - 1. ",,https://www.congress.gov/search?q=%7B%22congress%22%3A%22all%22%2C%22source%22%3A%22legislation%22%2C%22search%22%3A%22actionDate%3A%5C%22117%7C2021-08-02%5C%22+AND+%28billIsReserved%3A%5C%22N%5C%22+OR+type%3A%5C%22AMENDMENT%5C%22%29%22%7D&pageSort=documentNumber%3Aasc
08/02/2021,AMENDMENT,,,,,,https://www.congress.gov/search?q=%7B%22congress%22%3A%22all%22%2C%22source%22%3A%22legislation%22%2C%22search%22%3A%22actionDate%3A%5C%22117%7C2021-08-02%5C%22+AND+%28billIsReserved%3A%5C%22N%5C%22+OR+type%3A%5C%22AMENDMENT%5C%22%29%22%7D&pageSort=documentNumber%3Aasc
08/02/2021,AMENDMENT,,Record Vote Number: 306, agreed to in Senate by Yea-Nay Vote. 95 - 0. ,,,https://www.congress.gov/search?q=%7B%22congress%22%3A%22all%22%2C%22source%22%3A%22legislation%22%2C%22search%22%3A%22actionDate%3A%5C%22117%7C2021-08-02%5C%22+AND+%28billIsReserved%3A%5C%22N%5C%22+OR+type%3A%5C%22AMENDMENT%5C%22%29%22%7D&pageSort=documentNumber%3Aasc
08/03/2021,BILL,To modify the penalties for violations of the Telephone Consumer Protection Act of 1993.,"Rep. Ross, Deborah K. [D-NC-2]", House - Energy and Commerce        ,House - 08/03/2021 Referred to the House Committee on Energy and Commerce. (,Introduced,https://www.congress.gov/bill/117th-congress/house-bill/4919?q=%7B%22search%22%3A%5B%22actionDate%3A%5C%22117%7C2021-08-03%5C%22+AND+%28billIsReserved%3A%5C%22N%5C%22+OR+type%3A%5C%22AMENDMENT%5C%22%29%22%5D%7D&s=1&r=19
08/03/2021,BILL,To establish a working group on electric vehicles.,"Rep. Ross, Deborah K. [D-NC-2]"," House - Energy and Commerce; Transportation and Infrastructure; Science, Space, and Technology; Oversight and Reform        ",House - 08/04/2021 Referred to the Subcommittee on Highways and Transit. (,Introduced,https://www.congress.gov/bill/117th-congress/house-bill/4920?q=%7B%22search%22%3A%5B%22actionDate%3A%5C%22117%7C2021-08-03%5C%22+AND+%28billIsReserved%3A%5C%22N%5C%22+OR+type%3A%5C%22AMENDMENT%5C%22%29%22%5D%7D&s=1&r=20
08/03/2021,BILL,To improve the retirement security of American families by strengthening Social Security.,"Rep. Sanchez, Linda T. [D-CA-38]", House - Ways and Means; Education and Labor        ,"House - 08/03/2021 Referred to the Committee on Ways and Means, and in addition to the Committee on Education and Labor, for a period to be subsequently determined by the Speaker, in each case for consideration of such provisions as fall within the jurisdiction of the committee... (",Introduced,https://www.congress.gov/bill/117th-congress/house-bill/4921?q=%7B%22search%22%3A%5B%22actionDate%3A%5C%22117%7C2021-08-03%5C%22+AND+%28billIsReserved%3A%5C%22N%5C%22+OR+type%3A%5C%22AMENDMENT%5C%22%29%22%5D%7D&s=1&r=21
08/03/2021,BILL,"To amend the Internal Revenue Code of 1986 to expand the residential energy efficient property credit and energy credit, and for other purposes.","Rep. Sherrill, Mikie [D-NJ-11]", House - Ways and Means        ,House - 08/03/2021 Referred to the House Committee on Ways and Means. (,Introduced,https://www.congress.gov/bill/117th-congress/house-bill/4922?q=%7B%22search%22%3A%5B%22actionDate%3A%5C%22117%7C2021-08-03%5C%22+AND+%28billIsReserved%3A%5C%22N%5C%22+OR+type%3A%5C%22AMENDMENT%5C%22%29%22%5D%7D&s=1&r=22
08/03/2021,BILL,To prohibit Federal funding for educational agencies and schools whose students do not read certain foundational texts of the United States and are not able to recite those texts or that teach that those texts are products of white supremacy or racism.,"Rep. Smith, Jason [R-MO-8]", House - Education and Labor        ,House - 08/03/2021 Referred to the House Committee on Education and Labor. (,Introduced,https://www.congress.gov/bill/117th-congress/house-bill/4923?q=%7B%22search%22%3A%5B%22actionDate%3A%5C%22117%7C2021-08-03%5C%22+AND+%28billIsReserved%3A%5C%22N%5C%22+OR+type%3A%5C%22AMENDMENT%5C%22%29%22%5D%7D&s=1&r=23
08/03/2021,BILL,"To direct the Administrator of the Federal Aviation Administration to ensure representatives of aviation roundtables may participate in the NextGen performance-based navigation implementation process of the Federal Aviation Administration, and for other purposes.","Rep. Speier, Jackie [D-CA-14]", House - Transportation and Infrastructure        ,House - 08/04/2021 Referred to the Subcommittee on Aviation. (,Introduced,https://www.congress.gov/bill/117th-congress/house-bill/4924?q=%7B%22search%22%3A%5B%22actionDate%3A%5C%22117%7C2021-08-03%5C%22+AND+%28billIsReserved%3A%5C%22N%5C%22+OR+type%3A%5C%22AMENDMENT%5C%22%29%22%5D%7D&s=1&r=24
08/03/2021,BILL,"To amend title 49, United States Code, to expand the priorities of the Administrator of the Federal Aviation Administration in developing plans and policy for the use of the navigable airspace.","Rep. Speier, Jackie [D-CA-14]", House - Transportation and Infrastructure        ,House - 08/04/2021 Referred to the Subcommittee on Aviation. (,Introduced,https://www.congress.gov/bill/117th-congress/house-bill/4925?q=%7B%22search%22%3A%5B%22actionDate%3A%5C%22117%7C2021-08-03%5C%22+AND+%28billIsReserved%3A%5C%22N%5C%22+OR+type%3A%5C%22AMENDMENT%5C%22%29%22%5D%7D&s=1&r=25
08/03/2021,BILL,"To establish that no Federal statute is intended to preempt a cause of action against an airport maintained in any State small claims or superior court by any individual or city within 5 miles of an airport when an action is brought for noise or nuisance caused by ground-based noise in violation of a State statute as specified, and for other purposes.","Rep. Speier, Jackie [D-CA-14]", House - Transportation and Infrastructure        ,House - 08/04/2021 Referred to the Subcommittee on Aviation. (,Introduced,https://www.congress.gov/bill/117th-congress/house-bill/4926?q=%7B%22search%22%3A%5B%22actionDate%3A%5C%22117%7C2021-08-03%5C%22+AND+%28billIsReserved%3A%5C%22N%5C%22+OR+type%3A%5C%22AMENDMENT%5C%22%29%22%5D%7D&s=1&r=26
08/04/2021,BILL,Protecting Indian Tribes from Scams Act,"Sen. Lujan, Ben Ray [D-NM]"," Senate - Commerce, Science, and Transportation        ","Senate - 08/04/2021 Committee on Commerce, Science, and Transportation. Ordered to be reported with an amendment in the nature of a substitute favorably. (",Introduced,https://www.congress.gov/bill/117th-congress/senate-bill/1880?q=%7B%22search%22%3A%5B%22actionDate%3A%5C%22117%7C2021-08-04%5C%22+AND+%28billIsReserved%3A%5C%22N%5C%22+OR+type%3A%5C%22AMENDMENT%5C%22%29%22%5D%7D&s=1&r=21
08/04/2021,BILL,Minority Business Development Act of 2021,"Sen. Cardin, Benjamin L. [D-MD]"," Senate - Commerce, Science, and Transportation        ","Senate - 08/04/2021 Committee on Commerce, Science, and Transportation. Ordered to be reported with an amendment in the nature of a substitute favorably. (",Introduced,https://www.congress.gov/bill/117th-congress/senate-bill/2068?q=%7B%22search%22%3A%5B%22actionDate%3A%5C%22117%7C2021-08-04%5C%22+AND+%28billIsReserved%3A%5C%22N%5C%22+OR+type%3A%5C%22AMENDMENT%5C%22%29%22%5D%7D&s=1&r=22
08/04/2021,BILL,CADETS Act,"Sen. Peters, Gary C. [D-MI]"," Senate - Commerce, Science, and Transportation        ","Senate - 08/04/2021 Committee on Commerce, Science, and Transportation. Ordered to be reported without amendment favorably. (",Introduced,https://www.congress.gov/bill/117th-congress/senate-bill/2299?q=%7B%22search%22%3A%5B%22actionDate%3A%5C%22117%7C2021-08-04%5C%22+AND+%28billIsReserved%3A%5C%22N%5C%22+OR+type%3A%5C%22AMENDMENT%5C%22%29%22%5D%7D&s=1&r=23
08/04/2021,BILL,Cybersecurity Opportunity Act,"Sen. Ossoff, Jon [D-GA]", Senate - Homeland Security and Governmental Affairs        ,Senate - 08/04/2021 Committee on Homeland Security and Governmental Affairs. Ordered to be reported with an amendment in the nature of a substitute favorably. (,Introduced,https://www.congress.gov/bill/117th-congress/senate-bill/2305?q=%7B%22search%22%3A%5B%22actionDate%3A%5C%22117%7C2021-08-04%5C%22+AND+%28billIsReserved%3A%5C%22N%5C%22+OR+type%3A%5C%22AMENDMENT%5C%22%29%22%5D%7D&s=1&r=24
08/04/2021,BILL,Restoring Brand USA Act,"Sen. Klobuchar, Amy [D-MN]"," Senate - Commerce, Science, and Transportation        ","Senate - 08/04/2021 Committee on Commerce, Science, and Transportation. Ordered to be reported with an amendment favorably. (",Introduced,https://www.congress.gov/bill/117th-congress/senate-bill/2424?q=%7B%22search%22%3A%5B%22actionDate%3A%5C%22117%7C2021-08-04%5C%22+AND+%28billIsReserved%3A%5C%22N%5C%22+OR+type%3A%5C%22AMENDMENT%5C%22%29%22%5D%7D&s=1&r=25
