date,type,title,sponsor,committees,latest_action,tracker,url
10/27/2021,BILL,Native American Child Protection Act,"Rep. Gallego, Ruben [D-AZ-7]", House - Natural Resources | Senate - Indian Affairs        ,Senate - 10/27/2021 Committee on Indian Affairs. Ordered to be reported without amendment favorably. (,Passed House,https://www.congress.gov/bill/117th-congress/house-bill/1688?q=%7B%22search%22%3A%5B%22actionDate%3A%5C%22117%7C2021-10-27%5C%22+AND+%28billIsReserved%3A%5C%22N%5C%22+OR+type%3A%5C%22AMENDMENT%5C%22%29%22%2C%22%5C%22117%7C2021-10-27%5C%22%22%5D%7D&s=1&r=1
10/25/2021,BILL,Financial Exploitation Prevention Act of 2021,"Rep. Wagner, Ann [R-MO-2]"," House - Financial Services | Senate - Banking, Housing, and Urban Affairs        ","Senate - 10/26/2021 Received in the Senate and Read twice and referred to the Committee on Banking, Housing, and Urban Affairs. (",Passed House,https://www.congress.gov/bill/117th-congress/house-bill/2265?q=%7B%22search%22%3A%5B%22actionDate%3A%5C%22117%7C2021-10-25%5C%22+AND+%28billIsReserved%3A%5C%22N%5C%22+OR+type%3A%5C%22AMENDMENT%5C%22%29%22%2C%22%5C%22117%7C2021-10-25%5C%22%22%5D%7D&s=1&r=1
10/28/2021,BILL,YALI Act of 2021,"Rep. Bass, Karen [D-CA-37]", House - Foreign Affairs | Senate - Foreign Relations        ,Senate - 10/28/2021 Placed on Senate Legislative Calendar under General Orders. Calendar No. 161. (,Passed House,https://www.congress.gov/bill/117th-congress/house-bill/965?q=%7B%22search%22%3A%5B%22actionDate%3A%5C%22117%7C2021-10-28%5C%22+AND+%28billIsReserved%3A%5C%22N%5C%22+OR+type%3A%5C%22AMENDMENT%5C%22%29%22%2C%22%5C%22117%7C2021-10-28%5C%22%22%5D%7D&s=1&r=1
10/27/2021,BILL,Ensuring Compliance Against Drug Diversion Act of 2021,"Rep. Griffith, H. Morgan [R-VA-9]", House - Energy and Commerce; Judiciary; Budget | Senate - Judiciary        ,Senate - 10/27/2021 Message on Senate action sent to the House. (,Passed Senate,https://www.congress.gov/bill/117th-congress/house-bill/1899?q=%7B%22search%22%3A%5B%22actionDate%3A%5C%22117%7C2021-10-27%5C%22+AND+%28billIsReserved%3A%5C%22N%5C%22+OR+type%3A%5C%22AMENDMENT%5C%22%29%22%2C%22%5C%22117%7C2021-10-27%5C%22%22%5D%7D&s=1&r=2
10/27/2021,BILL,Family Violence Prevention and Services Improvement Act of 2021,"Rep. McBath, Lucy [D-GA-6]", House - Education and Labor        ,Senate - 10/27/2021 Received in the Senate. Read twice. Placed on Senate Legislative Calendar under General Orders. Calendar No. 156. (,Passed House,https://www.congress.gov/bill/117th-congress/house-bill/2119?q=%7B%22search%22%3A%5B%22actionDate%3A%5C%22117%7C2021-10-27%5C%22+AND+%28billIsReserved%3A%5C%22N%5C%22+OR+type%3A%5C%22AMENDMENT%5C%22%29%22%2C%22%5C%22117%7C2021-10-27%5C%22%22%5D%7D&s=1&r=3
10/27/2021,BILL,Real Justice for Our Veterans Act of 2021,"Rep. Jackson Lee, Sheila [D-TX-18]", House - Judiciary | Senate - Judiciary        ,Senate - 10/28/2021 Received in the Senate and Read twice and referred to the Committee on the Judiciary. (,Passed House,https://www.congress.gov/bill/117th-congress/house-bill/4035?q=%7B%22search%22%3A%5B%22actionDate%3A%5C%22117%7C2021-10-27%5C%22+AND+%28billIsReserved%3A%5C%22N%5C%22+OR+type%3A%5C%22AMENDMENT%5C%22%29%22%2C%22%5C%22117%7C2021-10-27%5C%22%22%5D%7D&s=1&r=4
10/27/2021,BILL,Continued State Flexibility To Assist Older Foster Youth Act,"Rep. Davis, Danny K. [D-IL-7]", House - Ways and Means        ,Senate - 10/28/2021 Received in the Senate. (,Passed House,https://www.congress.gov/bill/117th-congress/house-bill/5661?q=%7B%22search%22%3A%5B%22actionDate%3A%5C%22117%7C2021-10-27%5C%22+AND+%28billIsReserved%3A%5C%22N%5C%22+OR+type%3A%5C%22AMENDMENT%5C%22%29%22%2C%22%5C%22117%7C2021-10-27%5C%22%22%5D%7D&s=1&r=5
10/27/2021,BILL,"To clarify Medicare coverage for COVID-19 testing and to provide support for cellular immune response research for COVID-19, and for other purposes.","Rep. Dunn, Neal P. [R-FL-2]", House - Energy and Commerce; Ways and Means        ,"House - 10/27/2021 Referred to the Committee on Energy and Commerce, and in addition to the Committee on Ways and Means, for a period to be subsequently determined by the Speaker, in each case for consideration of such provisions as fall within the jurisdiction of the committee... (",Introduced,https://www.congress.gov/bill/117th-congress/house-bill/5745?q=%7B%22search%22%3A%5B%22actionDate%3A%5C%22117%7C2021-10-27%5C%22+AND+%28billIsReserved%3A%5C%22N%5C%22+OR+type%3A%5C%22AMENDMENT%5C%22%29%22%2C%22%5C%22117%7C2021-10-27%5C%22%22%5D%7D&s=1&r=6
10/27/2021,BILL,"To amend title 51, United States Code, to extend the authority of the National Aeronautics and Space Administration to enter into leases of non-excess property of the Administration.","Rep. Beyer, Donald S., Jr. [D-VA-8]"," House - Science, Space, and Technology        ","House - 10/27/2021 Referred to the House Committee on Science, Space, and Technology. (",Introduced,https://www.congress.gov/bill/117th-congress/house-bill/5746?q=%7B%22search%22%3A%5B%22actionDate%3A%5C%22117%7C2021-10-27%5C%22+AND+%28billIsReserved%3A%5C%22N%5C%22+OR+type%3A%5C%22AMENDMENT%5C%22%29%22%2C%22%5C%22117%7C2021-10-27%5C%22%22%5D%7D&s=1&r=7
10/27/2021,BILL,To amend the Internal Revenue Code of 1986 to include certain over-the-counter dietary supplement products as qualified medical expenses.,"Rep. Boyle, Brendan F. [D-PA-2]", House - Ways and Means        ,House - 10/27/2021 Referred to the House Committee on Ways and Means. (,Introduced,https://www.congress.gov/bill/117th-congress/house-bill/5747?q=%7B%22search%22%3A%5B%22actionDate%3A%5C%22117%7C2021-10-27%5C%22+AND+%28billIsReserved%3A%5C%22N%5C%22+OR+type%3A%5C%22AMENDMENT%5C%22%29%22%2C%22%5C%22117%7C2021-10-27%5C%22%22%5D%7D&s=1&r=8
10/27/2021,BILL,"To require the Secretary of Defense to establish a program to carry out minor military construction projects to construct child development centers and to provide education and treatment services for infant and early childhood mental health, and for other purposes.","Rep. Carbajal, Salud O. [D-CA-24]", House - Armed Services        ,House - 10/27/2021 Referred to the House Committee on Armed Services. (,Introduced,https://www.congress.gov/bill/117th-congress/house-bill/5748?q=%7B%22search%22%3A%5B%22actionDate%3A%5C%22117%7C2021-10-27%5C%22+AND+%28billIsReserved%3A%5C%22N%5C%22+OR+type%3A%5C%22AMENDMENT%5C%22%29%22%2C%22%5C%22117%7C2021-10-27%5C%22%22%5D%7D&s=1&r=9
10/27/2021,BILL,To impose natural gas trading limits during emergencies.,"Rep. Castro, Joaquin [D-TX-20]", House - Agriculture        ,House - 10/27/2021 Referred to the House Committee on Agriculture. (,Introduced,https://www.congress.gov/bill/117th-congress/house-bill/5749?q=%7B%22search%22%3A%5B%22actionDate%3A%5C%22117%7C2021-10-27%5C%22+AND+%28billIsReserved%3A%5C%22N%5C%22+OR+type%3A%5C%22AMENDMENT%5C%22%29%22%2C%22%5C%22117%7C2021-10-27%5C%22%22%5D%7D&s=1&r=10
10/27/2021,BILL,"To amend the Public Health Service Act to authorize certain grants (for youth suicide early intervention and prevention strategies) to be used for school personnel in elementary and secondary schools and students in secondary schools to receive student suicide awareness and prevention training, and for other purposes.","Rep. Cleaver, Emanuel [D-MO-5]", House - Energy and Commerce; Education and Labor        ,"House - 10/27/2021 Referred to the Committee on Energy and Commerce, and in addition to the Committee on Education and Labor, for a period to be subsequently determined by the Speaker, in each case for consideration of such provisions as fall within the jurisdiction of the committee... (",Introduced,https://www.congress.gov/bill/117th-congress/house-bill/5750?q=%7B%22search%22%3A%5B%22actionDate%3A%5C%22117%7C2021-10-27%5C%22+AND+%28billIsReserved%3A%5C%22N%5C%22+OR+type%3A%5C%22AMENDMENT%5C%22%29%22%2C%22%5C%22117%7C2021-10-27%5C%22%22%5D%7D&s=1&r=11
10/27/2021,BILL,"To amend title 49, United States Code, to prohibit Amtrak from including mandatory arbitration clauses in contracts of carriage, and for other purposes.","Rep. Lamb, Conor [D-PA-17]", House - Transportation and Infrastructure        ,House - 10/27/2021 Referred to the House Committee on Transportation and Infrastructure. (,Introduced,https://www.congress.gov/bill/117th-congress/house-bill/5751?q=%7B%22search%22%3A%5B%22actionDate%3A%5C%22117%7C2021-10-27%5C%22+AND+%28billIsReserved%3A%5C%22N%5C%22+OR+type%3A%5C%22AMENDMENT%5C%22%29%22%2C%22%5C%22117%7C2021-10-27%5C%22%22%5D%7D&s=1&r=12
10/25/2021,BILL,Fire Fauci Act,"Rep. Greene, Marjorie Taylor [R-GA-14]", House - Energy and Commerce        ,House - 10/25/2021 Motion to Discharge Committee filed by Mrs. Greene (GA). Petition No: 117-7. (,Introduced,https://www.congress.gov/bill/117th-congress/house-bill/2316?q=%7B%22search%22%3A%5B%22actionDate%3A%5C%22117%7C2021-10-25%5C%22+AND+%28billIsReserved%3A%5C%22N%5C%22+OR+type%3A%5C%22AMENDMENT%5C%22%29%22%2C%22%5C%22117%7C2021-10-25%5C%22%22%5D%7D&s=1&r=2
10/25/2021,BILL,Financial Transparency Act of 2021,"Rep. Maloney, Carolyn B. [D-NY-12]"," House - Financial Services; Agriculture | Senate - Banking, Housing, and Urban Affairs        ","Senate - 10/26/2021 Received in the Senate and Read twice and referred to the Committee on Banking, Housing, and Urban Affairs. (",Passed House,https://www.congress.gov/bill/117th-congress/house-bill/2989?q=%7B%22search%22%3A%5B%22actionDate%3A%5C%22117%7C2021-10-25%5C%22+AND+%28billIsReserved%3A%5C%22N%5C%22+OR+type%3A%5C%22AMENDMENT%5C%22%29%22%2C%22%5C%22117%7C2021-10-25%5C%22%22%5D%7D&s=1&r=3
10/25/2021,BILL,PUMP for Nursing Mothers Act,"Rep. Maloney, Carolyn B. [D-NY-12]", House - Education and Labor        ,Senate - 10/26/2021 Read twice. Placed on Senate Legislative Calendar under General Orders. Calendar No. 155. (,Passed House,https://www.congress.gov/bill/117th-congress/house-bill/3110?q=%7B%22search%22%3A%5B%22actionDate%3A%5C%22117%7C2021-10-25%5C%22+AND+%28billIsReserved%3A%5C%22N%5C%22+OR+type%3A%5C%22AMENDMENT%5C%22%29%22%2C%22%5C%22117%7C2021-10-25%5C%22%22%5D%7D&s=1&r=4
10/25/2021,BILL,Real Justice for Our Veterans Act of 2021,"Rep. Jackson Lee, Sheila [D-TX-18]", House - Judiciary | Senate - Judiciary        ,Senate - 10/28/2021 Received in the Senate and Read twice and referred to the Committee on the Judiciary. (,Passed House,https://www.congress.gov/bill/117th-congress/house-bill/4035?q=%7B%22search%22%3A%5B%22actionDate%3A%5C%22117%7C2021-10-25%5C%22+AND+%28billIsReserved%3A%5C%22N%5C%22+OR+type%3A%5C%22AMENDMENT%5C%22%29%22%2C%22%5C%22117%7C2021-10-25%5C%22%22%5D%7D&s=1&r=5
10/25/2021,BILL,Sovereign Debt Contract Capacity Act,"Rep. Waters, Maxine [D-CA-43]", House - Financial Services | Senate - Foreign Relations        ,Senate - 10/26/2021 Received in the Senate and Read twice and referred to the Committee on Foreign Relations. (,Passed House,https://www.congress.gov/bill/117th-congress/house-bill/4111?q=%7B%22search%22%3A%5B%22actionDate%3A%5C%22117%7C2021-10-25%5C%22+AND+%28billIsReserved%3A%5C%22N%5C%22+OR+type%3A%5C%22AMENDMENT%5C%22%29%22%2C%22%5C%22117%7C2021-10-25%5C%22%22%5D%7D&s=1&r=6
10/25/2021,BILL,"To award posthumously a Congressional Gold Medal, in commemoration to the servicemembers who perished in Afghanistan on August 26, 2021, during the evacuation of citizens of the United States and Afghan allies at Hamid Karzai International Airport, and for other purposes.","Rep. McClain, Lisa C. [R-MI-10]", House - Financial Services; House Administration        ,Senate - 10/26/2021 Received in the Senate. (,Passed House,https://www.congress.gov/bill/117th-congress/house-bill/5142?q=%7B%22search%22%3A%5B%22actionDate%3A%5C%22117%7C2021-10-25%5C%22+AND+%28billIsReserved%3A%5C%22N%5C%22+OR+type%3A%5C%22AMENDMENT%5C%22%29%22%2C%22%5C%22117%7C2021-10-25%5C%22%22%5D%7D&s=1&r=7
10/25/2021,BILL,CBP Donations Acceptance Program Reauthorization Act,"Rep. Barragan, Nanette Diaz [D-CA-44]", House - Homeland Security; Ways and Means; Transportation and Infrastructure        ,House - 10/26/2021 Ordered to be Reported by Voice Vote. (,Introduced,https://www.congress.gov/bill/117th-congress/house-bill/5682?q=%7B%22search%22%3A%5B%22actionDate%3A%5C%22117%7C2021-10-25%5C%22+AND+%28billIsReserved%3A%5C%22N%5C%22+OR+type%3A%5C%22AMENDMENT%5C%22%29%22%2C%22%5C%22117%7C2021-10-25%5C%22%22%5D%7D&s=1&r=8
10/25/2021,BILL,"To establish the People-Centered Assistance Reform Effort Commission, to improve the social safety net and increase social mobility by increasing access to resources which address the underlying causes of poverty.","Rep. Davidson, Warren [R-OH-8]", House - Ways and Means; Education and Labor; Agriculture; Energy and Commerce; Financial Services; Transportation and Infrastructure; Rules; Judiciary; Natural Resources        ,"House - 10/25/2021 Referred to the Subcommittee on Railroads, Pipelines, and Hazardous Materials. (",Introduced,https://www.congress.gov/bill/117th-congress/house-bill/5688?q=%7B%22search%22%3A%5B%22actionDate%3A%5C%22117%7C2021-10-25%5C%22+AND+%28billIsReserved%3A%5C%22N%5C%22+OR+type%3A%5C%22AMENDMENT%5C%22%29%22%2C%22%5C%22117%7C2021-10-25%5C%22%22%5D%7D&s=1&r=9
10/25/2021,BILL,Resilient AMERICA Act,"Rep. DeFazio, Peter A. [D-OR-4]", House - Transportation and Infrastructure        ,"House - 10/25/2021 Referred to the Subcommittee on Economic Development, Public Buildings, and Emergency Management. (",Introduced,https://www.congress.gov/bill/117th-congress/house-bill/5689?q=%7B%22search%22%3A%5B%22actionDate%3A%5C%22117%7C2021-10-25%5C%22+AND+%28billIsReserved%3A%5C%22N%5C%22+OR+type%3A%5C%22AMENDMENT%5C%22%29%22%2C%22%5C%22117%7C2021-10-25%5C%22%22%5D%7D&s=1&r=10
10/25/2021,BILL,Stop the Spread of Invasive Mussels Act of 2021,"Rep. Garamendi, John [D-CA-3]", House - Transportation and Infrastructure; Natural Resources        ,House - 10/25/2021 Referred to the Subcommittee on Water Resources and Environment. (,Introduced,https://www.congress.gov/bill/117th-congress/house-bill/5692?q=%7B%22search%22%3A%5B%22actionDate%3A%5C%22117%7C2021-10-25%5C%22+AND+%28billIsReserved%3A%5C%22N%5C%22+OR+type%3A%5C%22AMENDMENT%5C%22%29%22%2C%22%5C%22117%7C2021-10-25%5C%22%22%5D%7D&s=1&r=11
10/25/2021,BILL,Post-Disaster Mental Health Response Act,"Rep. Pressley, Ayanna [D-MA-7]", House - Transportation and Infrastructure        ,"House - 10/25/2021 Referred to the Subcommittee on Economic Development, Public Buildings, and Emergency Management. (",Introduced,https://www.congress.gov/bill/117th-congress/house-bill/5703?q=%7B%22search%22%3A%5B%22actionDate%3A%5C%22117%7C2021-10-25%5C%22+AND+%28billIsReserved%3A%5C%22N%5C%22+OR+type%3A%5C%22AMENDMENT%5C%22%29%22%2C%22%5C%22117%7C2021-10-25%5C%22%22%5D%7D&s=1&r=12
10/28/2021,BILL,VA Transparency & Trust Act of 2021,"Rep. Bost, Mike [R-IL-12]", House - Veterans' Affairs | Senate - Veterans' Affairs        ,Senate - 10/28/2021 Message on Senate action sent to the House. (,Passed Senate,https://www.congress.gov/bill/117th-congress/house-bill/2911?q=%7B%22search%22%3A%5B%22actionDate%3A%5C%22117%7C2021-10-28%5C%22+AND+%28billIsReserved%3A%5C%22N%5C%22+OR+type%3A%5C%22AMENDMENT%5C%22%29%22%2C%22%5C%22117%7C2021-10-28%5C%22%22%5D%7D&s=1&r=2
10/28/2021,BILL,"To name the Department of Veterans Affairs community-based outpatient clinic in Columbus, Georgia, as the ""Robert S. Poydasheff VA Clinic"".","Rep. Bishop, Sanford D., Jr. [D-GA-2]", House - Veterans' Affairs | Senate - Veterans' Affairs        ,Senate - 10/28/2021 Message on Senate action sent to the House. (,Passed Senate,https://www.congress.gov/bill/117th-congress/house-bill/3475?q=%7B%22search%22%3A%5B%22actionDate%3A%5C%22117%7C2021-10-28%5C%22+AND+%28billIsReserved%3A%5C%22N%5C%22+OR+type%3A%5C%22AMENDMENT%5C%22%29%22%2C%22%5C%22117%7C2021-10-28%5C%22%22%5D%7D&s=1&r=3
10/28/2021,BILL,Secure Equipment Act of 2021,"Rep. Scalise, Steve [R-LA-1]", House - Energy and Commerce        ,Senate - 10/28/2021 Message on Senate action sent to the House. (,Passed Senate,https://www.congress.gov/bill/117th-congress/house-bill/3919?q=%7B%22search%22%3A%5B%22actionDate%3A%5C%22117%7C2021-10-28%5C%22+AND+%28billIsReserved%3A%5C%22N%5C%22+OR+type%3A%5C%22AMENDMENT%5C%22%29%22%2C%22%5C%22117%7C2021-10-28%5C%22%22%5D%7D&s=1&r=4
10/28/2021,BILL,Real Justice for Our Veterans Act of 2021,"Rep. Jackson Lee, Sheila [D-TX-18]", House - Judiciary | Senate - Judiciary        ,Senate - 10/28/2021 Received in the Senate and Read twice and referred to the Committee on the Judiciary. (,Passed House,https://www.congress.gov/bill/117th-congress/house-bill/4035?q=%7B%22search%22%3A%5B%22actionDate%3A%5C%22117%7C2021-10-28%5C%22+AND+%28billIsReserved%3A%5C%22N%5C%22+OR+type%3A%5C%22AMENDMENT%5C%22%29%22%2C%22%5C%22117%7C2021-10-28%5C%22%22%5D%7D&s=1&r=5
10/28/2021,BILL,"To name the Department of Veterans Affairs community-based outpatient clinic in Aurora, Colorado, as the ""Lieutenant Colonel John W. Mosley VA Clinic"".","Rep. Crow, Jason [D-CO-6]", House - Veterans' Affairs | Senate - Veterans' Affairs        ,Senate - 10/28/2021 Message on Senate action sent to the House. (,Passed Senate,https://www.congress.gov/bill/117th-congress/house-bill/4172?q=%7B%22search%22%3A%5B%22actionDate%3A%5C%22117%7C2021-10-28%5C%22+AND+%28billIsReserved%3A%5C%22N%5C%22+OR+type%3A%5C%22AMENDMENT%5C%22%29%22%2C%22%5C%22117%7C2021-10-28%5C%22%22%5D%7D&s=1&r=6
10/28/2021,BILL,Broadband Internet Connections for Rural America Act,"Rep. Scott, David [D-GA-13]", House - Agriculture; Energy and Commerce        ,"House - 10/28/2021 House Committee on Energy and Commerce Granted an extension for further consideration ending not later than Nov. 5, 2021. (",Introduced,https://www.congress.gov/bill/117th-congress/house-bill/4374?q=%7B%22search%22%3A%5B%22actionDate%3A%5C%22117%7C2021-10-28%5C%22+AND+%28billIsReserved%3A%5C%22N%5C%22+OR+type%3A%5C%22AMENDMENT%5C%22%29%22%2C%22%5C%22117%7C2021-10-28%5C%22%22%5D%7D&s=1&r=7
10/28/2021,BILL,Intelligence Authorization Act for Fiscal Year 2022,"Rep. Schiff, Adam B. [D-CA-28]", House - Intelligence (Permanent Select)        ,"House - 10/28/2021 Placed on the Union Calendar, Calendar No. 114. (",Introduced,https://www.congress.gov/bill/117th-congress/house-bill/5412?q=%7B%22search%22%3A%5B%22actionDate%3A%5C%22117%7C2021-10-28%5C%22+AND+%28billIsReserved%3A%5C%22N%5C%22+OR+type%3A%5C%22AMENDMENT%5C%22%29%22%2C%22%5C%22117%7C2021-10-28%5C%22%22%5D%7D&s=1&r=8
10/28/2021,BILL,Continued State Flexibility To Assist Older Foster Youth Act,"Rep. Davis, Danny K. [D-IL-7]", House - Ways and Means        ,Senate - 10/28/2021 Received in the Senate. (,Passed House,https://www.congress.gov/bill/117th-congress/house-bill/5661?q=%7B%22search%22%3A%5B%22actionDate%3A%5C%22117%7C2021-10-28%5C%22+AND+%28billIsReserved%3A%5C%22N%5C%22+OR+type%3A%5C%22AMENDMENT%5C%22%29%22%2C%22%5C%22117%7C2021-10-28%5C%22%22%5D%7D&s=1&r=9
10/28/2021,BILL,Further Surface Transportation Extension Act of 2021,"Rep. DeFazio, Peter A. [D-OR-4]"," House - Transportation and Infrastructure; Ways and Means; Natural Resources; Science, Space, and Technology; Energy and Commerce; Oversight and Reform        ",Senate - 10/28/2021 Message on Senate action sent to the House. (,Passed Senate,https://www.congress.gov/bill/117th-congress/house-bill/5763?q=%7B%22search%22%3A%5B%22actionDate%3A%5C%22117%7C2021-10-28%5C%22+AND+%28billIsReserved%3A%5C%22N%5C%22+OR+type%3A%5C%22AMENDMENT%5C%22%29%22%2C%22%5C%22117%7C2021-10-28%5C%22%22%5D%7D&s=1&r=10
10/28/2021,BILL,"To require the Financial Crimes Enforcement Network to issue an advisory about how homegrown violent extremists and other perpetrators of domestic terrorism procure firearms and firearm accessories, and for other purposes.","Rep. Dean, Madeleine [D-PA-4]", House - Financial Services        ,House - 10/28/2021 Referred to the House Committee on Financial Services. (,Introduced,https://www.congress.gov/bill/117th-congress/house-bill/5764?q=%7B%22search%22%3A%5B%22actionDate%3A%5C%22117%7C2021-10-28%5C%22+AND+%28billIsReserved%3A%5C%22N%5C%22+OR+type%3A%5C%22AMENDMENT%5C%22%29%22%2C%22%5C%22117%7C2021-10-28%5C%22%22%5D%7D&s=1&r=11
10/28/2021,BILL,"To prohibit the use of Federal funds for funeral expenses related to COVID-19, and for other purposes.","Rep. Boebert, Lauren [R-CO-3]", House - Transportation and Infrastructure        ,House - 10/28/2021 Referred to the House Committee on Transportation and Infrastructure. (,Introduced,https://www.congress.gov/bill/117th-congress/house-bill/5765?q=%7B%22search%22%3A%5B%22actionDate%3A%5C%22117%7C2021-10-28%5C%22+AND+%28billIsReserved%3A%5C%22N%5C%22+OR+type%3A%5C%22AMENDMENT%5C%22%29%22%2C%22%5C%22117%7C2021-10-28%5C%22%22%5D%7D&s=1&r=12
10/27/2021,BILL,"To amend the Servicemembers Civil Relief Act to authorize the termination of a telephone, multichannel video programming, or internet access service contract by a servicemember who enters into such contract after receiving military orders for permanent change of station but then receives a stop movement order due to an emergency situation.","Rep. Levin, Mike [D-CA-49]", House - Veterans' Affairs        ,House - 10/27/2021 Referred to the House Committee on Veterans' Affairs. (,Introduced,https://www.congress.gov/bill/117th-congress/house-bill/5752?q=%7B%22search%22%3A%5B%22actionDate%3A%5C%22117%7C2021-10-27%5C%22+AND+%28billIsReserved%3A%5C%22N%5C%22+OR+type%3A%5C%22AMENDMENT%5C%22%29%22%2C%22%5C%22117%7C2021-10-27%5C%22%22%5D%7D&s=1&r=13
10/27/2021,BILL,"To assist in the transition of a certain hospital to a Medicare rural emergency hospital, and for other purposes.","Rep. Lucas, Frank D. [R-OK-3]", House - Ways and Means; Energy and Commerce        ,"House - 10/27/2021 Referred to the Committee on Ways and Means, and in addition to the Committee on Energy and Commerce, for a period to be subsequently determined by the Speaker, in each case for consideration of such provisions as fall within the jurisdiction of the committee... (",Introduced,https://www.congress.gov/bill/117th-congress/house-bill/5753?q=%7B%22search%22%3A%5B%22actionDate%3A%5C%22117%7C2021-10-27%5C%22+AND+%28billIsReserved%3A%5C%22N%5C%22+OR+type%3A%5C%22AMENDMENT%5C%22%29%22%2C%22%5C%22117%7C2021-10-27%5C%22%22%5D%7D&s=1&r=14
10/27/2021,BILL,"To amend title 38, United States Code, to improve the ability of veterans to electronically submit complaints about the delivery of health care services by the Department of Veterans Affairs.","Rep. McClain, Lisa C. [R-MI-10]", House - Veterans' Affairs        ,House - 10/27/2021 Referred to the House Committee on Veterans' Affairs. (,Introduced,https://www.congress.gov/bill/117th-congress/house-bill/5754?q=%7B%22search%22%3A%5B%22actionDate%3A%5C%22117%7C2021-10-27%5C%22+AND+%28billIsReserved%3A%5C%22N%5C%22+OR+type%3A%5C%22AMENDMENT%5C%22%29%22%2C%22%5C%22117%7C2021-10-27%5C%22%22%5D%7D&s=1&r=15
10/27/2021,BILL,"To amend title 38, United States Code, to improve the assignment of patient advocates at medical facilities of the Department of Veterans Affairs.","Rep. Moolenaar, John R. [R-MI-4]", House - Veterans' Affairs        ,House - 10/27/2021 Referred to the House Committee on Veterans' Affairs. (,Introduced,https://www.congress.gov/bill/117th-congress/house-bill/5755?q=%7B%22search%22%3A%5B%22actionDate%3A%5C%22117%7C2021-10-27%5C%22+AND+%28billIsReserved%3A%5C%22N%5C%22+OR+type%3A%5C%22AMENDMENT%5C%22%29%22%2C%22%5C%22117%7C2021-10-27%5C%22%22%5D%7D&s=1&r=16
10/27/2021,BILL,"To amend the Financial Institutions Reform, Recovery, and Enforcement Act of 1989 to establish a Portal for Appraiser Credentialing and AMC Registration Information, and for other purposes.","Rep. Perlmutter, Ed [D-CO-7]", House - Financial Services        ,House - 10/27/2021 Referred to the House Committee on Financial Services. (,Introduced,https://www.congress.gov/bill/117th-congress/house-bill/5756?q=%7B%22search%22%3A%5B%22actionDate%3A%5C%22117%7C2021-10-27%5C%22+AND+%28billIsReserved%3A%5C%22N%5C%22+OR+type%3A%5C%22AMENDMENT%5C%22%29%22%2C%22%5C%22117%7C2021-10-27%5C%22%22%5D%7D&s=1&r=17
10/27/2021,BILL,"To amend title 10, United States Code, to provide for the award of a military service medal to members of the Armed Forces who served honorably during the Cold War, and for other purposes.","Rep. Pingree, Chellie [D-ME-1]", House - Armed Services        ,House - 10/27/2021 Referred to the House Committee on Armed Services. (,Introduced,https://www.congress.gov/bill/117th-congress/house-bill/5757?q=%7B%22search%22%3A%5B%22actionDate%3A%5C%22117%7C2021-10-27%5C%22+AND+%28billIsReserved%3A%5C%22N%5C%22+OR+type%3A%5C%22AMENDMENT%5C%22%29%22%2C%22%5C%22117%7C2021-10-27%5C%22%22%5D%7D&s=1&r=18
10/27/2021,BILL,"To amend title 10, United States Code, to authorize non-medical counseling services, provided by certain mental health professionals, to military families.","Rep. Slotkin, Elissa [D-MI-8]", House - Armed Services        ,House - 10/27/2021 Referred to the House Committee on Armed Services. (,Introduced,https://www.congress.gov/bill/117th-congress/house-bill/5758?q=%7B%22search%22%3A%5B%22actionDate%3A%5C%22117%7C2021-10-27%5C%22+AND+%28billIsReserved%3A%5C%22N%5C%22+OR+type%3A%5C%22AMENDMENT%5C%22%29%22%2C%22%5C%22117%7C2021-10-27%5C%22%22%5D%7D&s=1&r=19
10/27/2021,BILL,To include sexual assault and aggravated sexual violence in the definition of aggravated felonies under the Immigration and Nationality Act in order to expedite the removal of aliens convicted of such crimes.,"Rep. Stefanik, Elise M. [R-NY-21]", House - Judiciary        ,House - 10/27/2021 Referred to the House Committee on the Judiciary. (,Introduced,https://www.congress.gov/bill/117th-congress/house-bill/5759?q=%7B%22search%22%3A%5B%22actionDate%3A%5C%22117%7C2021-10-27%5C%22+AND+%28billIsReserved%3A%5C%22N%5C%22+OR+type%3A%5C%22AMENDMENT%5C%22%29%22%2C%22%5C%22117%7C2021-10-27%5C%22%22%5D%7D&s=1&r=20
