date,url,title
"March 30, 2022",https://www.fcc.gov/document/fcc-ntia-leaders-hold-inaugural-monthly-meeting,"FCC, NTIA Leaders Hold Inaugural Monthly Meeting"
"March 30, 2022",https://www.fcc.gov/document/fcc-announces-second-public-hearing-broadband-consumer-labels,FCC Announces Second Public Hearing On Broadband Consumer Labels
"March 28, 2022",https://www.fcc.gov/document/fcc-launches-new-robocall-investigation-partnerships-more-states,FCC Launches New Robocall Investigation Partnerships with More States
"March 28, 2022",https://www.fcc.gov/document/fcc-fy-2023-congressional-budget-justification,FCC FY 2023 Congressional Budget Justification
"March 25, 2022",https://www.fcc.gov/document/carr-welcomes-expansion-fccs-covered-list,Carr Welcomes Expansion of FCC's Covered List
"March 25, 2022",https://www.fcc.gov/document/fcc-expands-list-equipment-and-services-pose-security-threat,FCC Expands List of Equipment and Services That Pose Security Threat
"March 25, 2022",https://www.fcc.gov/document/fcc-cac-next-meeting-date-time-and-agenda,"FCC CAC Next Meeting Date, Time, and Agenda"
"March 25, 2022",https://www.fcc.gov/document/fcc-announces-313-million-through-rural-digital-opportunity-fund,FCC Announces $313 Million Through Rural Digital Opportunity Fund
