date,url,title
"November 5, 2021",https://www.fcc.gov/document/carr-backs-bill-supporting-uncensored-internet-abroad,Carr Backs Bill Supporting Uncensored Internet Abroad
"November 5, 2021",https://www.fcc.gov/document/fcc-seeks-comment-atsc-30-multicast-requirements,FCC Seeks Comment on ATSC 3.0 Multicast Requirements
"November 3, 2021",https://www.fcc.gov/document/commissioner-simington-addresses-apcos-emerging-technology-forum,Commissioner Simington Addresses APCO's Emerging Technology Forum
"November 3, 2021",https://www.fcc.gov/document/fcc-authorizes-boeing-broadband-satellite-constellation,FCC Authorizes Boeing Broadband Satellite Constellation
"November 2, 2021",https://www.fcc.gov/document/china-telecom-americas-order-revocation-and-termination,China Telecom Americas Order on Revocation and Termination
"November 2, 2021",https://www.fcc.gov/document/fcc-announces-equity-council-members-and-working-group-chairs,FCC Announces Equity Council Members and Working Group Chairs
