date,url,title
"December 14, 2021",https://www.fcc.gov/document/fcc-looks-promote-fair-open-competitive-bidding-e-rate-program,FCC Looks to Promote Fair & Open Competitive Bidding in E-Rate Program
"December 14, 2021",https://www.fcc.gov/document/fcc-moves-facilitate-satellite-broadband-competition,FCC Moves to Facilitate Satellite Broadband Competition
"December 14, 2021",https://www.fcc.gov/document/fcc-seeks-improve-accessibility-clarity-emergency-alerts,FCC Seeks to Improve Accessibility & Clarity of Emergency Alerts
"December 10, 2021",https://www.fcc.gov/document/fcc-seeks-nominations-telecommunications-interagency-working-group,FCC Seeks Nominations for Telecommunications Interagency Working Group
"December 10, 2021",https://www.fcc.gov/document/fcc-moves-small-provider-stirshaken-start-date-combat-robocalls-0,FCC Moves Up Small Provider STIR/SHAKEN Start Date to Combat Robocalls
"December 9, 2021",https://www.fcc.gov/document/chairwoman-announces-members-first-meeting-precision-ag-task-force,"Chairwoman Announces Members, First Meeting of Precision Ag Task Force"
"December 8, 2021",https://www.fcc.gov/document/carr-statement-introduction-robocall-trace-back-enhancement-act,Carr Statement on Introduction of Robocall Trace Back Enhancement Act
"December 8, 2021",https://www.fcc.gov/document/fcc-issues-further-guidance-affordable-connectivity-program,FCC Issues Further Guidance for Affordable Connectivity Program
"December 8, 2021",https://www.fcc.gov/document/fcc-announces-csric-viii-meeting-december-15,FCC Announces CSRIC VIII Meeting on December 15
