date,url,title
"January 12, 2022",https://www.fcc.gov/document/chair-rosenworcel-circulates-new-data-breach-reporting-requirements,Chair Rosenworcel Circulates New Data Breach Reporting Requirements
"January 12, 2022",https://www.fcc.gov/document/carr-holds-official-meeting-taiwan-regulators,Carr Holds Official Meeting with Taiwan Regulators
"January 11, 2022",https://www.fcc.gov/document/fcc-chair-statement-senate-confirmation-ntia-administrator,FCC Chair Statement on Senate Confirmation of NTIA Administrator
"January 10, 2022",https://www.fcc.gov/document/fcc-commits-over-361m-additional-emergency-connectivity-funding,FCC Commits Over $361M in Additional Emergency Connectivity Funding
"January 7, 2022",https://www.fcc.gov/document/chair-rosenworcel-debuts-affordable-connectivity-program-draft-rules,Chair Rosenworcel Debuts Affordable Connectivity Program Draft Rules
"January 6, 2022",https://www.fcc.gov/document/fcc-announces-tentative-agenda-january-open-meeting-9,FCC Announces Tentative Agenda for January Open Meeting
