date,Type,title,url,description
"November 22, 2021",Research,U.S.-China Trade War: Still Going Nowhere,https://chinaus-icas.org/research/u-s-china-trade-war-still-going-nowhere/,
"November 19, 2021",Research,A Vision of Action on Marine Plastic Debris in the Asia-Pacific,https://chinaus-icas.org/research/a-vision-of-action-on-marine-plastic-debris-in-the-asia-pacific/,
"November 16, 2021",Research,From Pragmatism to UNCLOS Purism,https://chinaus-icas.org/research/from-pragmatism-to-unclos-purism/,The Evolution of U.S. Paracel Islands Policy
"November 5, 2021",Research,The Other Side of the Polar Coin,https://chinaus-icas.org/research/the-other-side-of-the-polar-coin/,The Antarctic Maritime Tracker
"November 1, 2021",Issue Brief,China’s Regulatory Clampdown on Big Tech,https://chinaus-icas.org/research/chinas-regulatory-clampdown-on-big-tech/,Motivations and the American Response
"October 26, 2021",Commentary,,https://chinaus-icas.org/research/old-wine-in-new-bottle-bidens-emerging-china-trade-policy/,Old Wine in New Bottle: Biden’s Emerging China Trade Policy
