date,Type,title,url,description
"August 31, 2021",Research,Find a Happy Medium or Take Cheap Shots?: The Challenges of U.S.-China Cooperation in a Post-Withdrawal Afghanistan,https://chinaus-icas.org/research/find-a-happy-medium-or-take-cheap-shots/,
"August 28, 2021",Research,Australia’s ‘China-has-changed’ narrative doesn’t explain damagingly bad ties,https://chinaus-icas.org/research/australias-china-has-changed-narrative-doesnt-explain-damagingly-bad-ties/,
"August 24, 2021",Research,The Biden Administration’s Emerging Approach on Technology Controls,https://chinaus-icas.org/research/the-biden-administrations-emerging-approach-on-technology-controls/,What its Handling of Three Trump-era Executive Orders Say
"August 19, 2021",Research,Making Sense of the Debacle and Tragedy of Afghanistan,https://chinaus-icas.org/research/making-sense-of-the-debacle-and-tragedy-of-afghanistan/,
"August 10, 2021",Commentary,,https://chinaus-icas.org/research/dont-let-the-glitters-block-the-path/,Don’t Let the Glitters Block the Path
