category,date,title,url,summary
Press Release,09/23/2021,"Committee Approves Biden Nominations for CPSC, DOC",https://www.commerce.senate.gov/2021/9/committee-approves-biden-nominations-for-cpsc-doc,"WASHINGTON, D.C. – The U.S. Senate Committee on Commerce, Science, and Transportation approved the following three nominations, all of whom are now subject to approval by the full Senate."
Hearings,09/30/2021,"Protecting Kids Online: Facebook, Instagram, and Mental Health Harms",https://www.commerce.senate.gov/2021/9/protecting-kids-online-facebook-instagram-and-mental-health-harms," 
WASHINGTON, D.C. —U.S. Senator Richard Blumenthal, Chair of the Subcommittee on Consumer Protection, Product Safety, and Data Security will convene a hearing titled “Protecting Kids Online: Facebook, Instagram, and Mental Health Harms” at 10:30 a.m. on Thursday, September 30, 2021.  Children and teens face immense peer pressure and social expectations to broadcast their lives online. Recent Wall Street Journal investigations have revealed troubling insights regarding what Facebook knows about how Instagram affects young users, including their mental health. This hearing will cover Facebook’s research into the impact of its apps on young audiences, its actions to address threats to these users, and policy considerations to safeguard kids online. 
"
Hearings,09/29/2021,Protecting Consumer Privacy,https://www.commerce.senate.gov/2021/9/protecting-consumer-privacy,"WASHINGTON, D.C. —U.S. Senator Maria Cantwell (D-WA), Chair of the Senate Committee on Commerce, Science, and Transportation will convene a hearing titled “Protecting Consumer Privacy” at 10:00 a.m. on Wednesday, September 29, 2021. This hearing will examine how to better safeguard consumer privacy rights, including by equipping the Federal Trade Commission with the resources it needs to protect consumer privacy through the creation of a privacy bureau; and the need for a comprehensive federal privacy law. "
Hearings,09/22/2021,Executive Session and Nominations Hearing,https://www.commerce.senate.gov/2021/9/executive-session/0f0eaa42-fa90-4d98-af69-3c75e23c3cad,"WASHINGTON, D.C. — U.S. Senator Maria Cantwell (D-WA), Chair of the Senate Committee on Commerce, Science, and Transportation, will convene an executive session at 10:00 a.m. on Wednesday, September 22, 2021 to consider the presidential nominations of Alexander Hoehn-Saric to be a Commissioner and Chair of the Consumer Product Safety Commission (CPSC); Mary T. Boyle to be a Commissioner of the CPSC; Richard Trumka, Jr. to be a Commissioner of the CPSC; and Grant Harris to be Assistant Secretary for Industry and Analysis at the Department of Commerce."
Markups,09/22/2021,Executive Session and Nominations Hearing,https://www.commerce.senate.gov/2021/9/executive-session/0f0eaa42-fa90-4d98-af69-3c75e23c3cad,"WASHINGTON, D.C. — U.S. Senator Maria Cantwell (D-WA), Chair of the Senate Committee on Commerce, Science, and Transportation, will convene an executive session at 10:00 a.m. on Wednesday, September 22, 2021 to consider the presidential nominations of Alexander Hoehn-Saric to be a Commissioner and Chair of the Consumer Product Safety Commission (CPSC); Mary T. Boyle to be a Commissioner of the CPSC; Richard Trumka, Jr. to be a Commissioner of the CPSC; and Grant Harris to be Assistant Secretary for Industry and Analysis at the Department of Commerce."
