category,date,title,url,summary
Hearings,10/13/2021,"Commerce Committee Announces Subcommittee Hearing on Coast Guard Oversight on Tuesday, October 19, 2021 ",https://www.commerce.senate.gov/2021/10/commerce-committee-announces-subcommittee-hearing-on-coast-guard-oversight-on-tuesday-october-19-2021,"WASHINGTON, D.C. —  U.S. Senator Tammy Baldwin (D-WI), the Chair of the Senate Subcommittee on Oceans, Fisheries, Climate Change, and Manufacturing , will convene a hearing titled  “Coast Guard Oversight” at 2:30 p.m. on Tuesday, October 19, 2021. This hearing will examine the Coast Guard’s role to safeguard our nation’s maritime interests to include budget oversight, oil spill response, marine safety, handling of sexual assault and harassment in the service, and diversity, equity, and inclusion.

 "
Hearings,10/7/2021,State of Telehealth: Removing Barriers to Access and Improving Patient Outcomes,https://www.commerce.senate.gov/2021/10/state of telehealth: removing barriers to access and improving patient outcomes,"WASHINGTON, D.C. — U.S. Senator Ben Ray Luján (D-NM), the Chair of the Subcommittee on Communications, Media, and Broadband, will convene a hearing titled “State of Telehealth: Removing Barriers to Access and Improving Patient Outcomes” at 10:00 a.m. on Thursday, October 7, 2021. The hearing will examine the importance of access to telehealth services, the utilization and changes during the COVID-19 pandemic, the critical role of access to broadband in the public health response, and how to structure future deployment and policy to address the needs of underserved communities.  "
Press Release,10/13/2021,"Cantwell Demands Accountability From USMMA, Coast Guard, DOT Leaders Following Sexual Assault Allegations   ",https://www.commerce.senate.gov/2021/10/antwell-demands-accountability-from-usmma-coast-guard-dot-leaders-following-sexual-assault-allegations,"WASHINGTON, D.C. – Senator Maria Cantwell (D-WA), Chair of the Senate Committee on Commerce, Science, and Transportation which oversees federal maritime agencies sent a letter to Acting Administrator of the Maritime Administration (MARAD) Lucinda Lessley demanding answers regarding allegations of rape, sexual assault, and sexual harassment made by midshipmen at the U.S. Merchant Marine Academy (USMMA) as well as the response from leaders at MARAD. Senator Cantwell sent a copy of the letter to the Coast Guard, which has primary jurisdiction for investigating these incidents on the high seas. "
Press Release,10/12/2021,"Following Two Weeks of Hearings, Sen. Cantwell Calls on Facebook to Preserve Data, Documents Related to Testimony the Company Misled Public, Put Profits over Safety of Users   ",https://www.commerce.senate.gov/2021/10/llowing-two-weeks-of-hearings-sen-cantwell-calls-on-facebook-to-preserve-data-documents-related-to-testimony-the-company-misled-public-put-profits-over-safety-of-users,"SEATTLE, WA – U.S. Senator Maria Cantwell, Chair of the Committee on Commerce, Science, and Transportation called on Facebook CEO Mark Zuckerberg to preserve all documents, data, and electronic information related to testimony that the company misled the public about the harmful impact of its platforms on teenagers and children, and in spreading hate and divisive content."
