,question,Title,votenumber,yeas,nays,date,issue,result
270, . ,Motion to Waive All Applicable Budgetary Discipline Re: Sasse Amdt. No. 192; To establish a deficit-neutral reserve fund relating to improving health care to prohibit a health care practitioner from failing to exercise the proper degree of care in the case of a child who survives an abortion or attempted abortion.,00023,52,48,04-Feb,S.Con.Res. 5,Rejected
271, . ,Barrasso Amdt. No. 653; To establish a deficit-neutral reserve fund relating to supporting elementary and secondary schools in States with lost revenue due to the Federal moratorium on oil and natural gas leasing on public lands and offshore waters.,00022,98,2,04-Feb,S.Con.Res. 5,Agreed to
272, . ,Cardin Amdt. No. 716; To establish a deficit-neutral reserve fund relating to COVID-19 vaccine administration and a public awareness campaign.,00021,100,0,04-Feb,S.Con.Res. 5,Agreed to
273, . ,Toomey Amdt. No. 553; To establish a deficit-neutral reserve fund relating to ensuring that State and local law enforcement are permitted to cooperate with Federal officials to enforce Federal law.,00020,50,50,04-Feb,S.Con.Res. 5,Rejected
274, . ,"Manchin Amdt No. 775; To establish a deficit-neutral reserve fund relating to targeting economic impact payments to Americans who are suffering from the effects of COVID-19, including provisions to ensure upper-income taxpayers are not eligible.",00019,99,1,04-Feb,S.Con.Res. 5,Agreed to
275, . ,"Young Amdt No. 54; To establish a deficit-neutral reserve fund relating to preventing legislation that would allow illegal immigrants to receive Economic Impact Payments or any other similar direct, tax-based temporary financial assistance.",00018,58,42,04-Feb,S.Con.Res. 5,Agreed to
276, . ,Blunt Amdt. No. 48; To establish a deficit-neutral reserve fund relating to prohibiting the provision of COVID-19 related kindergarten through grade 12 emergency relief to schools that do not reopen for in-person learning after the teachers of such schools are vaccinated against COVID-19.,00017,50,50,04-Feb,S.Con.Res. 5,Rejected
277, . ,Rubio Amdt. No. 69; To establish a deficit-neutral reserve fund relating to prohibiting legislation that would increase taxes on small businesses during any period in which a national emergency has been declared with respect to a pandemic.,00016,100,0,04-Feb,S.Con.Res. 5,Agreed to
278, . ,Scott (SC) Amdt. No. 53; To establish a deficit-neutral reserve fund relating to ensuring the accurate reporting of COVID-19 related deaths of residents or staff at nursing homes.,00015,50,50,04-Feb,S.Con.Res. 5,Rejected
279, . ,Wicker Amdt No. 261; To establish a deficit-neutral reserve fund relating to establishing a fund to provide grants to food service and drinking establishments affected by the COVID-19 pandemic.,00014,90,10,04-Feb,S.Con.Res. 5,Agreed to
280,On the Motion to Proceed,Motion to Proceed to S. Con. Res. 5; A concurrent resolution setting forth the congressional budget for the United States Government for fiscal year 2021 and setting forth the appropriate budgetary levels for fiscal years 2022 through 2030.,00013,50,49,02-Feb,S.Con.Res. 5,Agreed to
281,On the Nomination,"Confirmation: Alejandro Nicholas Mayorkas, of the District of Columbia, to be Secretary of Homeland Security",00012,56,43,02-Feb,PN78-13,Confirmed
282,On the Nomination,"Confirmation: Peter Paul Montgomery Buttigieg, of Indiana, to be Secretary of Transportation",00011,86,13,02-Feb,PN78-4,Confirmed
283,On the Cloture Motion,Motion to Invoke Cloture: Alejandro Nicholas Mayorkas to be Secretary of the Department of Homeland Security,00010,55,42,28-Jan,PN78-13,Agreed to
284,On the Resolution,"S. Res. 16; A resolution to provide for related procedures concerning the article of impeachment against Donald John Trump, President of the United States.",00009,83,17,26-Jan,S.Res. 16,Agreed to
285,On the Motion to Table (Motion to Table: Is the Point of Order Well Taken?),Motion to Table: Is the Point of Order Well Taken?,00008,55,45,26-Jan,n/a,Agreed to
286,On the Nomination,"Confirmation: Antony John Blinken, of New York, to be Secretary of State",00007,78,22,26-Jan,PN78-3,Confirmed
287,On the Nomination,"Confirmation: Janet Louise Yellen, of California, to be Secretary of the Treasury",00006,84,15,25-Jan,PN78-24,Confirmed
288,On the Nomination,"Confirmation: Lloyd James Austin, of Georgia, to be Secretary of Defense",00005,93,2,22-Jan,PN78-1,Confirmed
289,On Passage of the Bill,"H.R. 335
; A bill to provide for an exception to a limitation against appointment of persons as Secretary of Defense within seven years of relief from active duty as a regular commissioned officer of the Armed Forces.",00004,69,27,21-Jan,H.R. 335,Passed
290,On the Nomination,"Confirmation: Avril Danica Haines, of New York, to be Director of National Intelligence",00003,84,10,20-Jan,PN78-10,Confirmed
291,"On the Objection (Shall the Objection Submitted by the Gentleman from Pennsylvania, Mr. Perry, and the Senator from Missouri, Mr. Hawley, Be Sustained?)","Shall the Objection Submitted by the Gentleman from Pennsylvania, Mr. Perry, and the Senator from Missouri, Mr. Hawley, Be Sustained?",00002,7,92,07-Jan,n/a,Not Sustained
292,"On the Objection (Shall the Objection Submitted by the Gentleman from Arizona, Mr. Gosar, and the Senator from Texas, Mr. Cruz, and Others Be Sustained?)","Shall the Objection Submitted by the Gentleman from Arizona, Mr. Gosar, and the Senator from Texas, Mr. Cruz, and Others Be Sustained?",00001,6,93,06-Jan,n/a,Not Sustained
293, . , . , . , . , . , . , . , 
