category,date,url,title
majority,11/18/21,https://www.finance.senate.gov/chairmans-news/wyden-statement-on-hhs-overturning-trump-era-waivers-allowing-for-taxpayer-funded-discrimination-in-child-welfare-and-reestablishing-nondiscrimination-policies-across-the-agency,Wyden statement on HHS overturning Trump-era waivers allowing for taxpayer-funded discrimination in child welfare and reestablishing nondiscrimination policies across the agency
hearings,11/17/21,https://www.finance.senate.gov/hearings/open-executive-session-to-consider-favorably-reporting-pending-nominations22,Open Executive Session to Consider Favorably Reporting Pending Nominations
majority,11/18/21,https://www.finance.senate.gov/chairmans-news/wyden-statement-on-revenue-from-increased-irs-enforcement-against-wealthy-tax-cheats,Wyden Statement on Revenue from Increased IRS Enforcement Against Wealthy Tax Cheats
minority,11/19/21,https://www.finance.senate.gov/ranking-members-news/crapo-americans-must-continue-to-reject-irs-bank-reporting-scheme,Crapo: Americans Must Continue to Reject IRS Bank Reporting Scheme
minority,11/17/21,https://www.finance.senate.gov/ranking-members-news/crapo-statement-at-executive-session-to-vote-on-treasury-ustr-and-hhs-nominees,"Crapo Statement at Executive Session to Vote on Treasury, USTR, and HHS Nominees"
