category,date,url,title
minority,08/11/21,https://www.finance.senate.gov/ranking-members-news/crapo-republicans-will-not-raise-debt-ceiling-to-fuel-reckless-spending,Crapo: Republicans will not Raise Debt Ceiling to Fuel Reckless Spending
minority,08/11/21,https://www.finance.senate.gov/ranking-members-news/reckless-tax-and-spending-spree-mortgages-americas-future,Reckless Tax and Spending Spree Mortgages America’s Future
minority,08/10/21,https://www.finance.senate.gov/ranking-members-news/crapo-grassley-question-irs-responsiveness-over-data-breach,"Crapo, Grassley Question IRS Responsiveness over Data Breach"
minority,08/10/21,https://www.finance.senate.gov/ranking-members-news/democrats-choose-big-government-over-americans-privacy,Democrats Choose Big Government over Americans’ Privacy
minority,08/10/21,https://www.finance.senate.gov/ranking-members-news/crapo-files-amendment-to-protect-americans-privacy-from-intrusive-irs-reporting-regime,Crapo Files Amendment to Protect Americans’ Privacy from Intrusive IRS Reporting Regime
majority,08/12/21,https://www.finance.senate.gov/chairmans-news/wyden-statement-on-the-presidents-call-for-medicare-drug-negotiation,Wyden Statement on the President’s Call for Medicare Drug Negotiation
majority,08/11/21,https://www.finance.senate.gov/chairmans-news/wyden-statement-on-dol-actions-to-modernize-ui-technology,Wyden Statement on DOL Actions to Modernize UI Technology
majority,08/10/21,https://www.finance.senate.gov/chairmans-news/wyden-casey-unveil-comprehensive-bill-to-improve-nursing-homes-for-residents-and-workers,"Wyden, Casey Unveil Comprehensive Bill to Improve Nursing Homes for Residents and Workers"
