category,date,url,title
minority,8/10/21,http://www.hsgac.senate.gov/media/minority-media/portman-sinema-king-hassan-romney-applaud-senate-passage-of-more-than-20-million-for-the-office-of-national-cyber-director-in-infrastructure-investment-and-jobs-act,"Portman, Sinema, King, Hassan, Romney Applaud Senate Passage of More Than $20 Million for the Office of National Cyber Director in Infrastructure Investment & Jobs Act"
minority,8/5/21,http://www.hsgac.senate.gov/media/minority-media/portman-questions-witnesses-on-role-of-federal-government-in-preventing-and-addressing-domestic-terrorism_violent-extremism,Portman Questions Witnesses on Role of Federal Government in Preventing & Addressing Domestic Terrorism & Violent Extremism
minority,8/5/21,http://www.hsgac.senate.gov/media/minority-media/portman-at-hearing-on-domestic-terrorism-and-violent-extremism-we-need-to-hear-from-biden-administration-about-what-they-are-doing-to-combat-these-threats,Portman at Hearing on Domestic Terrorism & Violent Extremism: We Need to Hear from Biden Administration About What They Are Doing to Combat These Threats
majority,8/10/21,http://www.hsgac.senate.gov/media/majority-media/peters-provisions-to-strengthen-cybersecurity-pass-senate-as-a-part-of-bipartisan-infrastructure-bill_-,Peters Provisions to Strengthen Cybersecurity Pass Senate as a Part of Bipartisan Infrastructure Bill
majority,8/10/21,http://www.hsgac.senate.gov/media/majority-media/peters-secures-500-million-to-help-michigan-communities-address-shoreline-erosion-and-flooding-in-senate-passed-bipartisan-infrastructure-bill,Peters Secures $500 Million to Help Michigan Communities Address Shoreline Erosion and Flooding in Senate-Passed Bipartisan Infrastructure Bill
hearings,8/05/21,http://www.hsgac.senate.gov/hearings/examining-the-threat-of-racially-ethnically-religiously-and-politically-motivated-attacks-part-ii,"Full Committee Hearing : Domestic Terrorism and Violent Extremism: Examining the Threat of Racially, Ethnically, Religiously, and Politically Motivated Attacks, Part II"
majority,8/10/21,http://www.hsgac.senate.gov/media/majority-media/peters-scott-bipartisan-legislation-to-help-protect-k-12-school-systems-from-cyber-attacks-passes-senate,"Peters, Scott Bipartisan Legislation to Help Protect K-12 School Systems from Cyber-Attacks Passes Senate"
majority,8/5/21,http://www.hsgac.senate.gov/media/majority-media/peters-announces-nearly-35-million-in-security-grants-to-faith-based-and-nonprofit-institutions-across-michigan-,Peters Announces Nearly $3.5 Million in Security Grants to Faith-Based and Nonprofit Institutions Across Michigan
majority,8/5/21,http://www.hsgac.senate.gov/media/majority-media/peters-convenes-second-hearing-examining-actions-needed-to-combat-white-supremacist-and-anti-government-domestic-terrorism-threats,Peters Convenes Second Hearing Examining Actions Needed to Combat White Supremacist and Anti-Government Domestic Terrorism Threats
