category,date,url,title
minority,10/28/21,http://www.hsgac.senate.gov/media/minority-media/expert-witness-agrees-with-portman-that-transparency-and-third-party-review-of-social-media-company-data-necessary-to-inform-evidence-based-policy-solutions,Expert Witness Agrees with Portman that Transparency & Third-Party Review of Social Media Company Data Necessary to Inform Evidence-Based Policy Solutions
majority,10/28/21,http://www.hsgac.senate.gov/media/majority-media/peters-convenes-hearing-with-independent-experts-to-examine-amplification-of-domestic-extremist-content-on-social-media-platforms,Peters Convenes Hearing with Independent Experts to Examine Amplification of Domestic Extremist Content on Social Media Platforms
minority,10/28/21,http://www.hsgac.senate.gov/media/minority-media/portman-social-media-companies-need_to-provide-data-and-transparency-so-congress-can-create-evidence-based-policy,Portman: Social Media Companies Need  to Provide Data & Transparency so Congress Can Create Evidence-Based Policy
minority,10/28/21,http://www.hsgac.senate.gov/media/minority-media/portman-lankford-rounds-request-dhs-oig-review-of-tsas-security-directives-on-cybersecurity,"Portman, Lankford, Rounds Request DHS OIG Review of TSA’s Security Directives on Cybersecurity"
minority,10/27/21,http://www.hsgac.senate.gov/media/minority-media/subcommittee-witness-testimony-supports-portmans-energy-efficiency-and-reform-of-federal-permitting-process-included-in-bipartisan-infrastructure-investment_jobs-act,Subcommittee Witness Testimony Supports Portman’s Energy Efficiency & Reform of Federal Permitting Process Included in Bipartisan Infrastructure Investment & Jobs Act
minority,10/27/21,http://www.hsgac.senate.gov/media/minority-media/portman-house-must-pass-bipartisan-infrastructure-investment-and-jobs-act-to-reform-federal-permitting-process-fix-crumbling-infrastructure_strengthen-us-economy,"Portman: House Must Pass Bipartisan Infrastructure Investment & Jobs Act to Reform Federal Permitting Process, Fix Crumbling Infrastructure & Strengthen U.S. Economy"
minority,10/26/21,http://www.hsgac.senate.gov/media/minority-media/portman-carper-applaud-fcc-decision-to-end-china-telecom-operations-in-us,"Portman, Carper Applaud FCC Decision to End China Telecom Operations in U.S."
majority,10/27/21,http://www.hsgac.senate.gov/media/majority-media/icymi-on-washington-post-live-peters-discusses-efforts-to-address-threat-posed-by-cyber-attacks,"ICYMI: On Washington Post Live, Peters Discusses Efforts to Address Threat Posed by Cyber-Attacks"
