category,date,url,title
hearings,02/03/22,https://www.judiciary.senate.gov/meetings/01/27/2022/executive-business-meeting,Executive Business Meeting
majority,01/26/22,https://www.judiciary.senate.gov/press/dem/releases/durbin-presses-department-of-transportation-auto-industry-to-take-coordinated-action-to-address-carjackings,"Durbin Presses Department of Transportation, Auto Industry to Take Coordinated Action to Address Carjackings"
hearings,02/02/22,https://www.judiciary.senate.gov/meetings/breaking-the-news_journalism-competition-and-the-effects-of-market-power-on-a-free-press,"Breaking the News – Journalism, Competition, and the Effects of Market Power on a Free Press"
hearings,02/01/22,https://www.judiciary.senate.gov/meetings/01/25/2022/nominations,Nominations
majority,01/26/22,https://www.judiciary.senate.gov/press/dem/releases/durbin-statement-on-retirement-of-supreme-court-justice-stephen-breyer,Durbin Statement on Retirement of Supreme Court Justice Stephen Breyer
minority,01/27/22,https://www.judiciary.senate.gov/press/rep/releases/grassley-statement-on-the-retirement-of-justice-breyer,Grassley Statement on the Retirement of Justice Breyer
minority,01/25/22,https://www.judiciary.senate.gov/press/rep/releases/judiciary-republicans-demand-answers-from-state-dhs-and-fbi-on-terrorist-who-attacked-texas-synagogue,"Judiciary Republicans Demand Answers from State, DHS and FBI on Terrorist who Attacked Texas Synagogue"
minority,01/25/22,https://www.judiciary.senate.gov/republican-members-to-fbi_-akram,Republican Members to FBI - Akram
minority,01/25/22,https://www.judiciary.senate.gov/republican-members-to-homeland-security-state-depts_-akram,"Republican Members to Homeland Security, State Depts. - Akram"
